,user_id,status_id,created_at,screen_name,text,source,display_text_width,reply_to_status_id,reply_to_user_id,reply_to_screen_name,is_quote,is_retweet,favorite_count,retweet_count,quote_count,reply_count,hashtags,symbols,urls_url,urls_t.co,urls_expanded_url,media_url,media_t.co,media_expanded_url,media_type,ext_media_url,ext_media_t.co,ext_media_expanded_url,ext_media_type,mentions_user_id,mentions_screen_name,lang,quoted_status_id,quoted_text,quoted_created_at,quoted_source,quoted_favorite_count,quoted_retweet_count,quoted_user_id,quoted_screen_name,quoted_name,quoted_followers_count,quoted_friends_count,quoted_statuses_count,quoted_location,quoted_description,quoted_verified,retweet_status_id,retweet_text,retweet_created_at,retweet_source,retweet_favorite_count,retweet_retweet_count,retweet_user_id,retweet_screen_name,retweet_name,retweet_followers_count,retweet_friends_count,retweet_statuses_count,retweet_location,retweet_description,retweet_verified,place_url,place_name,place_full_name,place_type,country,country_code,geo_coords,coords_coords,bbox_coords,status_url,name,location,description,url,protected,followers_count,friends_count,listed_count,statuses_count,favourites_count,account_created_at,verified,profile_url,profile_expanded_url,account_lang,profile_banner_url,profile_background_url,profile_image_url
1,2191308961,1.45562E+18,1635881430,karenkavana,@Music_BrianMc @POTUS You’re right that transportation needs to transition to clean energy sources + we need to offset our carbon emissions in the meantime. Pres. Biden spent ~30 years commuting on Amtrak trains betw. Delaware and DC so I think he gets the need for better public transport too.,Twitter for iPhone,272,1.4556E+18,1.38859E+18,Music_BrianMc,FALSE,FALSE,0,0,NA,NA,NA,NA,NA,NA,NA,NA,NA,NA,NA,NA,NA,NA,NA,"c(""1388591182691831810"", ""1349149096909668363"")","c(""Music_BrianMc"", ""POTUS"")",en,NA,NA,NA,NA,NA,NA,NA,NA,NA,NA,NA,NA,NA,NA,NA,NA,NA,NA,NA,NA,NA,NA,NA,NA,NA,NA,NA,NA,NA,NA,NA,NA,NA,NA,NA,NA,"c(NA, NA)","c(NA, NA)","c(NA, NA, NA, NA, NA, NA, NA, NA)",https://twitter.com/karenkavana/status/1455618339250876421,Karen Kavanaugh,"Washington, DC","Biology, GIS, and oceanography by day. (pre-covid) concert going by night. **My opinions are my own.**",NA,FALSE,41,300,0,1094,28173,1384302315,FALSE,NA,NA,NA,NA,http://abs.twimg.com/images/themes/theme1/bg.png,http://pbs.twimg.com/profile_images/871123518884372481/Brpf4Ft1_normal.jpg
2,2565954439,1.45561E+18,1635880553,BryanCoxwell,There are Amtrak tickets from DC to NYC that are cheaper than an Uber from Penn Quarter to Union Station right now.,Twitter for iPhone,115,NA,NA,NA,FALSE,FALSE,4,0,NA,NA,NA,NA,NA,NA,NA,NA,NA,NA,NA,NA,NA,NA,NA,NA,NA,en,NA,NA,NA,NA,NA,NA,NA,NA,NA,NA,NA,NA,NA,NA,NA,NA,NA,NA,NA,NA,NA,NA,NA,NA,NA,NA,NA,NA,NA,NA,NA,NA,NA,NA,NA,NA,"c(NA, NA)","c(NA, NA)","c(NA, NA, NA, NA, NA, NA, NA, NA)",https://twitter.com/BryanCoxwell/status/1455614658174464002,Bryan Coxwell,"Washington, DC",@UMich Engineer making things that talk to other things. Former 3rd Batt Ranger.,NA,FALSE,1292,1078,3,2045,15628,1402694684,FALSE,NA,NA,NA,https://pbs.twimg.com/profile_banners/2565954439/1561728763,http://abs.twimg.com/images/themes/theme1/bg.png,http://pbs.twimg.com/profile_images/1149843631307669505/EgTST4Zz_normal.jpg
3,346691526,1.45561E+18,1635879480,constructdive,"In this week's infrastructure newsletter:
<U+0001F686> Amtrak's expansion plan rests with Congress
<U+0001F307> Florida infrastructure gets 'C' grade
<U+0001F6E3><U+FE0F> Lane Construction will build $600M Beltway extension
Not signed up yet? <U+0001F447> https://t.co/uIyBG1PBEx",Buffer,228,NA,NA,NA,FALSE,FALSE,0,0,NA,NA,NA,NA,buff.ly/3G6Au5r,https://t.co/uIyBG1PBEx,https://buff.ly/3G6Au5r,NA,NA,NA,NA,NA,NA,NA,NA,NA,NA,en,NA,NA,NA,NA,NA,NA,NA,NA,NA,NA,NA,NA,NA,NA,NA,NA,NA,NA,NA,NA,NA,NA,NA,NA,NA,NA,NA,NA,NA,NA,NA,NA,NA,NA,NA,NA,"c(NA, NA)","c(NA, NA)","c(NA, NA, NA, NA, NA, NA, NA, NA)",https://twitter.com/constructdive/status/1455610160752349187,Construction Dive,"Washington, DC",We provide business journalism and in-depth insight into the most impactful news and trends shaping construction. Sign up here: https://t.co/aQwUM3fTqY,http://t.co/qQGxS4xFlz,FALSE,27746,2161,539,24767,1416,1312221049,TRUE,http://t.co/qQGxS4xFlz,http://www.constructiondive.com,NA,https://pbs.twimg.com/profile_banners/346691526/1582903444,http://abs.twimg.com/images/themes/theme1/bg.png,http://pbs.twimg.com/profile_images/973900196936601602/-8_NHFd__normal.jpg
4,346691526,1.4556E+18,1635877983,constructdive,Amtrak's hopes of 30 or more new routes and increased service rest with Congress. #rail #infrastructure #construction https://t.co/0bZCzBBVG2 https://t.co/nbzBGk13im,Buffer,141,NA,NA,NA,FALSE,FALSE,0,0,NA,NA,"c(""rail"", ""infrastructure"", ""construction"")",NA,buff.ly/3BGHuTb,https://t.co/0bZCzBBVG2,https://buff.ly/3BGHuTb,http://pbs.twimg.com/media/FDNYA2BX0AcCJm6.jpg,https://t.co/nbzBGk13im,https://twitter.com/constructdive/status/1455603879220031497/photo/1,photo,http://pbs.twimg.com/media/FDNYA2BX0AcCJm6.jpg,https://t.co/nbzBGk13im,https://twitter.com/constructdive/status/1455603879220031497/photo/1,NA,NA,NA,en,NA,NA,NA,NA,NA,NA,NA,NA,NA,NA,NA,NA,NA,NA,NA,NA,NA,NA,NA,NA,NA,NA,NA,NA,NA,NA,NA,NA,NA,NA,NA,NA,NA,NA,NA,NA,"c(NA, NA)","c(NA, NA)","c(NA, NA, NA, NA, NA, NA, NA, NA)",https://twitter.com/constructdive/status/1455603879220031497,Construction Dive,"Washington, DC",We provide business journalism and in-depth insight into the most impactful news and trends shaping construction. Sign up here: https://t.co/aQwUM3fTqY,http://t.co/qQGxS4xFlz,FALSE,27746,2161,539,24767,1416,1312221049,TRUE,http://t.co/qQGxS4xFlz,http://www.constructiondive.com,NA,https://pbs.twimg.com/profile_banners/346691526/1582903444,http://abs.twimg.com/images/themes/theme1/bg.png,http://pbs.twimg.com/profile_images/973900196936601602/-8_NHFd__normal.jpg
5,7.16999E+17,1.45561E+18,1635879429,Ryanfor3F05,@nickburgerdc That would just make everything more expensive tbh. Need to push the cost down of Amtrak in particular as well as speeding it up to wreck the hundreds of intra NEC flights,Twitter for iPhone,171,1.45553E+18,2845611430,nickburgerdc,FALSE,FALSE,0,0,NA,NA,NA,NA,NA,NA,NA,NA,NA,NA,NA,NA,NA,NA,NA,2845611430,nickburgerdc,en,NA,NA,NA,NA,NA,NA,NA,NA,NA,NA,NA,NA,NA,NA,NA,NA,NA,NA,NA,NA,NA,NA,NA,NA,NA,NA,NA,NA,NA,NA,NA,NA,NA,NA,NA,NA,"c(NA, NA)","c(NA, NA)","c(NA, NA, NA, NA, NA, NA, NA, NA)",https://twitter.com/Ryanfor3F05/status/1455609946784030721,Ryan Keefe,District of Columbia,"DC resident. Product of reproductive & labor rights. Tweets about transit, housing, local politics. @ward3vision & @ward3bikes member",NA,FALSE,1104,1167,25,40424,78110,1459780824,FALSE,NA,NA,NA,https://pbs.twimg.com/profile_banners/716998860548214785/1461620635,NA,http://pbs.twimg.com/profile_images/1269126963299581952/XAOqfnqi_normal.jpg
6,7.16999E+17,1.45542E+18,1635833897,Ryanfor3F05,Amtrak being $100 more each way than flying around the holidays up to Boston is very annoying. I want to make more sustainable choices but neither the price nor the time incentivizes it.,Twitter for iPhone,186,NA,NA,NA,FALSE,FALSE,15,0,NA,NA,NA,NA,NA,NA,NA,NA,NA,NA,NA,NA,NA,NA,NA,NA,NA,en,NA,NA,NA,NA,NA,NA,NA,NA,NA,NA,NA,NA,NA,NA,NA,NA,NA,NA,NA,NA,NA,NA,NA,NA,NA,NA,NA,NA,NA,NA,NA,NA,NA,NA,NA,NA,"c(NA, NA)","c(NA, NA)","c(NA, NA, NA, NA, NA, NA, NA, NA)",https://twitter.com/Ryanfor3F05/status/1455418971604328450,Ryan Keefe,District of Columbia,"DC resident. Product of reproductive & labor rights. Tweets about transit, housing, local politics. @ward3vision & @ward3bikes member",NA,FALSE,1104,1167,25,40424,78110,1459780824,FALSE,NA,NA,NA,https://pbs.twimg.com/profile_banners/716998860548214785/1461620635,NA,http://pbs.twimg.com/profile_images/1269126963299581952/XAOqfnqi_normal.jpg
7,408154335,1.4556E+18,1635878154,ShellyLivingsto,Taking @Amtrak so much more civilized <U+0001F970> https://t.co/6YZNowSYRj,Twitter for iPhone,39,NA,NA,NA,TRUE,FALSE,0,0,NA,NA,NA,NA,twitter.com/imjohneli/stat…,https://t.co/6YZNowSYRj,https://twitter.com/imjohneli/status/1455603124207603721,NA,NA,NA,NA,NA,NA,NA,NA,119166791,Amtrak,en,1.4556E+18,"Fly at your own peril.

Canceled flights, packed planes, rising fares and violent outbursts are the new normal for air travel. Flying is getting worse for both passengers and crews.",1635877803,Twitter for iPhone,32,5,1.02102E+18,ImJohnEli,JohnEli,32757,29937,46240,Necker Island,I’m very curious and I will post items that I find provocative and interesting. I WILL FOLLOW YOU BACK!.,FALSE,NA,NA,NA,NA,NA,NA,NA,NA,NA,NA,NA,NA,NA,NA,NA,NA,NA,NA,NA,NA,NA,"c(NA, NA)","c(NA, NA)","c(NA, NA, NA, NA, NA, NA, NA, NA)",https://twitter.com/ShellyLivingsto/status/1455604598845198349,Shelly Livingston,"District of Columbia, USA","Dem activist. Past Chair Planned Parenthood Metropolitan DC Action Fund Board, Gun reform advocate. Ret staff from US House of Reps. TX native #TheResistance",NA,FALSE,5991,6434,8,12211,38116,1320803551,FALSE,NA,NA,NA,https://pbs.twimg.com/profile_banners/408154335/1598046825,http://abs.twimg.com/images/themes/theme1/bg.png,http://pbs.twimg.com/profile_images/821740517264195585/IdyYZ98O_normal.jpg
8,15446531,1.4556E+18,1635877560,mattyglesias,"Then you've got a few normie libs, two ""nominal leftists who hate everything Democrats do,"" plus a guy who likes to complain about Amtrak.",Twitter Web App,138,1.4556E+18,15446531,mattyglesias,FALSE,FALSE,40,0,NA,NA,NA,NA,NA,NA,NA,NA,NA,NA,NA,NA,NA,NA,NA,NA,NA,en,NA,NA,NA,NA,NA,NA,NA,NA,NA,NA,NA,NA,NA,NA,NA,NA,NA,NA,NA,NA,NA,NA,NA,NA,NA,NA,NA,NA,NA,NA,NA,NA,NA,NA,NA,NA,"c(NA, NA)","c(NA, NA)","c(NA, NA, NA, NA, NA, NA, NA, NA)",https://twitter.com/mattyglesias/status/1455602104857399296,Matthew Yglesias,"Washington, DC","Writer and editor, Slow Boring. Senior Fellow, Niskanen Center. Host of The Weeds. Vaxxed and relaxed. These tweets are worth what you pay for them.",https://t.co/MtmM5Urmwm,FALSE,517293,1295,11676,542,31474,1216158268,TRUE,https://t.co/MtmM5Urmwm,https://www.slowboring.com,NA,https://pbs.twimg.com/profile_banners/15446531/1605237927,http://abs.twimg.com/images/themes/theme18/bg.gif,http://pbs.twimg.com/profile_images/1391150331661258752/CYRFnzW-_normal.jpg
9,15446531,1.45531E+18,1635807093,mattyglesias,"This movie captures a fundamental fact of human existence, namely that the men’s rooms at Amtrak stations are sketchy as hell.",Twitter for iPhone,126,1.4553E+18,15446531,mattyglesias,FALSE,FALSE,191,2,NA,NA,NA,NA,NA,NA,NA,NA,NA,NA,NA,NA,NA,NA,NA,NA,NA,en,NA,NA,NA,NA,NA,NA,NA,NA,NA,NA,NA,NA,NA,NA,NA,NA,NA,NA,NA,NA,NA,NA,NA,NA,NA,NA,NA,NA,NA,NA,https://api.twitter.com/1.1/geo/id/01fbe706f872cb32.json,Washington,"Washington, DC",city,United States,US,"c(NA, NA)","c(NA, NA)","c(-77.119401, -76.909396, -76.909396, -77.119401, 38.801826, 38.801826, 38.9953797, 38.9953797)",https://twitter.com/mattyglesias/status/1455306545080807432,Matthew Yglesias,"Washington, DC","Writer and editor, Slow Boring. Senior Fellow, Niskanen Center. Host of The Weeds. Vaxxed and relaxed. These tweets are worth what you pay for them.",https://t.co/MtmM5Urmwm,FALSE,517293,1295,11676,542,31474,1216158268,TRUE,https://t.co/MtmM5Urmwm,https://www.slowboring.com,NA,https://pbs.twimg.com/profile_banners/15446531/1605237927,http://abs.twimg.com/images/themes/theme18/bg.gif,http://pbs.twimg.com/profile_images/1391150331661258752/CYRFnzW-_normal.jpg
10,4590435023,1.4556E+18,1635876900,RailPassengers,"Outstanding @PCoped piece by @theaustinwu on the important role passenger rail plays in many aspects of our lives —  jobs, the environment, equity — and why people in Iowa should be fighting for its return.  

https://t.co/V3WOHiJYu2",TweetDeck,233,NA,NA,NA,FALSE,FALSE,1,0,NA,NA,NA,NA,press-citizen.com/story/opinion/…,https://t.co/V3WOHiJYu2,https://www.press-citizen.com/story/opinion/2021/11/02/opinion-iowans-should-all-rallying-return-rail-routes-austin-wu-amtrak-transportation/6234716001/,NA,NA,NA,NA,NA,NA,NA,NA,"c(""2329257451"", ""820148516"")","c(""PCoped"", ""theaustinwu"")",en,NA,NA,NA,NA,NA,NA,NA,NA,NA,NA,NA,NA,NA,NA,NA,NA,NA,NA,NA,NA,NA,NA,NA,NA,NA,NA,NA,NA,NA,NA,NA,NA,NA,NA,NA,NA,"c(NA, NA)","c(NA, NA)","c(NA, NA, NA, NA, NA, NA, NA, NA)",https://twitter.com/RailPassengers/status/1455599336646066177,Rail Passengers Association,"Washington, DC",Rail Passengers showcases the connectivity that the National Network & other vital public transit services bring to travelers throughout the U.S. #TrainTwitter,https://t.co/bR6izAf6mw,FALSE,5689,361,88,5555,2025,1450970355,FALSE,https://t.co/bR6izAf6mw,http://www.railpassengers.org/action,NA,https://pbs.twimg.com/profile_banners/4590435023/1604697040,http://abs.twimg.com/images/themes/theme1/bg.png,http://pbs.twimg.com/profile_images/1168862201190473728/NT8S9TkA_normal.jpg
11,4590435023,1.45375E+18,1635435900,RailPassengers,". @Amtrak is finally acknowledging publicly something it has been grappling with internally for several months: there aren’t enough staff to run the trains, and more may be leaving the railroad. 

Written by our President &amp; CEO Jim Mathews.

https://t.co/xBN2xnNme1",TweetDeck,269,NA,NA,NA,FALSE,FALSE,21,11,NA,NA,NA,NA,railpassengers.org/happening-now/…,https://t.co/xBN2xnNme1,https://www.railpassengers.org/happening-now/news/blog/who-runs-the-trains-when-they-quit/,NA,NA,NA,NA,NA,NA,NA,NA,119166791,Amtrak,en,NA,NA,NA,NA,NA,NA,NA,NA,NA,NA,NA,NA,NA,NA,NA,NA,NA,NA,NA,NA,NA,NA,NA,NA,NA,NA,NA,NA,NA,NA,NA,NA,NA,NA,NA,NA,"c(NA, NA)","c(NA, NA)","c(NA, NA, NA, NA, NA, NA, NA, NA)",https://twitter.com/RailPassengers/status/1453749648644919299,Rail Passengers Association,"Washington, DC",Rail Passengers showcases the connectivity that the National Network & other vital public transit services bring to travelers throughout the U.S. #TrainTwitter,https://t.co/bR6izAf6mw,FALSE,5689,361,88,5555,2025,1450970355,FALSE,https://t.co/bR6izAf6mw,http://www.railpassengers.org/action,NA,https://pbs.twimg.com/profile_banners/4590435023/1604697040,http://abs.twimg.com/images/themes/theme1/bg.png,http://pbs.twimg.com/profile_images/1168862201190473728/NT8S9TkA_normal.jpg
12,4590435023,1.4538E+18,1635448500,RailPassengers,"President Biden Joins in Portal North Bridge Groundbreaking Ceremony.  @RailwayAge @Amtrak @POTUS #Gateway 

https://t.co/FBtHlbypOB",TweetDeck,132,NA,NA,NA,FALSE,FALSE,6,2,NA,NA,Gateway,NA,railwayage.com/mw/president-b…,https://t.co/FBtHlbypOB,https://www.railwayage.com/mw/president-biden-joins-in-portal-north-bridge-groundbreaking-ceremony/?RAchannel=mw,NA,NA,NA,NA,NA,NA,NA,NA,"c(""253266249"", ""119166791"", ""1349149096909668363"")","c(""RailwayAge"", ""Amtrak"", ""POTUS"")",en,NA,NA,NA,NA,NA,NA,NA,NA,NA,NA,NA,NA,NA,NA,NA,NA,NA,NA,NA,NA,NA,NA,NA,NA,NA,NA,NA,NA,NA,NA,NA,NA,NA,NA,NA,NA,"c(NA, NA)","c(NA, NA)","c(NA, NA, NA, NA, NA, NA, NA, NA)",https://twitter.com/RailPassengers/status/1453802496699224064,Rail Passengers Association,"Washington, DC",Rail Passengers showcases the connectivity that the National Network & other vital public transit services bring to travelers throughout the U.S. #TrainTwitter,https://t.co/bR6izAf6mw,FALSE,5689,361,88,5555,2025,1450970355,FALSE,https://t.co/bR6izAf6mw,http://www.railpassengers.org/action,NA,https://pbs.twimg.com/profile_banners/4590435023/1604697040,http://abs.twimg.com/images/themes/theme1/bg.png,http://pbs.twimg.com/profile_images/1168862201190473728/NT8S9TkA_normal.jpg
13,4590435023,1.45311E+18,1635282900,RailPassengers,"Upgrades to @Amtrak’s Texas routes may be arriving soon. @keranews @TexasStandard @RailwayAge

https://t.co/AF0XnyUveg",TweetDeck,118,NA,NA,NA,FALSE,FALSE,11,2,NA,NA,NA,NA,keranews.org/texas-news/202…,https://t.co/AF0XnyUveg,https://www.keranews.org/texas-news/2021-10-26/upgrades-to-amtraks-texas-routes-may-be-arriving-soon,NA,NA,NA,NA,NA,NA,NA,NA,"c(""119166791"", ""529663026"", ""2533104750"", ""253266249"")","c(""Amtrak"", ""keranews"", ""TexasStandard"", ""RailwayAge"")",en,NA,NA,NA,NA,NA,NA,NA,NA,NA,NA,NA,NA,NA,NA,NA,NA,NA,NA,NA,NA,NA,NA,NA,NA,NA,NA,NA,NA,NA,NA,NA,NA,NA,NA,NA,NA,"c(NA, NA)","c(NA, NA)","c(NA, NA, NA, NA, NA, NA, NA, NA)",https://twitter.com/RailPassengers/status/1453107920007278605,Rail Passengers Association,"Washington, DC",Rail Passengers showcases the connectivity that the National Network & other vital public transit services bring to travelers throughout the U.S. #TrainTwitter,https://t.co/bR6izAf6mw,FALSE,5689,361,88,5555,2025,1450970355,FALSE,https://t.co/bR6izAf6mw,http://www.railpassengers.org/action,NA,https://pbs.twimg.com/profile_banners/4590435023/1604697040,http://abs.twimg.com/images/themes/theme1/bg.png,http://pbs.twimg.com/profile_images/1168862201190473728/NT8S9TkA_normal.jpg
14,4590435023,1.45344E+18,1635361406,RailPassengers,"3/ Parties to this investigation include the @USDOTFRA,@Amtrak, @BNSFRailway, @BMWEDIBT, @smartunionworks, &amp; the Brotherhood of Locomotive Engineers and Trainmen (BLET)",Twitter Web App,172,1.45344E+18,4590435023,RailPassengers,FALSE,FALSE,3,2,NA,NA,NA,NA,NA,NA,NA,NA,NA,NA,NA,NA,NA,NA,NA,"c(""556051103"", ""119166791"", ""53417856"", ""493524476"", ""16899221"")","c(""USDOTFRA"", ""Amtrak"", ""BNSFRailway"", ""BMWEDIBT"", ""smartunionworks"")",en,NA,NA,NA,NA,NA,NA,NA,NA,NA,NA,NA,NA,NA,NA,NA,NA,NA,NA,NA,NA,NA,NA,NA,NA,NA,NA,NA,NA,NA,NA,NA,NA,NA,NA,NA,NA,"c(NA, NA)","c(NA, NA)","c(NA, NA, NA, NA, NA, NA, NA, NA)",https://twitter.com/RailPassengers/status/1453437198389452809,Rail Passengers Association,"Washington, DC",Rail Passengers showcases the connectivity that the National Network & other vital public transit services bring to travelers throughout the U.S. #TrainTwitter,https://t.co/bR6izAf6mw,FALSE,5689,361,88,5555,2025,1450970355,FALSE,https://t.co/bR6izAf6mw,http://www.railpassengers.org/action,NA,https://pbs.twimg.com/profile_banners/4590435023/1604697040,http://abs.twimg.com/images/themes/theme1/bg.png,http://pbs.twimg.com/profile_images/1168862201190473728/NT8S9TkA_normal.jpg
15,4590435023,1.45556E+18,1635866799,RailPassengers,". @Amtrak Debuts New Ticket Kiosks with National Rollout - @METROmagTweet

https://t.co/30Lc8CcinQ",TweetDeck,98,NA,NA,NA,FALSE,FALSE,5,2,NA,NA,NA,NA,metro-magazine.com/10155138/amtra…,https://t.co/30Lc8CcinQ,https://www.metro-magazine.com/10155138/amtrak-debuts-new-ticket-kiosks-with-national-rollout,NA,NA,NA,NA,NA,NA,NA,NA,"c(""119166791"", ""205919296"")","c(""Amtrak"", ""METROmagTweet"")",en,NA,NA,NA,NA,NA,NA,NA,NA,NA,NA,NA,NA,NA,NA,NA,NA,NA,NA,NA,NA,NA,NA,NA,NA,NA,NA,NA,NA,NA,NA,NA,NA,NA,NA,NA,NA,"c(NA, NA)","c(NA, NA)","c(NA, NA, NA, NA, NA, NA, NA, NA)",https://twitter.com/RailPassengers/status/1455556972342882316,Rail Passengers Association,"Washington, DC",Rail Passengers showcases the connectivity that the National Network & other vital public transit services bring to travelers throughout the U.S. #TrainTwitter,https://t.co/bR6izAf6mw,FALSE,5689,361,88,5555,2025,1450970355,FALSE,https://t.co/bR6izAf6mw,http://www.railpassengers.org/action,NA,https://pbs.twimg.com/profile_banners/4590435023/1604697040,http://abs.twimg.com/images/themes/theme1/bg.png,http://pbs.twimg.com/profile_images/1168862201190473728/NT8S9TkA_normal.jpg
16,4590435023,1.45344E+18,1635362886,RailPassengers,"The Rail Passengers Assoc. is proud to endorse this Act on behalf of the millions of passengers around the country.  You can read the full press release in the link below, which includes a quote from our President &amp; CEO Jim Mathews.

https://t.co/ExlIO3GwLv https://t.co/3VwOjegMRw",Twitter Web App,261,NA,NA,NA,TRUE,FALSE,9,4,NA,NA,NA,NA,"c(""blumenthal.senate.gov/newsroom/press…"", ""twitter.com/SenBlumenthal/…"")","c(""https://t.co/ExlIO3GwLv"", ""https://t.co/3VwOjegMRw"")","c(""https://www.blumenthal.senate.gov/newsroom/press/release/blumenthal-and-lamb-lead-introduction-of-legislation-to-restore-amtrak-riders-legal-rights_protections"", ""https://twitter.com/SenBlumenthal/status/1453414488938590208"")",NA,NA,NA,NA,NA,NA,NA,NA,NA,NA,en,1.45341E+18,Train passengers are often unaware they’ve signed away their legal rights with the purchase of a ticket until the worst happens. The Ending Passenger Rail Forced Arbitration Act will restore vital legal rights to the travelers who are injured on Amtrak trains &amp; seek just redress.,1635355991,Twitter Web App,145,37,278124059,SenBlumenthal,Richard Blumenthal,719846,989,16783,"Connecticut, USA","Official Twitter account of U.S. Senator Richard Blumenthal, proudly working for the people of Connecticut.",TRUE,NA,NA,NA,NA,NA,NA,NA,NA,NA,NA,NA,NA,NA,NA,NA,NA,NA,NA,NA,NA,NA,"c(NA, NA)","c(NA, NA)","c(NA, NA, NA, NA, NA, NA, NA, NA)",https://twitter.com/RailPassengers/status/1453443408194899978,Rail Passengers Association,"Washington, DC",Rail Passengers showcases the connectivity that the National Network & other vital public transit services bring to travelers throughout the U.S. #TrainTwitter,https://t.co/bR6izAf6mw,FALSE,5689,361,88,5555,2025,1450970355,FALSE,https://t.co/bR6izAf6mw,http://www.railpassengers.org/action,NA,https://pbs.twimg.com/profile_banners/4590435023/1604697040,http://abs.twimg.com/images/themes/theme1/bg.png,http://pbs.twimg.com/profile_images/1168862201190473728/NT8S9TkA_normal.jpg
17,4590435023,1.45302E+18,1635262200,RailPassengers,"The groundbreaking ceremony for the Baltimore Penn Station Redevelopment Project was held last Friday.  @Amtrak @MassTransitmag

https://t.co/uS177glQfg",TweetDeck,152,NA,NA,NA,FALSE,FALSE,8,2,NA,NA,NA,NA,masstransitmag.com/technology/fac…,https://t.co/uS177glQfg,https://www.masstransitmag.com/technology/facilities/article/21243747/baltimore-penn-station-redevelopment-project-breaks-ground,NA,NA,NA,NA,NA,NA,NA,NA,"c(""119166791"", ""69011444"")","c(""Amtrak"", ""MassTransitmag"")",en,NA,NA,NA,NA,NA,NA,NA,NA,NA,NA,NA,NA,NA,NA,NA,NA,NA,NA,NA,NA,NA,NA,NA,NA,NA,NA,NA,NA,NA,NA,NA,NA,NA,NA,NA,NA,"c(NA, NA)","c(NA, NA)","c(NA, NA, NA, NA, NA, NA, NA, NA)",https://twitter.com/RailPassengers/status/1453021098082279432,Rail Passengers Association,"Washington, DC",Rail Passengers showcases the connectivity that the National Network & other vital public transit services bring to travelers throughout the U.S. #TrainTwitter,https://t.co/bR6izAf6mw,FALSE,5689,361,88,5555,2025,1450970355,FALSE,https://t.co/bR6izAf6mw,http://www.railpassengers.org/action,NA,https://pbs.twimg.com/profile_banners/4590435023/1604697040,http://abs.twimg.com/images/themes/theme1/bg.png,http://pbs.twimg.com/profile_images/1168862201190473728/NT8S9TkA_normal.jpg
18,194553939,1.45556E+18,1635868415,RAILMag,"@Gok @ericgoldwyn I mean none of these routes are listed in the bill at all, let alone decision-making guidelines. AmtrakConnect is not a thing that exists formally other than an Amtrak PR effort so far. But its likely you'll see some number of those routes materialize with that funding.",Twitter Web App,270,1.45556E+18,777733,Gok,FALSE,FALSE,0,0,NA,NA,NA,NA,NA,NA,NA,NA,NA,NA,NA,NA,NA,NA,NA,"c(""777733"", ""179092541"")","c(""Gok"", ""ericgoldwyn"")",en,NA,NA,NA,NA,NA,NA,NA,NA,NA,NA,NA,NA,NA,NA,NA,NA,NA,NA,NA,NA,NA,NA,NA,NA,NA,NA,NA,NA,NA,NA,NA,NA,NA,NA,NA,NA,"c(NA, NA)","c(NA, NA)","c(NA, NA, NA, NA, NA, NA, NA, NA)",https://twitter.com/RAILMag/status/1455563749100822539,RAIL Magazine,"Washington, DC",The most extensive coverage of North American passenger rail on Twitter,https://t.co/LDFK0ke7Dh,FALSE,17532,4851,471,36224,25746,1285331445,FALSE,https://t.co/LDFK0ke7Dh,http://www.railmagazine.org,NA,https://pbs.twimg.com/profile_banners/194553939/1540934349,http://abs.twimg.com/images/themes/theme1/bg.png,http://pbs.twimg.com/profile_images/1130240233/rbox_normal.jpg
19,194553939,1.45559E+18,1635874779,RAILMag,"@Jeff_CCTuba Rail funding totaling $66B, mostly going to Amtrak/passenger rail, were in the BIF/infrastructure bill already passed by the Senate, along with 5 years of transit funding. Another $10B for HSR specifically is (so far) is in the reconciliation bill, along with some other transit $",Twitter for iPhone,280,1.45559E+18,1330275962,Jeff_CCTuba,FALSE,FALSE,1,0,NA,NA,NA,NA,NA,NA,NA,NA,NA,NA,NA,NA,NA,NA,NA,1330275962,Jeff_CCTuba,en,NA,NA,NA,NA,NA,NA,NA,NA,NA,NA,NA,NA,NA,NA,NA,NA,NA,NA,NA,NA,NA,NA,NA,NA,NA,NA,NA,NA,NA,NA,NA,NA,NA,NA,NA,NA,"c(NA, NA)","c(NA, NA)","c(NA, NA, NA, NA, NA, NA, NA, NA)",https://twitter.com/RAILMag/status/1455590440959369217,RAIL Magazine,"Washington, DC",The most extensive coverage of North American passenger rail on Twitter,https://t.co/LDFK0ke7Dh,FALSE,17532,4851,471,36224,25746,1285331445,FALSE,https://t.co/LDFK0ke7Dh,http://www.railmagazine.org,NA,https://pbs.twimg.com/profile_banners/194553939/1540934349,http://abs.twimg.com/images/themes/theme1/bg.png,http://pbs.twimg.com/profile_images/1130240233/rbox_normal.jpg
