175,2996516074,1.45412E+18,1635524008,V4DC2,@SenatorTester DC requires #DCstatehood to free DC to support new &gt;750mi (so traditionally Feds liberal donor state US tax $ subsidized) @Amtrak line from Bend OR-Eugene OR-Seattle WA-SandPoint ID-Missoula &amp; MT to build high speed rail &amp; help build ski &amp; mountain biking tourism resorts eastward,Twitter for iPad,295,1.45411E+18,515822213,SenatorTester,FALSE,FALSE,0,0,NA,NA,DCstatehood,NA,NA,NA,NA,NA,NA,NA,NA,NA,NA,NA,NA,"c(""515822213"", ""119166791"")","c(""SenatorTester"", ""Amtrak"")",en,NA,NA,NA,NA,NA,NA,NA,NA,NA,NA,NA,NA,NA,NA,NA,NA,NA,NA,NA,NA,NA,NA,NA,NA,NA,NA,NA,NA,NA,NA,NA,NA,NA,NA,NA,NA,"c(NA, NA)","c(NA, NA)","c(NA, NA, NA, NA, NA, NA, NA, NA)",https://twitter.com/V4DC2/status/1454119201006817290,v4dc2 - DC statehood News,Washington DC,"#DCstatehood #DCstatehoodNews service, seeking to end ongoing JimCrow tyranny over DC which forbids all actual legislature elections in DC, Federal,state,&local",https://t.co/SoPRkaBTEY,FALSE,2358,4982,47,82745,42281,1422130782,FALSE,https://t.co/SoPRkaBTEY,https://www.facebook.com/v4dc2/,NA,https://pbs.twimg.com/profile_banners/2996516074/1422196207,http://abs.twimg.com/images/themes/theme1/bg.png,http://pbs.twimg.com/profile_images/559357331599679488/LKwA3Prq_normal.png
176,7.75833E+17,1.45449E+18,1635612189,JackduORleans,"@hpmacd It's Amtrak, you can't get through that ordeal without booze",Twitter for Android,60,1.45447E+18,3815616209,hpmacd,FALSE,FALSE,1,0,NA,NA,NA,NA,NA,NA,NA,NA,NA,NA,NA,NA,NA,NA,NA,3815616209,hpmacd,en,NA,NA,NA,NA,NA,NA,NA,NA,NA,NA,NA,NA,NA,NA,NA,NA,NA,NA,NA,NA,NA,NA,NA,NA,NA,NA,NA,NA,NA,NA,NA,NA,NA,NA,NA,NA,"c(NA, NA)","c(NA, NA)","c(NA, NA, NA, NA, NA, NA, NA, NA)",https://twitter.com/JackduORleans/status/1454489061280858117,"JackOrleans, oceans interactive's great flop","Washington, USA","Hiya I'm jack. Washington state, I love our evergreens and mountains.",NA,FALSE,154,819,3,27757,25316,1473808049,FALSE,NA,NA,NA,https://pbs.twimg.com/profile_banners/775833306692595712/1473808558,NA,http://pbs.twimg.com/profile_images/1448843539987709952/dUGkwgEq_normal.jpg
177,17919393,1.45449E+18,1635611468,W7VOA,"Three people dead after @Amtrak train, carrying 500 passengers, strikes a car in #SouthCarolina. https://t.co/W98x6bU8S1",Twitter Web App,120,NA,NA,NA,FALSE,FALSE,8,5,NA,NA,SouthCarolina,NA,live5news.com/2021/10/30/3-d…,https://t.co/W98x6bU8S1,https://www.live5news.com/2021/10/30/3-dead-1-injured-after-amtrak-train-strikes-car-north-charleston/,NA,NA,NA,NA,NA,NA,NA,NA,119166791,Amtrak,en,NA,NA,NA,NA,NA,NA,NA,NA,NA,NA,NA,NA,NA,NA,NA,NA,NA,NA,NA,NA,NA,NA,NA,NA,NA,NA,NA,NA,NA,NA,NA,NA,NA,NA,NA,NA,"c(NA, NA)","c(NA, NA)","c(NA, NA, NA, NA, NA, NA, NA, NA)",https://twitter.com/W7VOA/status/1454486034696245253,Steve Herman,"Washington, DC ","@VOANews. Member @aaja, @NBSAERho, @opcofamerica, @pressclubdc, @sajahq, @sejorg, @whca. Broadcast VP @aajadc. Governing Board @afsatweets.",https://t.co/ofLYqmmCSu,FALSE,108430,1991,4133,157085,8500,1228553805,TRUE,https://t.co/ofLYqmmCSu,https://www.steveherman.press,NA,https://pbs.twimg.com/profile_banners/17919393/1617765538,http://abs.twimg.com/images/themes/theme9/bg.gif,http://pbs.twimg.com/profile_images/1325994854443347968/Ji5PcGKV_normal.jpg
178,256169419,1.45442E+18,1635596111,Yael_Shafritz,"It's 8 am on a Saturday and:
- I watched a beautiful post rain sunrise as I biked through DC
- I secured my bike on the Amtrak to take it to NYC with me
- Arsenal are two nil up

It's objectively a beautiful morning

P.S. I love trains and bikes",Twitter for Android,245,NA,NA,NA,FALSE,FALSE,17,0,NA,NA,NA,NA,NA,NA,NA,NA,NA,NA,NA,NA,NA,NA,NA,NA,NA,en,NA,NA,NA,NA,NA,NA,NA,NA,NA,NA,NA,NA,NA,NA,NA,NA,NA,NA,NA,NA,NA,NA,NA,NA,NA,NA,NA,NA,NA,NA,NA,NA,NA,NA,NA,NA,"c(NA, NA)","c(NA, NA)","c(NA, NA, NA, NA, NA, NA, NA, NA)",https://twitter.com/Yael_Shafritz/status/1454421624468430855,Yael Shafritz,Washington DC,"Londoner and Gooner in DC.
The worse things get the less I tweet about politics and the more I tweet about football.
Organising with @DCJWJ",NA,FALSE,2702,2306,34,14926,7463,1298405653,FALSE,NA,NA,NA,https://pbs.twimg.com/profile_banners/256169419/1575473115,http://abs.twimg.com/images/themes/theme12/bg.gif,http://pbs.twimg.com/profile_images/1427396084855361536/I4U_eqqa_normal.jpg
179,1.06871E+18,1.45429E+18,1635564149,SpiritualLifeC2,@sayitnspinit They were on an Amtrak right...,Twitter for Android,31,1.45416E+18,7.8164E+17,sayitnspinit,FALSE,FALSE,0,0,NA,NA,NA,NA,NA,NA,NA,NA,NA,NA,NA,NA,NA,NA,NA,7.8164E+17,sayitnspinit,en,NA,NA,NA,NA,NA,NA,NA,NA,NA,NA,NA,NA,NA,NA,NA,NA,NA,NA,NA,NA,NA,NA,NA,NA,NA,NA,NA,NA,NA,NA,NA,NA,NA,NA,NA,NA,"c(NA, NA)","c(NA, NA)","c(NA, NA, NA, NA, NA, NA, NA, NA)",https://twitter.com/SpiritualLifeC2/status/1454287563905277956,Here to Help,"Frederick, MD","Saint who sins. Experienced Husband, Dad, Grandad, Pastor, Teacher, Missionary, Coach, Writer, Speaker. Chronic Disease and Pain as Increased my Empathy.",NA,FALSE,760,2157,2,22613,27894,1543635604,FALSE,NA,NA,NA,NA,NA,http://pbs.twimg.com/profile_images/1068711984156295168/ArL81fQ6_normal.jpg
180,30407984,1.45428E+18,1635561730,danielmwarwick,@alex_block They have a free bus to the Santa Clara Amtrak station which is nice. The station has a small railroad museum,Twitter for Android,109,1.45424E+18,130149985,alex_block,FALSE,FALSE,0,0,NA,NA,NA,NA,NA,NA,NA,NA,NA,NA,NA,NA,NA,NA,NA,130149985,alex_block,en,NA,NA,NA,NA,NA,NA,NA,NA,NA,NA,NA,NA,NA,NA,NA,NA,NA,NA,NA,NA,NA,NA,NA,NA,NA,NA,NA,NA,NA,NA,NA,NA,NA,NA,NA,NA,"c(NA, NA)","c(NA, NA)","c(NA, NA, NA, NA, NA, NA, NA, NA)",https://twitter.com/danielmwarwick/status/1454277417695170567,Daniel Warwick,"Washington, DC",No longer an ANC Commissioner who knows FAR too much about the Gas Station Advisory Board and the difference between cellar & basement; the crankiest subtweeter,NA,FALSE,1354,1810,55,21978,13512,1239428752,FALSE,NA,NA,NA,NA,http://abs.twimg.com/images/themes/theme1/bg.png,http://pbs.twimg.com/profile_images/1120439176653103104/J8UJngDX_normal.png
181,38865681,1.45427E+18,1635559030,mzeltakalns,@its_Xopher @Amtrak https://t.co/z1UIZaMnn5,Twitter for iPhone,0,1.45426E+18,8.08323E+17,its_Xopher,FALSE,FALSE,0,0,NA,NA,NA,NA,NA,NA,NA,http://pbs.twimg.com/tweet_video_thumb/FC6XTaZWEAQde-8.jpg,https://t.co/z1UIZaMnn5,https://twitter.com/mzeltakalns/status/1454266095586656266/photo/1,photo,http://pbs.twimg.com/tweet_video_thumb/FC6XTaZWEAQde-8.jpg,https://t.co/z1UIZaMnn5,https://twitter.com/mzeltakalns/status/1454266095586656266/photo/1,NA,"c(""808322616473878528"", ""119166791"")","c(""its_Xopher"", ""Amtrak"")",und,NA,NA,NA,NA,NA,NA,NA,NA,NA,NA,NA,NA,NA,NA,NA,NA,NA,NA,NA,NA,NA,NA,NA,NA,NA,NA,NA,NA,NA,NA,NA,NA,NA,NA,NA,NA,"c(NA, NA)","c(NA, NA)","c(NA, NA, NA, NA, NA, NA, NA, NA)",https://twitter.com/mzeltakalns/status/1454266095586656266,mbz,"Washington, DC USA","At a party, on the floor, playing with the dog.",NA,FALSE,142,1232,0,440,1958,1241881086,FALSE,NA,NA,NA,https://pbs.twimg.com/profile_banners/38865681/1487262001,http://abs.twimg.com/images/themes/theme1/bg.png,http://pbs.twimg.com/profile_images/1335806450610786304/R1Fsrdvn_normal.jpg
182,2392927858,1.45426E+18,1635558205,terpswag,@its_Xopher @Amtrak https://t.co/CJ5dz1JIJ3,Twitter for iPhone,0,1.45426E+18,8.08323E+17,its_Xopher,FALSE,FALSE,1,0,NA,NA,NA,NA,NA,NA,NA,http://pbs.twimg.com/tweet_video_thumb/FC6UJ-xXMAQBkx8.jpg,https://t.co/CJ5dz1JIJ3,https://twitter.com/terpswag/status/1454262635319398400/photo/1,photo,http://pbs.twimg.com/tweet_video_thumb/FC6UJ-xXMAQBkx8.jpg,https://t.co/CJ5dz1JIJ3,https://twitter.com/terpswag/status/1454262635319398400/photo/1,NA,"c(""808322616473878528"", ""119166791"")","c(""its_Xopher"", ""Amtrak"")",und,NA,NA,NA,NA,NA,NA,NA,NA,NA,NA,NA,NA,NA,NA,NA,NA,NA,NA,NA,NA,NA,NA,NA,NA,NA,NA,NA,NA,NA,NA,NA,NA,NA,NA,NA,NA,"c(NA, NA)","c(NA, NA)","c(NA, NA, NA, NA, NA, NA, NA, NA)",https://twitter.com/terpswag/status/1454262635319398400,Rich,"Washington, DC","I’m not exactly sure what I’m doing, but I’m on the clock for it so <U+0001F937><U+0001F3FD><U+200D><U+2642><U+FE0F>| Figuring it out as I go | Venmo @terpswag - CashApp $terpswag",NA,FALSE,1041,3632,7,31789,372977,1394255199,FALSE,NA,NA,NA,https://pbs.twimg.com/profile_banners/2392927858/1632363490,http://abs.twimg.com/images/themes/theme1/bg.png,http://pbs.twimg.com/profile_images/1243278918192435200/_XZFzFgn_normal.jpg
183,248384711,1.45426E+18,1635558198,MarsCove,@its_Xopher @Amtrak That looks so good! I need to get me one of those,Twitter for iPhone,49,1.45426E+18,8.08323E+17,its_Xopher,FALSE,FALSE,0,0,NA,NA,NA,NA,NA,NA,NA,NA,NA,NA,NA,NA,NA,NA,NA,"c(""808322616473878528"", ""119166791"")","c(""its_Xopher"", ""Amtrak"")",en,NA,NA,NA,NA,NA,NA,NA,NA,NA,NA,NA,NA,NA,NA,NA,NA,NA,NA,NA,NA,NA,NA,NA,NA,NA,NA,NA,NA,NA,NA,NA,NA,NA,NA,NA,NA,"c(NA, NA)","c(NA, NA)","c(NA, NA, NA, NA, NA, NA, NA, NA)",https://twitter.com/MarsCove/status/1454262604533207043,Mario Moreno,"Arlington, VA",This is the world as best as I can remember it | <U+0001F1F2><U+0001F1FD><U+0001F1FA><U+0001F1F8><U+0001F3F3><U+FE0F><U+200D><U+0001F308> | Georgetown Linguistics | he/him,https://t.co/3wUAz2BHEg,FALSE,184,785,0,2141,14694,1297029822,FALSE,https://t.co/3wUAz2BHEg,http://instagram.com/mars.cove,NA,https://pbs.twimg.com/profile_banners/248384711/1596910007,http://abs.twimg.com/images/themes/theme6/bg.gif,http://pbs.twimg.com/profile_images/1418011161702936579/D36gSuLC_normal.jpg
184,8.08323E+17,1.45426E+18,1635557948,its_Xopher,My new @Amtrak hoodie just arrived and it’s comfy af. You don’t understand - I’m obsessed <U+0001F60D> https://t.co/hEoL8aYqtT,Twitter for iPhone,91,NA,NA,NA,FALSE,FALSE,56,1,NA,NA,NA,NA,NA,NA,NA,http://pbs.twimg.com/media/FC6TLVTXIAgER70.jpg,https://t.co/hEoL8aYqtT,https://twitter.com/its_Xopher/status/1454261556334706688/photo/1,photo,http://pbs.twimg.com/media/FC6TLVTXIAgER70.jpg,https://t.co/hEoL8aYqtT,https://twitter.com/its_Xopher/status/1454261556334706688/photo/1,NA,119166791,Amtrak,en,NA,NA,NA,NA,NA,NA,NA,NA,NA,NA,NA,NA,NA,NA,NA,NA,NA,NA,NA,NA,NA,NA,NA,NA,NA,NA,NA,NA,NA,NA,NA,NA,NA,NA,NA,NA,"c(NA, NA)","c(NA, NA)","c(NA, NA, NA, NA, NA, NA, NA, NA)",https://twitter.com/its_Xopher/status/1454261556334706688,christopher,"Washington, DC","Washingtonian. Engineer. Tweets about leftist politics, urban planning, transit, and other things. <U+0001F3F3><U+FE0F><U+200D><U+0001F308> He/Him. #DCStatehood",NA,FALSE,1011,459,4,3696,10090,1481554104,FALSE,NA,NA,NA,https://pbs.twimg.com/profile_banners/808322616473878528/1584420820,NA,http://pbs.twimg.com/profile_images/1408203109256634371/-8T0P_gU_normal.jpg
185,51659154,1.45424E+18,1635553744,ByERussell,"A 3-4 mile automated people mover between San Jose’s Diridon Station and SJC Airport? I don’t actually hate it, considering Diridon will be a hub of Caltrain, BART, ACE, Amtrak, and California HSR. https://t.co/XkbBZLZLin",Twitter for iPhone,197,NA,NA,NA,TRUE,FALSE,12,2,NA,NA,NA,NA,twitter.com/KO6YQ/status/1…,https://t.co/XkbBZLZLin,https://twitter.com/KO6YQ/status/1454241441597714432,NA,NA,NA,NA,NA,NA,NA,NA,NA,NA,en,1.45424E+18,"City of #SanJose started new phase of contractor solicitations for automated guideway #transit project between SJC Airport &amp; downtown San Jose train station (Caltrain/Amtrak/ACE now, BART in 2030, CA high speed rail in ?) https://t.co/otXKnJIqeg #travel #SanJose https://t.co/ggZl1sfFdr",1635553152,Twitter Web App,9,5,161588737,KO6YQ,Ian Kluft,515,107,18488,"San Jose, California","Software Engineer, cybersecurity/CSSLP, pilot/CFI, Libertarian, electronics geek, Ham, rocket/balloon tracker. This acct tech/net/comms/local; see also @ikluft",FALSE,NA,NA,NA,NA,NA,NA,NA,NA,NA,NA,NA,NA,NA,NA,NA,NA,NA,NA,NA,NA,NA,"c(NA, NA)","c(NA, NA)","c(NA, NA, NA, NA, NA, NA, NA, NA)",https://twitter.com/ByERussell/status/1454243924915150852,Edward Russell,DC,"Airlines at @skift and @airline_weekly. Former @thepointsguy, @FlightGlobal, @FinanceAsia. Runner, cyclist, transit and cities. Opinions my own. He/him.",https://t.co/atUMd7mfFD,FALSE,12145,1143,411,87923,55868,1246166671,FALSE,https://t.co/atUMd7mfFD,https://skift.com/author/edward-russell/,NA,https://pbs.twimg.com/profile_banners/51659154/1628774877,http://abs.twimg.com/images/themes/theme15/bg.png,http://pbs.twimg.com/profile_images/933299460997750785/eXrTyv4e_normal.jpg
186,45992465,1.45423E+18,1635550021,tmthomasdc,Someone is trimming their nails on this Amtrak car. Why. Why are people.,Twitter for iPhone,72,NA,NA,NA,FALSE,FALSE,4,0,NA,NA,NA,NA,NA,NA,NA,NA,NA,NA,NA,NA,NA,NA,NA,NA,NA,en,NA,NA,NA,NA,NA,NA,NA,NA,NA,NA,NA,NA,NA,NA,NA,NA,NA,NA,NA,NA,NA,NA,NA,NA,NA,NA,NA,NA,NA,NA,NA,NA,NA,NA,NA,NA,"c(NA, NA)","c(NA, NA)","c(NA, NA, NA, NA, NA, NA, NA, NA)",https://twitter.com/tmthomasdc/status/1454228309538217986,"Taylor Miller Thomas, but spooky <U+0001F47B><U+0001F383>","Washington, DC","Work: @PoliticoPro Special Projects Editor, Data & Graphics | Elsewhere: restocking my craft cart",NA,FALSE,1139,4622,37,12714,19664,1244594409,FALSE,NA,NA,NA,https://pbs.twimg.com/profile_banners/45992465/1448325031,http://abs.twimg.com/images/themes/theme1/bg.png,http://pbs.twimg.com/profile_images/1454056381334573057/CjwPbRWC_normal.jpg
187,44135322,1.45421E+18,1635546414,yfreemark,"@BennetCornelius The blame may be on Amtrak, no question!",Twitter for iPhone,40,1.45417E+18,627859155,BennetCornelius,FALSE,FALSE,2,0,NA,NA,NA,NA,NA,NA,NA,NA,NA,NA,NA,NA,NA,NA,NA,627859155,BennetCornelius,en,NA,NA,NA,NA,NA,NA,NA,NA,NA,NA,NA,NA,NA,NA,NA,NA,NA,NA,NA,NA,NA,NA,NA,NA,NA,NA,NA,NA,NA,NA,NA,NA,NA,NA,NA,NA,"c(NA, NA)","c(NA, NA)","c(NA, NA, NA, NA, NA, NA, NA, NA)",https://twitter.com/yfreemark/status/1454213178670387204,Yonah Freemark,DC,Urbanism + Transport + Housing + Politics / @UrbanInstitute / Le progrès ne vaut que s'il est partagé par tous / https://t.co/TgjewPzTbI / https://t.co/olw3ryjUGD,https://t.co/3Rs7yNzRAS,FALSE,28757,643,1029,28192,15031,1243955480,TRUE,https://t.co/3Rs7yNzRAS,https://www.urban.org/author/yonah-freemark,NA,https://pbs.twimg.com/profile_banners/44135322/1583705251,http://abs.twimg.com/images/themes/theme1/bg.png,http://pbs.twimg.com/profile_images/1198681060671983616/F1kaD1oP_normal.jpg
188,44135322,1.4538E+18,1635447720,yfreemark,"@nilocobau $76 billion in intercity rail funding, of which:
-$10 billion go to high-speed rail
-$36 billion go to corridors (maybe high-speed rail, probably not)
-$22 billion for Amtrak (very little for high-speed rail)
-$8 billion for freight/safety/grade crossings",Twitter Web App,255,1.4538E+18,1.29846E+18,nilocobau,FALSE,FALSE,23,2,NA,NA,NA,NA,NA,NA,NA,NA,NA,NA,NA,NA,NA,NA,NA,1.29846E+18,nilocobau,en,NA,NA,NA,NA,NA,NA,NA,NA,NA,NA,NA,NA,NA,NA,NA,NA,NA,NA,NA,NA,NA,NA,NA,NA,NA,NA,NA,NA,NA,NA,NA,NA,NA,NA,NA,NA,"c(NA, NA)","c(NA, NA)","c(NA, NA, NA, NA, NA, NA, NA, NA)",https://twitter.com/yfreemark/status/1453799225796476934,Yonah Freemark,DC,Urbanism + Transport + Housing + Politics / @UrbanInstitute / Le progrès ne vaut que s'il est partagé par tous / https://t.co/TgjewPzTbI / https://t.co/olw3ryjUGD,https://t.co/3Rs7yNzRAS,FALSE,28757,643,1029,28192,15031,1243955480,TRUE,https://t.co/3Rs7yNzRAS,https://www.urban.org/author/yonah-freemark,NA,https://pbs.twimg.com/profile_banners/44135322/1583705251,http://abs.twimg.com/images/themes/theme1/bg.png,http://pbs.twimg.com/profile_images/1198681060671983616/F1kaD1oP_normal.jpg
189,44135322,1.45421E+18,1635546366,yfreemark,"@erik_griswold @AmtrakNECAlerts The blame may be on Amtrak, no question!",Twitter for iPhone,40,1.4542E+18,620033039,erik_griswold,FALSE,FALSE,1,0,NA,NA,NA,NA,NA,NA,NA,NA,NA,NA,NA,NA,NA,NA,NA,"c(""620033039"", ""236842868"")","c(""erik_griswold"", ""AmtrakNECAlerts"")",en,NA,NA,NA,NA,NA,NA,NA,NA,NA,NA,NA,NA,NA,NA,NA,NA,NA,NA,NA,NA,NA,NA,NA,NA,NA,NA,NA,NA,NA,NA,NA,NA,NA,NA,NA,NA,"c(NA, NA)","c(NA, NA)","c(NA, NA, NA, NA, NA, NA, NA, NA)",https://twitter.com/yfreemark/status/1454212978627293190,Yonah Freemark,DC,Urbanism + Transport + Housing + Politics / @UrbanInstitute / Le progrès ne vaut que s'il est partagé par tous / https://t.co/TgjewPzTbI / https://t.co/olw3ryjUGD,https://t.co/3Rs7yNzRAS,FALSE,28757,643,1029,28192,15031,1243955480,TRUE,https://t.co/3Rs7yNzRAS,https://www.urban.org/author/yonah-freemark,NA,https://pbs.twimg.com/profile_banners/44135322/1583705251,http://abs.twimg.com/images/themes/theme1/bg.png,http://pbs.twimg.com/profile_images/1198681060671983616/F1kaD1oP_normal.jpg
190,7.25788E+17,1.45421E+18,1635545028,hellhathnosarah,"last night i was boarding amtrak &amp; this guy does a “oh are you ashley?” bit of flirting. there’s back + forth, we sit together, he offers me pizza. 1hr in he drops he has a gf. he gets off the train before me &amp; adds me on ig. looked at his ig today. 

his gf’s name is…ashley <U+0001F636>",Twitter for iPhone,285,NA,NA,NA,FALSE,FALSE,9,0,NA,NA,NA,NA,NA,NA,NA,NA,NA,NA,NA,NA,NA,NA,NA,NA,NA,en,NA,NA,NA,NA,NA,NA,NA,NA,NA,NA,NA,NA,NA,NA,NA,NA,NA,NA,NA,NA,NA,NA,NA,NA,NA,NA,NA,NA,NA,NA,NA,NA,NA,NA,NA,NA,"c(NA, NA)","c(NA, NA)","c(NA, NA, NA, NA, NA, NA, NA, NA)",https://twitter.com/hellhathnosarah/status/1454207366690390021,st <U+0001F525><U+270C><U+0001F3FC> <U+0001F305>,miami / dc,"avid goodreads user, practitioner of breathing, and hip hop enthusiast (she/her)",https://t.co/KX5dVdFTNv,FALSE,312,1519,4,5324,27512,1461876248,FALSE,https://t.co/KX5dVdFTNv,http://ally.wiki,NA,https://pbs.twimg.com/profile_banners/725787705158852610/1597164602,http://abs.twimg.com/images/themes/theme1/bg.png,http://pbs.twimg.com/profile_images/1452627135626100741/AwmrZCBe_normal.jpg
191,9.97107E+17,1.4542E+18,1635543203,PlasticPlanners,"@erik_griswold @yfreemark @AmtrakNECAlerts @Amtrak Yeah - it's always a nonsense when rail companies are turning against each other when local, regional and express should all be symbiotic.

But never mind, we've had plenty of this nonsense too in other areas.",TweetDeck,209,1.4542E+18,620033039,erik_griswold,FALSE,FALSE,1,0,NA,NA,NA,NA,NA,NA,NA,NA,NA,NA,NA,NA,NA,NA,NA,"c(""620033039"", ""44135322"", ""236842868"", ""119166791"")","c(""erik_griswold"", ""yfreemark"", ""AmtrakNECAlerts"", ""Amtrak"")",en,NA,NA,NA,NA,NA,NA,NA,NA,NA,NA,NA,NA,NA,NA,NA,NA,NA,NA,NA,NA,NA,NA,NA,NA,NA,NA,NA,NA,NA,NA,NA,NA,NA,NA,NA,NA,"c(NA, NA)","c(NA, NA)","c(NA, NA, NA, NA, NA, NA, NA, NA)",https://twitter.com/PlasticPlanners/status/1454199710579834885,Lego Road Safety & Highways,Middle Earth,Using the world's favourite toy to educate immature little BMW drivers about how roads actually work. 100% NOT the Lego group.,https://t.co/nPAdBUYlBu,FALSE,4525,2202,43,89864,9633,1526563896,FALSE,https://t.co/nPAdBUYlBu,http://www.plasticplanners.org,NA,https://pbs.twimg.com/profile_banners/997107368847642624/1543585879,http://abs.twimg.com/images/themes/theme1/bg.png,http://pbs.twimg.com/profile_images/1068502851054391296/FACAYW5t_normal.jpg
192,9.97107E+17,1.4542E+18,1635542504,PlasticPlanners,"@erik_griswold @yfreemark @AmtrakNECAlerts Have to say I think this is pretty unique, but I wasn't aware of Amtrak owning any track?

I've seen a figure of 19p per train per mile in the UK when comparing like with like. The electricity would need to be bought on the supply market, but wires afaik all Network Rail.",TweetDeck,272,1.4542E+18,620033039,erik_griswold,FALSE,FALSE,0,0,NA,NA,NA,NA,NA,NA,NA,NA,NA,NA,NA,NA,NA,NA,NA,"c(""620033039"", ""44135322"", ""236842868"")","c(""erik_griswold"", ""yfreemark"", ""AmtrakNECAlerts"")",en,NA,NA,NA,NA,NA,NA,NA,NA,NA,NA,NA,NA,NA,NA,NA,NA,NA,NA,NA,NA,NA,NA,NA,NA,NA,NA,NA,NA,NA,NA,NA,NA,NA,NA,NA,NA,"c(NA, NA)","c(NA, NA)","c(NA, NA, NA, NA, NA, NA, NA, NA)",https://twitter.com/PlasticPlanners/status/1454196778761347072,Lego Road Safety & Highways,Middle Earth,Using the world's favourite toy to educate immature little BMW drivers about how roads actually work. 100% NOT the Lego group.,https://t.co/nPAdBUYlBu,FALSE,4525,2202,43,89864,9633,1526563896,FALSE,https://t.co/nPAdBUYlBu,http://www.plasticplanners.org,NA,https://pbs.twimg.com/profile_banners/997107368847642624/1543585879,http://abs.twimg.com/images/themes/theme1/bg.png,http://pbs.twimg.com/profile_images/1068502851054391296/FACAYW5t_normal.jpg
193,239824566,1.4542E+18,1635542761,EnoTrans,"The Northeast states, federal government, 8 commuter rail agencies, and Amtrak came together through the @NEC_Commission to develop C3—a plan outlining infrastructure investments over 15 years. Join us on Thursday, Nov. 4 at 2pm to learn more. <U+0001F447>
https://t.co/Jy8zmYb0WQ https://t.co/i65zYKtBa3",CoSchedule,269,NA,NA,NA,FALSE,FALSE,0,0,NA,NA,NA,NA,bit.ly/3vwJagL?utm_ca…,https://t.co/Jy8zmYb0WQ,https://bit.ly/3vwJagL?utm_campaign=coschedule&utm_source=twitter&utm_medium=EnoTrans,http://pbs.twimg.com/media/FC5ZPiPXoAoSrNs.jpg,https://t.co/i65zYKtBa3,https://twitter.com/EnoTrans/status/1454197855460200456/photo/1,photo,http://pbs.twimg.com/media/FC5ZPiPXoAoSrNs.jpg,https://t.co/i65zYKtBa3,https://twitter.com/EnoTrans/status/1454197855460200456/photo/1,NA,2431919046,NEC_Commission,en,NA,NA,NA,NA,NA,NA,NA,NA,NA,NA,NA,NA,NA,NA,NA,NA,NA,NA,NA,NA,NA,NA,NA,NA,NA,NA,NA,NA,NA,NA,NA,NA,NA,NA,NA,NA,"c(NA, NA)","c(NA, NA)","c(NA, NA, NA, NA, NA, NA, NA, NA)",https://twitter.com/EnoTrans/status/1454197855460200456,Eno,"Washington, DC",Policy Research & Leadership for the Transportation Industry. See what we're saying: https://t.co/4QiHkgG9ns,http://t.co/Ha8RhQN8ZD,FALSE,9601,1366,378,24872,1845,1295360764,TRUE,http://t.co/Ha8RhQN8ZD,http://www.enotrans.org,NA,https://pbs.twimg.com/profile_banners/239824566/1549506918,http://abs.twimg.com/images/themes/theme1/bg.png,http://pbs.twimg.com/profile_images/1377648710386122764/0Izz5pZN_normal.jpg
194,28645275,1.45418E+18,1635538393,alexdoyle,This humble brag brought to you by some Amtrak downtime :)  Have a great weekend everyone! https://t.co/AtYq70Yuv2,Twitter for Android,90,NA,NA,NA,FALSE,FALSE,2,0,NA,NA,NA,NA,NA,NA,NA,http://pbs.twimg.com/media/FC5IlH8XoAAR0Dk.jpg,https://t.co/AtYq70Yuv2,https://twitter.com/alexdoyle/status/1454179537047236612/photo/1,photo,http://pbs.twimg.com/media/FC5IlH8XoAAR0Dk.jpg,https://t.co/AtYq70Yuv2,https://twitter.com/alexdoyle/status/1454179537047236612/photo/1,NA,NA,NA,en,NA,NA,NA,NA,NA,NA,NA,NA,NA,NA,NA,NA,NA,NA,NA,NA,NA,NA,NA,NA,NA,NA,NA,NA,NA,NA,NA,NA,NA,NA,NA,NA,NA,NA,NA,NA,"c(NA, NA)","c(NA, NA)","c(NA, NA, NA, NA, NA, NA, NA, NA)",https://twitter.com/alexdoyle/status/1454179537047236612,Alex Doyle,"Washington, DC","Business Communications Product Manager, Dad of 3, guitar player in the best fake band in the telecom world.   Opinions my own, etc etc.",NA,FALSE,948,2070,33,4222,1830,1238790439,FALSE,NA,NA,NA,https://pbs.twimg.com/profile_banners/28645275/1511529733,http://abs.twimg.com/images/themes/theme1/bg.png,http://pbs.twimg.com/profile_images/1146184301647716358/QHF0dEee_normal.jpg
195,708151574,1.45417E+18,1635536964,kiernan_kat,Something I’m writing for work requires me to look at the libertarian party’s website and I can just feel judgment coming from the ppl I’m sharing this Amtrak train with rn,Twitter Web App,172,NA,NA,NA,FALSE,FALSE,12,0,NA,NA,NA,NA,NA,NA,NA,NA,NA,NA,NA,NA,NA,NA,NA,NA,NA,en,NA,NA,NA,NA,NA,NA,NA,NA,NA,NA,NA,NA,NA,NA,NA,NA,NA,NA,NA,NA,NA,NA,NA,NA,NA,NA,NA,NA,NA,NA,NA,NA,NA,NA,NA,NA,"c(NA, NA)","c(NA, NA)","c(NA, NA, NA, NA, NA, NA, NA, NA)",https://twitter.com/kiernan_kat/status/1454173541818064913,Kat,"Washington, DC",just out here trying to live my best life | she/her,NA,FALSE,404,582,6,12422,94014,1342835355,FALSE,NA,NA,NA,https://pbs.twimg.com/profile_banners/708151574/1617156393,http://abs.twimg.com/images/themes/theme7/bg.gif,http://pbs.twimg.com/profile_images/1421231470828531712/FuG5pUPA_normal.jpg
196,179297823,1.45417E+18,1635536485,WashInformer,"Rediscover the places you love with people you love. With comfy seats, private rooms, and lots of options to fit your schedule, Amtrak can get you safely to 500+ destinations nationwide. Rediscover America. Just An Amtrak Away.

Learn more at https://t.co/vMdsmRGAPw

#amtrak https://t.co/AiUfsxAlEe",LatelyAI,275,NA,NA,NA,FALSE,FALSE,0,0,NA,NA,amtrak,NA,amtrak.com,https://t.co/vMdsmRGAPw,http://www.amtrak.com,http://pbs.twimg.com/media/FC5BTPGWEAMHEWs.jpg,https://t.co/AiUfsxAlEe,https://twitter.com/WashInformer/status/1454171533962715139/photo/1,photo,http://pbs.twimg.com/media/FC5BTPGWEAMHEWs.jpg,https://t.co/AiUfsxAlEe,https://twitter.com/WashInformer/status/1454171533962715139/photo/1,NA,NA,NA,en,NA,NA,NA,NA,NA,NA,NA,NA,NA,NA,NA,NA,NA,NA,NA,NA,NA,NA,NA,NA,NA,NA,NA,NA,NA,NA,NA,NA,NA,NA,NA,NA,NA,NA,NA,NA,"c(NA, NA)","c(NA, NA)","c(NA, NA, NA, NA, NA, NA, NA, NA)",https://twitter.com/WashInformer/status/1454171533962715139,Washington Informer,"Washington, DC","Top-leading African American woman-owned media company serving the Washington D.C. metro area since 1964. 
News Tip? News@washingtoninformer.com",https://t.co/QIrfY5qgXY,FALSE,10691,6917,288,40087,5110,1282003867,FALSE,https://t.co/QIrfY5qgXY,http://washingtoninformer.com,NA,https://pbs.twimg.com/profile_banners/179297823/1592309379,http://abs.twimg.com/images/themes/theme14/bg.gif,http://pbs.twimg.com/profile_images/756508039390306306/pK5w7voq_normal.jpg
