265,44805447,1.4529E+18,1635232580,michele_all_day,".@Amtrak My kid has just arrived in Roanoke and the connecting bus to Blacksburg (paid for as part of his Amtrak ticket) is not there, and the station is abandoned. He’s an hour away from his school in Blacksburg, and 4 hours away from me, calling me in a panic at 3:15am. (5)",Twitter for iPhone,276,NA,NA,NA,FALSE,FALSE,1,0,NA,NA,NA,NA,NA,NA,NA,NA,NA,NA,NA,NA,NA,NA,NA,119166791,Amtrak,en,NA,NA,NA,NA,NA,NA,NA,NA,NA,NA,NA,NA,NA,NA,NA,NA,NA,NA,NA,NA,NA,NA,NA,NA,NA,NA,NA,NA,NA,NA,https://api.twitter.com/1.1/geo/id/db1e795d2641873e.json,Gaithersburg,"Gaithersburg, MD",city,United States,US,"c(NA, NA)","c(NA, NA)","c(-77.252801, -77.1630643, -77.1630643, -77.252801, 39.102707, 39.102707, 39.169487, 39.169487)",https://twitter.com/michele_all_day/status/1452896862231482368,Michele Weaverling <U+0001F3F3><U+FE0F><U+200D><U+0001F308>,"Washington, DC",Be you … keep going … look for the lifelines.<U+2665><U+FE0F><U+2665><U+FE0F> My vintage + fashion + creative thing: lifeline.vintage on IG and TikTok. Personal IG: michele_keeps_going.,NA,FALSE,132,911,5,15390,5190,1244170917,FALSE,NA,NA,NA,https://pbs.twimg.com/profile_banners/44805447/1626412309,http://abs.twimg.com/images/themes/theme1/bg.png,http://pbs.twimg.com/profile_images/1435880512523018242/TfRpsjYb_normal.jpg
266,44805447,1.45289E+18,1635231972,michele_all_day,".@Amtrak Call 2, agent was more helpful and says bus should be there but disconnects the call before she can confirm. (3)",Twitter for iPhone,121,NA,NA,NA,FALSE,FALSE,0,0,NA,NA,NA,NA,NA,NA,NA,NA,NA,NA,NA,NA,NA,NA,NA,119166791,Amtrak,en,NA,NA,NA,NA,NA,NA,NA,NA,NA,NA,NA,NA,NA,NA,NA,NA,NA,NA,NA,NA,NA,NA,NA,NA,NA,NA,NA,NA,NA,NA,https://api.twitter.com/1.1/geo/id/db1e795d2641873e.json,Gaithersburg,"Gaithersburg, MD",city,United States,US,"c(NA, NA)","c(NA, NA)","c(-77.252801, -77.1630643, -77.1630643, -77.252801, 39.102707, 39.102707, 39.169487, 39.169487)",https://twitter.com/michele_all_day/status/1452894311960436742,Michele Weaverling <U+0001F3F3><U+FE0F><U+200D><U+0001F308>,"Washington, DC",Be you … keep going … look for the lifelines.<U+2665><U+FE0F><U+2665><U+FE0F> My vintage + fashion + creative thing: lifeline.vintage on IG and TikTok. Personal IG: michele_keeps_going.,NA,FALSE,132,911,5,15390,5190,1244170917,FALSE,NA,NA,NA,https://pbs.twimg.com/profile_banners/44805447/1626412309,http://abs.twimg.com/images/themes/theme1/bg.png,http://pbs.twimg.com/profile_images/1435880512523018242/TfRpsjYb_normal.jpg
267,44805447,1.4529E+18,1635232722,michele_all_day,.@Amtrak This is how you treat stranded passengers (mainly college kids!) in the middle of the night after your train breaks down for 5 hours?? Absolutely shameful. (6),Twitter for iPhone,168,NA,NA,NA,FALSE,FALSE,0,0,NA,NA,NA,NA,NA,NA,NA,NA,NA,NA,NA,NA,NA,NA,NA,119166791,Amtrak,en,NA,NA,NA,NA,NA,NA,NA,NA,NA,NA,NA,NA,NA,NA,NA,NA,NA,NA,NA,NA,NA,NA,NA,NA,NA,NA,NA,NA,NA,NA,https://api.twitter.com/1.1/geo/id/db1e795d2641873e.json,Gaithersburg,"Gaithersburg, MD",city,United States,US,"c(NA, NA)","c(NA, NA)","c(-77.252801, -77.1630643, -77.1630643, -77.252801, 39.102707, 39.102707, 39.169487, 39.169487)",https://twitter.com/michele_all_day/status/1452897457424175108,Michele Weaverling <U+0001F3F3><U+FE0F><U+200D><U+0001F308>,"Washington, DC",Be you … keep going … look for the lifelines.<U+2665><U+FE0F><U+2665><U+FE0F> My vintage + fashion + creative thing: lifeline.vintage on IG and TikTok. Personal IG: michele_keeps_going.,NA,FALSE,132,911,5,15390,5190,1244170917,FALSE,NA,NA,NA,https://pbs.twimg.com/profile_banners/44805447/1626412309,http://abs.twimg.com/images/themes/theme1/bg.png,http://pbs.twimg.com/profile_images/1435880512523018242/TfRpsjYb_normal.jpg
268,44805447,1.45289E+18,1635231719,michele_all_day,".@Amtrak I called cust serv 4 times, on hold over an hour each time. Call 1, agent says nothing she can do, and if bus is gone when train arrives in Roanoke, my son should call Amtrak, wait hour+ on hold, and request another one, or wait 7 hours until next train @ 10:15 am. (2)",Twitter for iPhone,278,NA,NA,NA,FALSE,FALSE,0,0,NA,NA,NA,NA,NA,NA,NA,NA,NA,NA,NA,NA,NA,NA,NA,119166791,Amtrak,en,NA,NA,NA,NA,NA,NA,NA,NA,NA,NA,NA,NA,NA,NA,NA,NA,NA,NA,NA,NA,NA,NA,NA,NA,NA,NA,NA,NA,NA,NA,https://api.twitter.com/1.1/geo/id/db1e795d2641873e.json,Gaithersburg,"Gaithersburg, MD",city,United States,US,"c(NA, NA)","c(NA, NA)","c(-77.252801, -77.1630643, -77.1630643, -77.252801, 39.102707, 39.102707, 39.169487, 39.169487)",https://twitter.com/michele_all_day/status/1452893252777095172,Michele Weaverling <U+0001F3F3><U+FE0F><U+200D><U+0001F308>,"Washington, DC",Be you … keep going … look for the lifelines.<U+2665><U+FE0F><U+2665><U+FE0F> My vintage + fashion + creative thing: lifeline.vintage on IG and TikTok. Personal IG: michele_keeps_going.,NA,FALSE,132,911,5,15390,5190,1244170917,FALSE,NA,NA,NA,https://pbs.twimg.com/profile_banners/44805447/1626412309,http://abs.twimg.com/images/themes/theme1/bg.png,http://pbs.twimg.com/profile_images/1435880512523018242/TfRpsjYb_normal.jpg
269,44805447,1.45317E+18,1635297050,michele_all_day,".@Amtrak’s soc med ppl have been SO helpful re my kid stranded at 3am in the cold an hour from campus w/no connecting bus, no Uber, egregious cust serv, after train broke down. (He thankfully hitched a ride w/other students who woke a friend to come get them.)  Sincere thanks!! https://t.co/B6JDj00AE9",Twitter for iPhone,278,NA,NA,NA,FALSE,FALSE,0,0,NA,NA,NA,NA,NA,NA,NA,http://pbs.twimg.com/media/FCqv7o0XMAIVAkg.jpg,https://t.co/B6JDj00AE9,https://twitter.com/michele_all_day/status/1453167271543820296/photo/1,photo,http://pbs.twimg.com/media/FCqv7o0XMAIVAkg.jpg,https://t.co/B6JDj00AE9,https://twitter.com/michele_all_day/status/1453167271543820296/photo/1,NA,119166791,Amtrak,en,NA,NA,NA,NA,NA,NA,NA,NA,NA,NA,NA,NA,NA,NA,NA,NA,NA,NA,NA,NA,NA,NA,NA,NA,NA,NA,NA,NA,NA,NA,https://api.twitter.com/1.1/geo/id/db1e795d2641873e.json,Gaithersburg,"Gaithersburg, MD",city,United States,US,"c(NA, NA)","c(NA, NA)","c(-77.252801, -77.1630643, -77.1630643, -77.252801, 39.102707, 39.102707, 39.169487, 39.169487)",https://twitter.com/michele_all_day/status/1453167271543820296,Michele Weaverling <U+0001F3F3><U+FE0F><U+200D><U+0001F308>,"Washington, DC",Be you … keep going … look for the lifelines.<U+2665><U+FE0F><U+2665><U+FE0F> My vintage + fashion + creative thing: lifeline.vintage on IG and TikTok. Personal IG: michele_keeps_going.,NA,FALSE,132,911,5,15390,5190,1244170917,FALSE,NA,NA,NA,https://pbs.twimg.com/profile_banners/44805447/1626412309,http://abs.twimg.com/images/themes/theme1/bg.png,http://pbs.twimg.com/profile_images/1435880512523018242/TfRpsjYb_normal.jpg
270,44805447,1.4529E+18,1635233890,michele_all_day,".@Amtrak Call 4, still on hold more than an hour. Don’t even know why I’m calling anymore. Been on the phone for nearly 6 hours trying to get help, and no one can help, or they are angry at me for calling at all. (8)",Twitter for iPhone,216,NA,NA,NA,FALSE,FALSE,0,0,NA,NA,NA,NA,NA,NA,NA,NA,NA,NA,NA,NA,NA,NA,NA,119166791,Amtrak,en,NA,NA,NA,NA,NA,NA,NA,NA,NA,NA,NA,NA,NA,NA,NA,NA,NA,NA,NA,NA,NA,NA,NA,NA,NA,NA,NA,NA,NA,NA,https://api.twitter.com/1.1/geo/id/db1e795d2641873e.json,Gaithersburg,"Gaithersburg, MD",city,United States,US,"c(NA, NA)","c(NA, NA)","c(-77.252801, -77.1630643, -77.1630643, -77.252801, 39.102707, 39.102707, 39.169487, 39.169487)",https://twitter.com/michele_all_day/status/1452902358049075203,Michele Weaverling <U+0001F3F3><U+FE0F><U+200D><U+0001F308>,"Washington, DC",Be you … keep going … look for the lifelines.<U+2665><U+FE0F><U+2665><U+FE0F> My vintage + fashion + creative thing: lifeline.vintage on IG and TikTok. Personal IG: michele_keeps_going.,NA,FALSE,132,911,5,15390,5190,1244170917,FALSE,NA,NA,NA,https://pbs.twimg.com/profile_banners/44805447/1626412309,http://abs.twimg.com/images/themes/theme1/bg.png,http://pbs.twimg.com/profile_images/1435880512523018242/TfRpsjYb_normal.jpg
271,44805447,1.45289E+18,1635231427,michele_all_day,".@Amtrak My college student has been on a train from New Carrollton to Roanoke since 4pm yesterday 10/25, with a connecting bus to Blacksburg. It’s now 3am on 10/26 and the train has been sitting disabled for 5 hours. No electricity, no A/C, no updates on status. (1)",Twitter for iPhone,267,NA,NA,NA,FALSE,FALSE,1,0,NA,NA,NA,NA,NA,NA,NA,NA,NA,NA,NA,NA,NA,NA,NA,119166791,Amtrak,en,NA,NA,NA,NA,NA,NA,NA,NA,NA,NA,NA,NA,NA,NA,NA,NA,NA,NA,NA,NA,NA,NA,NA,NA,NA,NA,NA,NA,NA,NA,https://api.twitter.com/1.1/geo/id/db1e795d2641873e.json,Gaithersburg,"Gaithersburg, MD",city,United States,US,"c(NA, NA)","c(NA, NA)","c(-77.252801, -77.1630643, -77.1630643, -77.252801, 39.102707, 39.102707, 39.169487, 39.169487)",https://twitter.com/michele_all_day/status/1452892025989255171,Michele Weaverling <U+0001F3F3><U+FE0F><U+200D><U+0001F308>,"Washington, DC",Be you … keep going … look for the lifelines.<U+2665><U+FE0F><U+2665><U+FE0F> My vintage + fashion + creative thing: lifeline.vintage on IG and TikTok. Personal IG: michele_keeps_going.,NA,FALSE,132,911,5,15390,5190,1244170917,FALSE,NA,NA,NA,https://pbs.twimg.com/profile_banners/44805447/1626412309,http://abs.twimg.com/images/themes/theme1/bg.png,http://pbs.twimg.com/profile_images/1435880512523018242/TfRpsjYb_normal.jpg
272,44805447,1.4529E+18,1635233639,michele_all_day,.@Amtrak Trying to order a $100 Uber out of desperation and none are available. Never been more infuriated. (7),Twitter for iPhone,111,NA,NA,NA,FALSE,FALSE,0,0,NA,NA,NA,NA,NA,NA,NA,NA,NA,NA,NA,NA,NA,NA,NA,119166791,Amtrak,en,NA,NA,NA,NA,NA,NA,NA,NA,NA,NA,NA,NA,NA,NA,NA,NA,NA,NA,NA,NA,NA,NA,NA,NA,NA,NA,NA,NA,NA,NA,https://api.twitter.com/1.1/geo/id/db1e795d2641873e.json,Gaithersburg,"Gaithersburg, MD",city,United States,US,"c(NA, NA)","c(NA, NA)","c(-77.252801, -77.1630643, -77.1630643, -77.252801, 39.102707, 39.102707, 39.169487, 39.169487)",https://twitter.com/michele_all_day/status/1452901305639448576,Michele Weaverling <U+0001F3F3><U+FE0F><U+200D><U+0001F308>,"Washington, DC",Be you … keep going … look for the lifelines.<U+2665><U+FE0F><U+2665><U+FE0F> My vintage + fashion + creative thing: lifeline.vintage on IG and TikTok. Personal IG: michele_keeps_going.,NA,FALSE,132,911,5,15390,5190,1244170917,FALSE,NA,NA,NA,https://pbs.twimg.com/profile_banners/44805447/1626412309,http://abs.twimg.com/images/themes/theme1/bg.png,http://pbs.twimg.com/profile_images/1435880512523018242/TfRpsjYb_normal.jpg
273,44805447,1.4529E+18,1635232292,michele_all_day,".@Amtrak Call 3, agent named Shane brings comically negligent, insulting cust serv by simply informing me train is 5 hours delayed (thanks!) and then actually yelling at me when I ask for more info to help my kid get home in the dark of night, then HUNG UP on me. Unbelievable (4)",Twitter for iPhone,280,NA,NA,NA,FALSE,FALSE,0,0,NA,NA,NA,NA,NA,NA,NA,NA,NA,NA,NA,NA,NA,NA,NA,119166791,Amtrak,en,NA,NA,NA,NA,NA,NA,NA,NA,NA,NA,NA,NA,NA,NA,NA,NA,NA,NA,NA,NA,NA,NA,NA,NA,NA,NA,NA,NA,NA,NA,https://api.twitter.com/1.1/geo/id/db1e795d2641873e.json,Gaithersburg,"Gaithersburg, MD",city,United States,US,"c(NA, NA)","c(NA, NA)","c(-77.252801, -77.1630643, -77.1630643, -77.252801, 39.102707, 39.102707, 39.169487, 39.169487)",https://twitter.com/michele_all_day/status/1452895656427802626,Michele Weaverling <U+0001F3F3><U+FE0F><U+200D><U+0001F308>,"Washington, DC",Be you … keep going … look for the lifelines.<U+2665><U+FE0F><U+2665><U+FE0F> My vintage + fashion + creative thing: lifeline.vintage on IG and TikTok. Personal IG: michele_keeps_going.,NA,FALSE,132,911,5,15390,5190,1244170917,FALSE,NA,NA,NA,https://pbs.twimg.com/profile_banners/44805447/1626412309,http://abs.twimg.com/images/themes/theme1/bg.png,http://pbs.twimg.com/profile_images/1435880512523018242/TfRpsjYb_normal.jpg
274,1115749460,1.45314E+18,1635291083,riccardian,@NotOfAssisi Strollers also are a weird device in that they don’t quite grant you ADA access but you need it? For example the NE regional Amtrak trains often board ( like VRE ) from platforms involving a step up. Amtrak per ADA has little elevator thingy’s but they are for wheelchairs,Twitter Web App,272,1.45314E+18,1115749460,riccardian,FALSE,FALSE,5,0,NA,NA,NA,NA,NA,NA,NA,NA,NA,NA,NA,NA,NA,NA,NA,1.13411E+18,NotOfAssisi,en,NA,NA,NA,NA,NA,NA,NA,NA,NA,NA,NA,NA,NA,NA,NA,NA,NA,NA,NA,NA,NA,NA,NA,NA,NA,NA,NA,NA,NA,NA,NA,NA,NA,NA,NA,NA,"c(NA, NA)","c(NA, NA)","c(NA, NA, NA, NA, NA, NA, NA, NA)",https://twitter.com/riccardian/status/1453142243016167430,Michael,"Alexandria, VA",Catholic Transit Nerd,NA,FALSE,110,329,3,271,2386,1358992466,FALSE,NA,NA,NA,NA,http://abs.twimg.com/images/themes/theme1/bg.png,http://pbs.twimg.com/profile_images/1049081357350187008/Yhd2IQxv_normal.jpg
275,2467791,1.45311E+18,1635282749,washingtonpost,"NTSB report says Amtrak train in fatal Montana derailment had automatic-braking system, but offers few clues https://t.co/XantKcSm75",SocialFlow,132,NA,NA,NA,FALSE,FALSE,45,16,NA,NA,NA,NA,wapo.st/3melnPA,https://t.co/XantKcSm75,https://wapo.st/3melnPA,NA,NA,NA,NA,NA,NA,NA,NA,NA,NA,en,NA,NA,NA,NA,NA,NA,NA,NA,NA,NA,NA,NA,NA,NA,NA,NA,NA,NA,NA,NA,NA,NA,NA,NA,NA,NA,NA,NA,NA,NA,NA,NA,NA,NA,NA,NA,"c(NA, NA)","c(NA, NA)","c(NA, NA, NA, NA, NA, NA, NA, NA)",https://twitter.com/washingtonpost/status/1453107289720766475,The Washington Post,"Washington, DC",Democracy Dies in Darkness.,http://t.co/Hq7hTYkOPg,FALSE,18407128,1717,103883,408029,4272,1174994379,TRUE,http://t.co/Hq7hTYkOPg,http://washingtonpost.com,NA,https://pbs.twimg.com/profile_banners/2467791/1469484132,http://abs.twimg.com/images/themes/theme1/bg.png,http://pbs.twimg.com/profile_images/1060271522319925257/fJKwJ0r2_normal.jpg
276,1.43029E+18,1.45295E+18,1635246302,Johnathan4089,"BREAKING: Over 278 Families in Fairfax, all whom were vaccinated, some triple vaccinated, were ill stricken with CoV19! 

The vaccines DO NOT work! @NIH Fauci @JoeBiden Continues to lie! 

@POTUS continues to lie about meeting Amtrak employee that died years earlier than he said! https://t.co/WO6lFGh97J",Twitter for iPhone,280,NA,NA,NA,FALSE,FALSE,0,1,NA,NA,NA,NA,NA,NA,NA,http://pbs.twimg.com/media/FCnuWDAWUAoIeoz.jpg,https://t.co/WO6lFGh97J,https://twitter.com/Johnathan4089/status/1452954419922968580/photo/1,photo,http://pbs.twimg.com/media/FCnuWDAWUAoIeoz.jpg,https://t.co/WO6lFGh97J,https://twitter.com/Johnathan4089/status/1452954419922968580/photo/1,NA,"c(""15134240"", ""939091"", ""1349149096909668363"")","c(""NIH"", ""JoeBiden"", ""POTUS"")",en,NA,NA,NA,NA,NA,NA,NA,NA,NA,NA,NA,NA,NA,NA,NA,NA,NA,NA,NA,NA,NA,NA,NA,NA,NA,NA,NA,NA,NA,NA,NA,NA,NA,NA,NA,NA,"c(NA, NA)","c(NA, NA)","c(NA, NA, NA, NA, NA, NA, NA, NA)",https://twitter.com/Johnathan4089/status/1452954419922968580,Lt Dan,Washington DC,Retired Specialist,NA,FALSE,34,124,0,7862,4390,1629843838,FALSE,NA,NA,NA,NA,NA,http://pbs.twimg.com/profile_images/1430297119869517828/b4T7wSA1_normal.jpg
277,1.43029E+18,1.45311E+18,1635282593,Johnathan4089,"MASSIVE LIE by @TerryMcAuliffe who has the same disease as @JoeBiden about the Amtrak story which he lies about. When do @vademocrats STOP LYING &amp; deal with the issues. 

Like @TerryMcAuliffe defending sexual predators and rapists ??? https://t.co/cgcaHEYGCo",Twitter Web App,238,NA,NA,NA,TRUE,FALSE,0,1,NA,NA,NA,NA,twitter.com/thedailybeast/…,https://t.co/cgcaHEYGCo,https://twitter.com/thedailybeast/status/1452995865119973385,NA,NA,NA,NA,NA,NA,NA,NA,"c(""19471123"", ""939091"", ""29363230"", ""19471123"")","c(""TerryMcAuliffe"", ""JoeBiden"", ""vademocrats"", ""TerryMcAuliffe"")",en,1.453E+18,"Terry McAuliffe said more than 1,100 kids were hospitalized with COVID. There were 35. https://t.co/OnadR9LVdg",1635256184,SocialFlow,8149,3483,16012783,thedailybeast,The Daily Beast,1338182,1017,364197,"New York, NY","Independent. Intelligent. Influential. Send tips to tips@thedailybeast.com

Site issues? Please email membership@thedailybeast.com",TRUE,NA,NA,NA,NA,NA,NA,NA,NA,NA,NA,NA,NA,NA,NA,NA,NA,NA,NA,NA,NA,NA,"c(NA, NA)","c(NA, NA)","c(NA, NA, NA, NA, NA, NA, NA, NA)",https://twitter.com/Johnathan4089/status/1453106634067173379,Lt Dan,Washington DC,Retired Specialist,NA,FALSE,34,124,0,7862,4390,1629843838,FALSE,NA,NA,NA,NA,NA,http://pbs.twimg.com/profile_images/1430297119869517828/b4T7wSA1_normal.jpg
278,1.2704E+18,1.4531E+18,1635280719,thepn_org,AP FACT CHECK: Biden tale of Amtrak conductor doesn’t add up WASHINGTON — President Joe Biden is spin https://t.co/DpBBGBy0Ff,Trending on Twitter (The PN),125,NA,NA,NA,FALSE,FALSE,0,0,NA,NA,NA,NA,thepn.org/?p=109063,https://t.co/DpBBGBy0Ff,https://thepn.org/?p=109063,NA,NA,NA,NA,NA,NA,NA,NA,NA,NA,en,NA,NA,NA,NA,NA,NA,NA,NA,NA,NA,NA,NA,NA,NA,NA,NA,NA,NA,NA,NA,NA,NA,NA,NA,NA,NA,NA,NA,NA,NA,NA,NA,NA,NA,NA,NA,"c(NA, NA)","c(NA, NA)","c(NA, NA, NA, NA, NA, NA, NA, NA)",https://twitter.com/thepn_org/status/1453098775052959748,thepn.org,"Washington, DC",Get the Right Headlines | what's trending at https://t.co/JJqIfjssRf | This is The Protagonist News,https://t.co/O1hRNXcohE,FALSE,4197,1299,6,61989,142,1591722757,FALSE,https://t.co/O1hRNXcohE,https://thepn.org,NA,https://pbs.twimg.com/profile_banners/1270403356423368704/1591825139,NA,http://pbs.twimg.com/profile_images/1270403656047669248/3moGhbJ6_normal.jpg
279,1.2704E+18,1.45275E+18,1635197911,thepn_org,"‘Swear to god, true story,’ Biden says as he tells ‘false’ Amtrak story for 5th time President Biden on Monday https://t.co/a2sRYfSTiw",Trending on Twitter (The PN),134,NA,NA,NA,FALSE,FALSE,0,0,NA,NA,NA,NA,thepn.org/?p=108819,https://t.co/a2sRYfSTiw,https://thepn.org/?p=108819,NA,NA,NA,NA,NA,NA,NA,NA,NA,NA,en,NA,NA,NA,NA,NA,NA,NA,NA,NA,NA,NA,NA,NA,NA,NA,NA,NA,NA,NA,NA,NA,NA,NA,NA,NA,NA,NA,NA,NA,NA,NA,NA,NA,NA,NA,NA,"c(NA, NA)","c(NA, NA)","c(NA, NA, NA, NA, NA, NA, NA, NA)",https://twitter.com/thepn_org/status/1452751453156790275,thepn.org,"Washington, DC",Get the Right Headlines | what's trending at https://t.co/JJqIfjssRf | This is The Protagonist News,https://t.co/O1hRNXcohE,FALSE,4197,1299,6,61989,142,1591722757,FALSE,https://t.co/O1hRNXcohE,https://thepn.org,NA,https://pbs.twimg.com/profile_banners/1270403356423368704/1591825139,NA,http://pbs.twimg.com/profile_images/1270403656047669248/3moGhbJ6_normal.jpg
280,9864112,1.4531E+18,1635280045,loriara,https://t.co/gOpk9Qw7mu,Twitter Web App,23,NA,NA,NA,FALSE,FALSE,0,0,NA,NA,NA,NA,washingtonpost.com/transportation…,https://t.co/gOpk9Qw7mu,https://www.washingtonpost.com/transportation/2021/10/26/ntsb-amtrak-derailment-cause/,NA,NA,NA,NA,NA,NA,NA,NA,NA,NA,und,NA,NA,NA,NA,NA,NA,NA,NA,NA,NA,NA,NA,NA,NA,NA,NA,NA,NA,NA,NA,NA,NA,NA,NA,NA,NA,NA,NA,NA,NA,NA,NA,NA,NA,NA,NA,"c(NA, NA)","c(NA, NA)","c(NA, NA, NA, NA, NA, NA, NA, NA)",https://twitter.com/loriara/status/1453095948201103360,lori aratani,"washington, d.c.","Planes, trains, scooters, automobiles, eTVOLs -- I write stories about how people get around (and sometimes don't) for The Washington Post.",https://t.co/idNfRXD4vm,FALSE,4674,1915,282,44957,3683,1193951462,TRUE,https://t.co/idNfRXD4vm,https://www.washingtonpost.com/people/lori-aratani/?utm_term=.a03fe7130e66,NA,https://pbs.twimg.com/profile_banners/9864112/1560435739,http://abs.twimg.com/images/themes/theme7/bg.gif,http://pbs.twimg.com/profile_images/960661314023624704/J8b13D_S_normal.jpg
281,3178197002,1.45309E+18,1635278795,drmassee,‘True story’: Biden refuses to drop debunked Amtrak tale https://t.co/Dv7M18DW6y,Twitter for Android,80,NA,NA,NA,FALSE,FALSE,0,0,NA,NA,NA,NA,washingtontimes.com/news/2021/oct/…,https://t.co/Dv7M18DW6y,https://www.washingtontimes.com/news/2021/oct/26/joe-biden-repeats-debunked-amtrak-tale-calls-it-tr/,NA,NA,NA,NA,NA,NA,NA,NA,NA,NA,en,NA,NA,NA,NA,NA,NA,NA,NA,NA,NA,NA,NA,NA,NA,NA,NA,NA,NA,NA,NA,NA,NA,NA,NA,NA,NA,NA,NA,NA,NA,NA,NA,NA,NA,NA,NA,"c(NA, NA)","c(NA, NA)","c(NA, NA, NA, NA, NA, NA, NA, NA)",https://twitter.com/drmassee/status/1453090704800956417,Donald Ray Massee,"California, USA","Physician married to a RN, conservative, leans libertarian, on the Trump train, limited government, limited taxes, support military and law enforcement",NA,FALSE,2723,3181,7,89238,34760,1430225749,FALSE,NA,NA,NA,NA,http://abs.twimg.com/images/themes/theme1/bg.png,http://pbs.twimg.com/profile_images/815683684082716672/bHegxK3D_normal.jpg
282,1.3727E+18,1.45309E+18,1635278308,Newslooks2,Fact check: Biden not telling the truth with Amtrak story - https://t.co/DG3tBcO9YW https://t.co/eSRdnYg6O1,Newslooks,83,NA,NA,NA,FALSE,FALSE,0,0,NA,NA,NA,NA,newslooks.com/?p=35828,https://t.co/DG3tBcO9YW,https://www.newslooks.com/?p=35828,http://pbs.twimg.com/media/FCpocBuX0AkW2pa.jpg,https://t.co/eSRdnYg6O1,https://twitter.com/Newslooks2/status/1453088662514806787/photo/1,photo,http://pbs.twimg.com/media/FCpocBuX0AkW2pa.jpg,https://t.co/eSRdnYg6O1,https://twitter.com/Newslooks2/status/1453088662514806787/photo/1,NA,NA,NA,en,NA,NA,NA,NA,NA,NA,NA,NA,NA,NA,NA,NA,NA,NA,NA,NA,NA,NA,NA,NA,NA,NA,NA,NA,NA,NA,NA,NA,NA,NA,NA,NA,NA,NA,NA,NA,"c(NA, NA)","c(NA, NA)","c(NA, NA, NA, NA, NA, NA, NA, NA)",https://twitter.com/Newslooks2/status/1453088662514806787,Newslooksteam,Washington DC. USA,"We are not here to tell the news in a partisan way, but to analyze it and reveal what underlies it",https://t.co/eih9SNeP92,FALSE,30,22,1,3910,9,1616112462,FALSE,https://t.co/eih9SNeP92,http://www.newslooks.com,NA,https://pbs.twimg.com/profile_banners/1372701197958791168/1625872485,NA,http://pbs.twimg.com/profile_images/1372701386241155084/sHPsgDwn_normal.jpg
283,1.07517E+18,1.45308E+18,1635276841,KyleMartinsen_,"Joe Biden keeps saying he had a conversation with an Amtrak conductor who was DEAD a year before the conversation could have occurred.
https://t.co/6W0rpV9TZb",Twitter Web App,158,NA,NA,NA,FALSE,FALSE,75,28,NA,NA,NA,NA,gop.com/rapid-response…,https://t.co/6W0rpV9TZb,https://gop.com/rapid-response/serial-liar-joe-biden-strikes-again/,NA,NA,NA,NA,NA,NA,NA,NA,NA,NA,en,NA,NA,NA,NA,NA,NA,NA,NA,NA,NA,NA,NA,NA,NA,NA,NA,NA,NA,NA,NA,NA,NA,NA,NA,NA,NA,NA,NA,NA,NA,NA,NA,NA,NA,NA,NA,"c(NA, NA)","c(NA, NA)","c(NA, NA, NA, NA, NA, NA, NA, NA)",https://twitter.com/KyleMartinsen_/status/1453082505901481984,Kyle Martinsen,"Washington, DC",@GOP + @RNCResearch Rapid Response | Formerly @TeamTrump | Go Bills,NA,FALSE,6725,738,54,2737,3397,1545176158,FALSE,NA,NA,NA,https://pbs.twimg.com/profile_banners/1075172850062057472/1621623793,NA,http://pbs.twimg.com/profile_images/1351975324289003525/wLq2MOWS_normal.jpg
284,35084736,1.45307E+18,1635274744,roguewarde,"Yesterday's bomb cyclone while riding the Amtrak &amp;
searching for a home during a global pandemic

#BombCyclone #Covid_19 #amtrak #californiarain 
https://t.co/NKe1JbrNnz via @roguewarde",Twitter Web App,189,NA,NA,NA,FALSE,FALSE,0,0,NA,NA,"c(""BombCyclone"", ""Covid_19"", ""amtrak"", ""californiarain"")",NA,theroguevoice.com/bomb-cyclone-o…,https://t.co/NKe1JbrNnz,https://theroguevoice.com/bomb-cyclone-on-the-amtrak/,NA,NA,NA,NA,NA,NA,NA,NA,35084736,roguewarde,en,NA,NA,NA,NA,NA,NA,NA,NA,NA,NA,NA,NA,NA,NA,NA,NA,NA,NA,NA,NA,NA,NA,NA,NA,NA,NA,NA,NA,NA,NA,NA,NA,NA,NA,NA,NA,"c(NA, NA)","c(NA, NA)","c(NA, NA, NA, NA, NA, NA, NA, NA)",https://twitter.com/roguewarde/status/1453073713675472896,stacey warde,California,"Former chicken wrangler, blueberry grower, & farmhand. Writer & agitator. Dreamer. Publisher of The Rogue Voice. #Veteran: Rangers Lead the Way.",https://t.co/aTqJ1aAGIR,FALSE,537,2184,44,17975,4548,1240617778,FALSE,https://t.co/aTqJ1aAGIR,http://theroguevoice.com,NA,https://pbs.twimg.com/profile_banners/35084736/1633708153,http://abs.twimg.com/images/themes/theme8/bg.gif,http://pbs.twimg.com/profile_images/1446254142809206801/4QhkpLzB_normal.jpg
285,35084736,1.45279E+18,1635206453,roguewarde,"Bomb cyclone on the Amtrak https://t.co/0MIp2wpSDp 

#Amtrak #weather #BombCyclone #home",Twitter Web App,88,NA,NA,NA,FALSE,FALSE,0,0,NA,NA,"c(""Amtrak"", ""weather"", ""BombCyclone"", ""home"")",NA,link.medium.com/KgAOuFiGEkb,https://t.co/0MIp2wpSDp,https://link.medium.com/KgAOuFiGEkb,NA,NA,NA,NA,NA,NA,NA,NA,NA,NA,en,NA,NA,NA,NA,NA,NA,NA,NA,NA,NA,NA,NA,NA,NA,NA,NA,NA,NA,NA,NA,NA,NA,NA,NA,NA,NA,NA,NA,NA,NA,NA,NA,NA,NA,NA,NA,"c(NA, NA)","c(NA, NA)","c(NA, NA, NA, NA, NA, NA, NA, NA)",https://twitter.com/roguewarde/status/1452787280704270338,stacey warde,California,"Former chicken wrangler, blueberry grower, & farmhand. Writer & agitator. Dreamer. Publisher of The Rogue Voice. #Veteran: Rangers Lead the Way.",https://t.co/aTqJ1aAGIR,FALSE,537,2184,44,17975,4548,1240617778,FALSE,https://t.co/aTqJ1aAGIR,http://theroguevoice.com,NA,https://pbs.twimg.com/profile_banners/35084736/1633708153,http://abs.twimg.com/images/themes/theme8/bg.gif,http://pbs.twimg.com/profile_images/1446254142809206801/4QhkpLzB_normal.jpg
