233,2242253172,1.45362E+18,1635404896,klipsch1,@Being_Humor @abhisar_sharma which taxi do you drive ? <U+0001F61C>,Twitter for iPhone,43,1.45361E+18,438525539,Being_Humor,FALSE,FALSE,0,0,NA,NA,NA,NA,NA,NA,NA,NA,NA,NA,NA,NA,NA,NA,NA,"c(""438525539"", ""56627441"")","c(""Being_Humor"", ""abhisar_sharma"")",en,NA,NA,NA,NA,NA,NA,NA,NA,NA,NA,NA,NA,NA,NA,NA,NA,NA,NA,NA,NA,NA,NA,NA,NA,NA,NA,NA,NA,NA,NA,NA,NA,NA,NA,NA,NA,"c(NA, NA)","c(NA, NA)","c(NA, NA, NA, NA, NA, NA, NA, NA)",https://twitter.com/klipsch1/status/1453619607852421124,klipsch,"California, USA",born in the USA!,NA,FALSE,28,41,3,155,14276,1386849320,FALSE,NA,NA,NA,https://pbs.twimg.com/profile_banners/2242253172/1482147998,http://abs.twimg.com/images/themes/theme1/bg.png,http://pbs.twimg.com/profile_images/810813792493989888/tZtgA_fv_normal.jpg
234,1.21315E+18,1.45357E+18,1635392091,spaceymila,Since we are in the catalogue of unreleased songs… may I suggest Witness and Taxi <U+0001F617>,Twitter for iPhone,83,NA,NA,NA,FALSE,FALSE,49,3,NA,NA,NA,NA,NA,NA,NA,NA,NA,NA,NA,NA,NA,NA,NA,NA,NA,en,NA,NA,NA,NA,NA,NA,NA,NA,NA,NA,NA,NA,NA,NA,NA,NA,NA,NA,NA,NA,NA,NA,NA,NA,NA,NA,NA,NA,NA,NA,NA,NA,NA,NA,NA,NA,"c(NA, NA)","c(NA, NA)","c(NA, NA, NA, NA, NA, NA, NA, NA)",https://twitter.com/spaceymila/status/1453565900125192193,james <U+0001F349>,"California, USA",he/him | POC,https://t.co/Hw3IPuWhE1,FALSE,912,608,4,9356,43719,1578073598,FALSE,https://t.co/Hw3IPuWhE1,https://open.spotify.com/track/1058fW9H3fZA6QjYCdOBad?si=wyZQYrkKRZ-RJ_JVSMo7Mw&dl_branch=1,NA,https://pbs.twimg.com/profile_banners/1213154675484004352/1632154384,NA,http://pbs.twimg.com/profile_images/1454953073583947776/NdWf_Pju_normal.jpg
235,8.98609E+17,1.45356E+18,1635389787,CryptoRocky,"@puck_beaverton @AaronD84942819 @Meiyoshin @teddyeugene Elon has pushed forward sustainable cars in EVs, not only are they good for our future selves because they don't release toxic gasses, but they are fast, fun, and convenient. When robo taxi is ready it will drop uber costs to 10-20%. What do you do to better humanity? Your turn..",Twitter Web App,280,1.45346E+18,1.37747E+18,puck_beaverton,FALSE,FALSE,0,0,NA,NA,NA,NA,NA,NA,NA,NA,NA,NA,NA,NA,NA,NA,NA,"c(""1377466395349327872"", ""1238009622046228480"", ""2182493300"", ""467466542"")","c(""puck_beaverton"", ""AaronD84942819"", ""Meiyoshin"", ""teddyeugene"")",en,NA,NA,NA,NA,NA,NA,NA,NA,NA,NA,NA,NA,NA,NA,NA,NA,NA,NA,NA,NA,NA,NA,NA,NA,NA,NA,NA,NA,NA,NA,NA,NA,NA,NA,NA,NA,"c(NA, NA)","c(NA, NA)","c(NA, NA, NA, NA, NA, NA, NA, NA)",https://twitter.com/CryptoRocky/status/1453556238550138886,Roc Zacharias,"California, USA","CEO of LDA @LunarAssets

@QuickSwapDEX advisor

Crypto Evangelist

Proud Libertarian

No longer - Elon, Tesla, SpaceX FanBoy

#Bitcoin & DeFi change everything",https://t.co/SpkQkTEwIV,FALSE,13102,7775,84,4246,28622,1503080152,FALSE,https://t.co/SpkQkTEwIV,http://LunarDigitalAssets.io,NA,NA,NA,http://pbs.twimg.com/profile_images/1037545634998276096/WOAsinMl_normal.jpg
236,33024328,1.45355E+18,1635389465,ThatOhioKidRyan,"@CubsZone Position player - @BrennenDavis__ 
Pitcher - how about a lil love for the Taxi Squad hero that willed Happer to a career high in homers; Mr @DMekkes7",Twitter for Android,149,1.45353E+18,1.11163E+18,CubsZone,FALSE,FALSE,0,0,NA,NA,NA,NA,NA,NA,NA,NA,NA,NA,NA,NA,NA,NA,NA,"c(""1111629541578104833"", ""2524403740"", ""1070081089811685382"")","c(""CubsZone"", ""BrennenDavis__"", ""DMekkes7"")",en,NA,NA,NA,NA,NA,NA,NA,NA,NA,NA,NA,NA,NA,NA,NA,NA,NA,NA,NA,NA,NA,NA,NA,NA,NA,NA,NA,NA,NA,NA,NA,NA,NA,NA,NA,NA,"c(NA, NA)","c(NA, NA)","c(NA, NA, NA, NA, NA, NA, NA, NA)",https://twitter.com/ThatOhioKidRyan/status/1453554886373691403,Ryan S,"Fredericksburg, VA","32 - OH native, VA Living - 
#GirlDad to twins - 
Cubs, Cavs, Eagles, Caps - 
12 yr Navy Vet <U+0001F1FA><U+0001F1F8><U+2693> - 
OH/IL/FLx3/JPN/HI/VA -
often playing devil's advocate",NA,FALSE,462,2238,7,25198,61049,1240091443,FALSE,NA,NA,NA,https://pbs.twimg.com/profile_banners/33024328/1626347183,http://abs.twimg.com/images/themes/theme1/bg.png,http://pbs.twimg.com/profile_images/1446103889464414208/--yHswL-_normal.jpg
237,90250059,1.45354E+18,1635386611,AssailedLoner,"“No Way Out”: Taxi Drivers, Allies Enter 2nd Week of Hunger Strike Against Crushing Medallion Debt https://t.co/YuRWouMUCU via @YouTube",Twitter Web App,135,NA,NA,NA,FALSE,FALSE,0,0,NA,NA,NA,NA,youtu.be/ber6qF5JOuw,https://t.co/YuRWouMUCU,https://youtu.be/ber6qF5JOuw,NA,NA,NA,NA,NA,NA,NA,NA,10228272,YouTube,en,NA,NA,NA,NA,NA,NA,NA,NA,NA,NA,NA,NA,NA,NA,NA,NA,NA,NA,NA,NA,NA,NA,NA,NA,NA,NA,NA,NA,NA,NA,NA,NA,NA,NA,NA,NA,"c(NA, NA)","c(NA, NA)","c(NA, NA, NA, NA, NA, NA, NA, NA)",https://twitter.com/AssailedLoner/status/1453542917075734528,D. R.,"California, USA","Hello there. I mostly retweet info I think is important. I hope you're keeping safe, staying informed, and taking action to make the world better for everybody.",NA,FALSE,85,397,1,18603,423,1258319830,FALSE,NA,NA,NA,https://pbs.twimg.com/profile_banners/90250059/1588461971,http://abs.twimg.com/images/themes/theme14/bg.gif,http://pbs.twimg.com/profile_images/1437198416082178051/bUiI-xXp_normal.jpg
238,1.15121E+18,1.45352E+18,1635381969,debidiamonds,@TohoKingdom Finally home after work &amp; the dreaded Costco run. Had some soup <U+0001F35C> &amp; im ready to take a relaxey taxi.,Twitter for iPhone,108,1.45348E+18,2300848045,TohoKingdom,FALSE,FALSE,0,0,NA,NA,NA,NA,NA,NA,NA,NA,NA,NA,NA,NA,NA,NA,NA,2300848045,TohoKingdom,en,NA,NA,NA,NA,NA,NA,NA,NA,NA,NA,NA,NA,NA,NA,NA,NA,NA,NA,NA,NA,NA,NA,NA,NA,NA,NA,NA,NA,NA,NA,NA,NA,NA,NA,NA,NA,"c(NA, NA)","c(NA, NA)","c(NA, NA, NA, NA, NA, NA, NA, NA)",https://twitter.com/debidiamonds/status/1453523446147649540,debidiamonds,"California, USA<U+0001F637>",I am a world that cannot be explored in one day. I am not a place for cowards. ~ Caitlyn Siehl,NA,FALSE,1794,3065,2,39565,124815,1563303941,FALSE,NA,NA,NA,https://pbs.twimg.com/profile_banners/1151206282965049344/1612842023,NA,http://pbs.twimg.com/profile_images/1414441542790516742/41CQYD6c_normal.jpg
239,1969987273,1.45351E+18,1635377811,BabaAgyat,"@BerkleytheG @Teslaconomics if you look at the Taxi/ridesharing model, the whole cost aspect is coming from labor/drivers. so the bet is going to be on the software (autonomy) rather than the hardware(EV)
That is why I think they will go with Tesla",Twitter Web App,220,1.4535E+18,1.12977E+18,BerkleytheG,FALSE,FALSE,0,0,NA,NA,NA,NA,NA,NA,NA,NA,NA,NA,NA,NA,NA,NA,NA,"c(""1129768480402632704"", ""985243593538338816"")","c(""BerkleytheG"", ""Teslaconomics"")",en,NA,NA,NA,NA,NA,NA,NA,NA,NA,NA,NA,NA,NA,NA,NA,NA,NA,NA,NA,NA,NA,NA,NA,NA,NA,NA,NA,NA,NA,NA,NA,NA,NA,NA,NA,NA,"c(NA, NA)","c(NA, NA)","c(NA, NA, NA, NA, NA, NA, NA, NA)",https://twitter.com/BabaAgyat/status/1453506004813959168,Harry,"California, USA",I Bleed Scarlet and Gray,NA,FALSE,108,214,2,3642,1804,1382145204,FALSE,NA,NA,NA,NA,http://abs.twimg.com/images/themes/theme1/bg.png,http://pbs.twimg.com/profile_images/1302778345994809344/jfZRiGLT_normal.jpg
240,1.24893E+18,1.4535E+18,1635375574,MxssLadyBxtch,Taxi cheaper than Uber,Twitter for iPhone,22,NA,NA,NA,FALSE,FALSE,3,1,NA,NA,NA,NA,NA,NA,NA,NA,NA,NA,NA,NA,NA,NA,NA,NA,NA,en,NA,NA,NA,NA,NA,NA,NA,NA,NA,NA,NA,NA,NA,NA,NA,NA,NA,NA,NA,NA,NA,NA,NA,NA,NA,NA,NA,NA,NA,NA,https://api.twitter.com/1.1/geo/id/01fbe706f872cb32.json,Washington,"Washington, DC",city,United States,US,"c(NA, NA)","c(NA, NA)","c(-77.119401, -76.909396, -76.909396, -77.119401, 38.801826, 38.801826, 38.9953797, 38.9953797)",https://twitter.com/MxssLadyBxtch/status/1453496625394032642,Champagne Naki,"Little Rock, AR","flower child, beautiful child, I'm in MY zone <U+0001F49C><U+0001F989>",NA,FALSE,4151,2958,5,70455,115197,1586602793,FALSE,NA,NA,NA,https://pbs.twimg.com/profile_banners/1248928683668234240/1632550420,NA,http://pbs.twimg.com/profile_images/1441649919492694016/YYFKWotN_normal.jpg
241,1.24893E+18,1.4535E+18,1635375992,MxssLadyBxtch,@Thatstrix_ Uber said $56... taxi was only $35. I'm in DC,Twitter for iPhone,45,1.4535E+18,720510182,Thatstrix_,FALSE,FALSE,1,0,NA,NA,NA,NA,NA,NA,NA,NA,NA,NA,NA,NA,NA,NA,NA,720510182,Thatstrix_,en,NA,NA,NA,NA,NA,NA,NA,NA,NA,NA,NA,NA,NA,NA,NA,NA,NA,NA,NA,NA,NA,NA,NA,NA,NA,NA,NA,NA,NA,NA,https://api.twitter.com/1.1/geo/id/01fbe706f872cb32.json,Washington,"Washington, DC",city,United States,US,"c(NA, NA)","c(NA, NA)","c(-77.119401, -76.909396, -76.909396, -77.119401, 38.801826, 38.801826, 38.9953797, 38.9953797)",https://twitter.com/MxssLadyBxtch/status/1453498375865880577,Champagne Naki,"Little Rock, AR","flower child, beautiful child, I'm in MY zone <U+0001F49C><U+0001F989>",NA,FALSE,4151,2958,5,70455,115197,1586602793,FALSE,NA,NA,NA,https://pbs.twimg.com/profile_banners/1248928683668234240/1632550420,NA,http://pbs.twimg.com/profile_images/1441649919492694016/YYFKWotN_normal.jpg
242,19364382,1.45346E+18,1635367395,tobyharnden,@OGA_Ron I’m sure you do! World’s best taxi service.,Twitter for iPhone,43,1.45346E+18,1.27379E+18,OGA_Ron,FALSE,FALSE,2,0,NA,NA,NA,NA,NA,NA,NA,NA,NA,NA,NA,NA,NA,NA,NA,1.27379E+18,OGA_Ron,en,NA,NA,NA,NA,NA,NA,NA,NA,NA,NA,NA,NA,NA,NA,NA,NA,NA,NA,NA,NA,NA,NA,NA,NA,NA,NA,NA,NA,NA,NA,NA,NA,NA,NA,NA,NA,"c(NA, NA)","c(NA, NA)","c(NA, NA, NA, NA, NA, NA, NA, NA)",https://twitter.com/tobyharnden/status/1453462319376343050,Toby Harnden,"McLean, VA",Author “First Casualty: The Untold Story of the CIA Mission to Avenge 9/11” -out Sep 7 https://t.co/FFHKvVrtzk,https://t.co/ZAsnmsoCNf,FALSE,21895,10269,719,51157,2847,1232661666,TRUE,https://t.co/ZAsnmsoCNf,http://www.tobyharnden.com,NA,https://pbs.twimg.com/profile_banners/19364382/1624060236,http://abs.twimg.com/images/themes/theme1/bg.png,http://pbs.twimg.com/profile_images/1401235769130430464/HVg4H1J0_normal.jpg
243,347007101,1.45345E+18,1635365119,DCFitted,"@DCDPW 1 st NW from Channing St NW to Michigan Ave NW needs additional liter cans placed along that entire stretch! Cars parking for the hospitals and taxi drivers taking breaks discard their trash all over.  Trash cans might help, but frequent pickup of garbage needed!",Twitter Web App,263,1.45344E+18,86340250,DCDPW,FALSE,FALSE,1,0,NA,NA,NA,NA,NA,NA,NA,NA,NA,NA,NA,NA,NA,NA,NA,86340250,DCDPW,en,NA,NA,NA,NA,NA,NA,NA,NA,NA,NA,NA,NA,NA,NA,NA,NA,NA,NA,NA,NA,NA,NA,NA,NA,NA,NA,NA,NA,NA,NA,NA,NA,NA,NA,NA,NA,"c(NA, NA)","c(NA, NA)","c(NA, NA, NA, NA, NA, NA, NA, NA)",https://twitter.com/DCFitted/status/1453452774277013511,J.C.,washington dc,,NA,FALSE,61,251,2,1058,1237,1312259220,FALSE,NA,NA,NA,NA,http://abs.twimg.com/images/themes/theme1/bg.png,http://pbs.twimg.com/profile_images/1761478765/image_normal.jpg
244,125767959,1.45345E+18,1635364422,CSISKoreaChair,"8 years after its first attempt to break into South Korea, @Uber plans to shake up the country’s $8 billion taxi market and dethrone local giant @kakaotalk
 in online mobility with the help of SK Telecom Co. @soheefication @business 

https://t.co/UTnEfY33Q0",Twitter Web App,258,NA,NA,NA,FALSE,FALSE,5,1,NA,NA,NA,NA,bloomberg.com/news/articles/…,https://t.co/UTnEfY33Q0,https://www.bloomberg.com/news/articles/2021-10-26/uber-revives-push-into-south-korea-with-help-from-local-partner?srnd=technology-vp,NA,NA,NA,NA,NA,NA,NA,NA,"c(""19103481"", ""121707043"", ""138476941"", ""34713362"")","c(""Uber"", ""kakaotalk"", ""soheefication"", ""business"")",en,NA,NA,NA,NA,NA,NA,NA,NA,NA,NA,NA,NA,NA,NA,NA,NA,NA,NA,NA,NA,NA,NA,NA,NA,NA,NA,NA,NA,NA,NA,NA,NA,NA,NA,NA,NA,"c(NA, NA)","c(NA, NA)","c(NA, NA, NA, NA, NA, NA, NA, NA)",https://twitter.com/CSISKoreaChair/status/1453449848527675404,CSIS Korea Chair,"Washington, DC",@CSIS Korea Chair is an independent platform from which to advance major policy issues of common importance to the Korean & American people. RTs <U+2260> endorsements.,https://t.co/BPHAwhZaPR,FALSE,17332,1294,558,39160,567,1269375831,TRUE,https://t.co/BPHAwhZaPR,https://www.csis.org/programs/korea-chair,NA,https://pbs.twimg.com/profile_banners/125767959/1633103008,http://abs.twimg.com/images/themes/theme9/bg.gif,http://pbs.twimg.com/profile_images/1385079407862296576/kSRF3Inn_normal.jpg
245,3272213102,1.45345E+18,1635363421,accidentguys,"Have you been involved in a taxi accident? 

Watch our latest #tipoftheweek video to get some insight into taxi accidents.

 We can assist you, contact The Accident Guys to help protect your rights, and get you the compensation that you deserve. https://t.co/G4SiGLTrtn",Twitter Web App,245,NA,NA,NA,FALSE,FALSE,0,0,NA,NA,tipoftheweek,NA,NA,NA,NA,http://pbs.twimg.com/ext_tw_video_thumb/1453445481976287234/pu/img/3kuaJJsWScvjBiKP.jpg,https://t.co/G4SiGLTrtn,https://twitter.com/accidentguys/status/1453445651690360838/video/1,photo,http://pbs.twimg.com/ext_tw_video_thumb/1453445481976287234/pu/img/3kuaJJsWScvjBiKP.jpg,https://t.co/G4SiGLTrtn,https://twitter.com/accidentguys/status/1453445651690360838/video/1,NA,NA,NA,en,NA,NA,NA,NA,NA,NA,NA,NA,NA,NA,NA,NA,NA,NA,NA,NA,NA,NA,NA,NA,NA,NA,NA,NA,NA,NA,NA,NA,NA,NA,NA,NA,NA,NA,NA,NA,"c(NA, NA)","c(NA, NA)","c(NA, NA, NA, NA, NA, NA, NA, NA)",https://twitter.com/accidentguys/status/1453445651690360838,The Accident Guys,"California, USA","YOUR Injury Attorneys <U+2696><U+FE0F> 
Clients are always<U+261D><U+FE0F> Everything else<U+270C><U+FE0F>
Get your free consultation <U+0001F53B> with a personal injury lawyer.",https://t.co/TBMHMtUvMO,FALSE,188,39,3,817,1217,1436387276,FALSE,https://t.co/TBMHMtUvMO,http://www.calltheaccidentguys.com/,NA,https://pbs.twimg.com/profile_banners/3272213102/1579820050,http://abs.twimg.com/images/themes/theme1/bg.png,http://pbs.twimg.com/profile_images/1220478626824519680/hSXM1CeU_normal.jpg
246,285119044,1.45343E+18,1635359715,ahmadjavid,"A deluge of militant fighters arrived in Afghanistan. The ISI, meanwhile, galvanized its elaborate network of human informants in major cities from local travel agencies to commercial banks, restaurants, hotels, bakeries, and taxi drivers. /19",Twitter Web App,243,1.45343E+18,285119044,ahmadjavid,FALSE,FALSE,33,6,NA,NA,NA,NA,NA,NA,NA,NA,NA,NA,NA,NA,NA,NA,NA,NA,NA,en,NA,NA,NA,NA,NA,NA,NA,NA,NA,NA,NA,NA,NA,NA,NA,NA,NA,NA,NA,NA,NA,NA,NA,NA,NA,NA,NA,NA,NA,NA,NA,NA,NA,NA,NA,NA,"c(NA, NA)","c(NA, NA)","c(NA, NA, NA, NA, NA, NA, NA, NA)",https://twitter.com/ahmadjavid/status/1453430107801018371,Javid Ahmad,"Washington, DC",Senior Fellow (nonresident) @AtlanticCouncil. Fmr. Afghan ambassador to the UAE.  Views are my own.,https://t.co/oGsZvGNnUJ,FALSE,14617,1536,103,2976,1629,1303312982,TRUE,https://t.co/oGsZvGNnUJ,https://www.atlanticcouncil.org/expert/javid-ahmad/,NA,https://pbs.twimg.com/profile_banners/285119044/1569098251,http://abs.twimg.com/images/themes/theme7/bg.gif,http://pbs.twimg.com/profile_images/1437201426837647366/8xNmi3Nv_normal.jpg
247,1.0791E+18,1.45342E+18,1635357439,RepAOC,"TW: suicide

Over two years ago, we raised the issue of New York taxi drivers becoming victim to predatory lending schemes. They’re drowning in debt. And, heartbreakingly, some have ended their lives.

@NYTWA has been on a hunger strike for over a week. They need a bail out NOW. https://t.co/vTmEBzxGnf",Twitter Media Studio,279,NA,NA,NA,FALSE,FALSE,3501,573,NA,NA,NA,NA,NA,NA,NA,http://pbs.twimg.com/media/FCuWOC5WYAEmdAS.jpg,https://t.co/vTmEBzxGnf,https://twitter.com/RepAOC/status/1453420562060021766/video/1,photo,http://pbs.twimg.com/media/FCuWOC5WYAEmdAS.jpg,https://t.co/vTmEBzxGnf,https://twitter.com/RepAOC/status/1453420562060021766/video/1,NA,182884481,NYTWA,en,NA,NA,NA,NA,NA,NA,NA,NA,NA,NA,NA,NA,NA,NA,NA,NA,NA,NA,NA,NA,NA,NA,NA,NA,NA,NA,NA,NA,NA,NA,NA,NA,NA,NA,NA,NA,"c(NA, NA)","c(NA, NA)","c(NA, NA, NA, NA, NA, NA, NA, NA)",https://twitter.com/RepAOC/status/1453420562060021766,Rep. Alexandria Ocasio-Cortez,"Washington, DC",This account is maintained by federal staff to share services and legislation relevant to constituents of NY-14.,https://t.co/v2uqN2fOcQ,FALSE,714153,581,2937,1191,60,1546113551,TRUE,https://t.co/v2uqN2fOcQ,https://ocasio-cortez.house.gov/,NA,https://pbs.twimg.com/profile_banners/1079104563280527364/1593776403,NA,http://pbs.twimg.com/profile_images/1418224461401235456/iKs5xt4i_normal.jpg
248,1201648940,1.45342E+18,1635357372,Nyxthemoon,"@iotnbok Taxi Driver, acho que tem no Viki",Twitter Web App,33,1.45342E+18,1.19576E+18,iotnbok,FALSE,FALSE,1,0,NA,NA,NA,NA,NA,NA,NA,NA,NA,NA,NA,NA,NA,NA,NA,1.19576E+18,iotnbok,pt,NA,NA,NA,NA,NA,NA,NA,NA,NA,NA,NA,NA,NA,NA,NA,NA,NA,NA,NA,NA,NA,NA,NA,NA,NA,NA,NA,NA,NA,NA,NA,NA,NA,NA,NA,NA,"c(NA, NA)","c(NA, NA)","c(NA, NA, NA, NA, NA, NA, NA, NA)",https://twitter.com/Nyxthemoon/status/1453420278902571008,Mariana <U+263E>,Rivendell,sorry about this,NA,FALSE,84,329,0,6630,26158,1361380607,FALSE,NA,NA,NA,https://pbs.twimg.com/profile_banners/1201648940/1593264088,http://abs.twimg.com/images/themes/theme14/bg.gif,http://pbs.twimg.com/profile_images/1450968244786016256/Of5jPD8m_normal.jpg
249,8919762,1.4534E+18,1635353080,JulesPolonetsky,I gave a big tip to a taxi driver and he gave me this mask thingy that is so nerdy and I love it. Perfect for the current mask on/mask off stage of life. https://t.co/eFXR4lMXlh,Twitter for Android,153,NA,NA,NA,FALSE,FALSE,29,0,NA,NA,NA,NA,NA,NA,NA,http://pbs.twimg.com/media/FCuFqwMXEAk74jI.jpg,https://t.co/eFXR4lMXlh,https://twitter.com/JulesPolonetsky/status/1453402277432242177/photo/1,photo,http://pbs.twimg.com/media/FCuFqwMXEAk74jI.jpg,https://t.co/eFXR4lMXlh,https://twitter.com/JulesPolonetsky/status/1453402277432242177/photo/1,NA,NA,NA,en,NA,NA,NA,NA,NA,NA,NA,NA,NA,NA,NA,NA,NA,NA,NA,NA,NA,NA,NA,NA,NA,NA,NA,NA,NA,NA,NA,NA,NA,NA,https://api.twitter.com/1.1/geo/id/01fbe706f872cb32.json,Washington,"Washington, DC",city,United States,US,"c(NA, NA)","c(NA, NA)","c(-77.119401, -76.909396, -76.909396, -77.119401, 38.801826, 38.801826, 38.9953797, 38.9953797)",https://twitter.com/JulesPolonetsky/status/1453402277432242177,Jules Polonetsky,"ÜT: 38.895812,-77.006402","@futureofprivacy @ILTechPolicy 'privacy' as in risks to individual & society,rights & freedoms, equity, discrimination, power. media@fpf.org",https://t.co/Kjakxge2Wm,FALSE,19655,8779,945,17172,4537,1189981233,TRUE,https://t.co/Kjakxge2Wm,http://about.me/JulesPolonetsky,NA,https://pbs.twimg.com/profile_banners/8919762/1452441366,http://abs.twimg.com/images/themes/theme15/bg.png,http://pbs.twimg.com/profile_images/1367094975821975553/5xSTQ2gR_normal.jpg
250,33777451,1.4534E+18,1635351406,JacMohnson,"@samvanhallgren Coens are the ultimate growers. Even lower tier stuff like The Ladykillers I’ve enjoyed more on rewatch. 

John Ford comes to mind. The first time I saw The Searchers I didn’t get the hype. By the third viewing I was a convert. Fittingly had a similar reaction to Taxi Driver.",Twitter for iPhone,276,1.45339E+18,7379852,samvanhallgren,FALSE,FALSE,1,0,NA,NA,NA,NA,NA,NA,NA,NA,NA,NA,NA,NA,NA,NA,NA,7379852,samvanhallgren,en,NA,NA,NA,NA,NA,NA,NA,NA,NA,NA,NA,NA,NA,NA,NA,NA,NA,NA,NA,NA,NA,NA,NA,NA,NA,NA,NA,NA,NA,NA,NA,NA,NA,NA,NA,NA,"c(NA, NA)","c(NA, NA)","c(NA, NA, NA, NA, NA, NA, NA, NA)",https://twitter.com/JacMohnson/status/1453395254116237321,Mac Johnson,"Alexandria, VA",Catastrophic cog in a microscopic plan,NA,FALSE,96,1366,0,1365,2066,1240281222,FALSE,NA,NA,NA,https://pbs.twimg.com/profile_banners/33777451/1468542269,http://abs.twimg.com/images/themes/theme14/bg.gif,http://pbs.twimg.com/profile_images/753746421942132744/um0UVujw_normal.jpg
251,1.28247E+18,1.45338E+18,1635347425,Danny___Dimes,"@Cooper_DFF @DFBeanCounter That's why I keep chase on my taxi squad this year. Young guys need to earn their keep across a full 17, no shortcuts

Unrelated but I'm 0-7",Twitter Web App,140,1.45337E+18,1.21063E+18,Cooper_DFF,FALSE,FALSE,6,0,NA,NA,NA,NA,NA,NA,NA,NA,NA,NA,NA,NA,NA,NA,NA,"c(""1210634054682468352"", ""360901501"")","c(""Cooper_DFF"", ""DFBeanCounter"")",en,NA,NA,NA,NA,NA,NA,NA,NA,NA,NA,NA,NA,NA,NA,NA,NA,NA,NA,NA,NA,NA,NA,NA,NA,NA,NA,NA,NA,NA,NA,NA,NA,NA,NA,NA,NA,"c(NA, NA)","c(NA, NA)","c(NA, NA, NA, NA, NA, NA, NA, NA)",https://twitter.com/Danny___Dimes/status/1453378559116861448,Daniel Racz,Washington D.C.,part-time best ball guy | the dead zone is a social construct | leader of the Zach Pascal fan club | believed in Brandon Aiyuk,https://t.co/urgnoDUzoy,FALSE,929,1212,8,4280,40481,1594599397,FALSE,https://t.co/urgnoDUzoy,http://AntonioGibszn.com,NA,https://pbs.twimg.com/profile_banners/1282468910802046977/1630253946,NA,http://pbs.twimg.com/profile_images/1282469003286503429/oAiftbNx_normal.jpg
252,9.90805E+17,1.45331E+18,1635331719,iamnotaline,Que sabor ASSISTAM TAXI DRIVER MELHOR DRAMA DE 2021 https://t.co/2hNZhHZ7pm,Twitter for Android,51,NA,NA,NA,TRUE,FALSE,2,1,NA,NA,NA,NA,twitter.com/doramabra/stat…,https://t.co/2hNZhHZ7pm,https://twitter.com/doramabra/status/1453036672552144898,NA,NA,NA,NA,NA,NA,NA,NA,NA,NA,pt,1.45304E+18,DOMINANDO TUDO! <U+0001F5E3> O AMAZON está colocando doramas no catálogo e fica a dúvida se @PrimeVideoBR vai colocar no seu catálogo também! #AnnyeongPrime https://t.co/aN9CyMVXQP,1635265913,Twitter for iPhone,3019,272,2723008215,doramabra,Doramas Brasil,34122,66,2211,,Seja bem-vindo a sua maior fonte de informações sobre dramas coreanos e os atores no Brasil.,FALSE,NA,NA,NA,NA,NA,NA,NA,NA,NA,NA,NA,NA,NA,NA,NA,NA,NA,NA,NA,NA,NA,"c(NA, NA)","c(NA, NA)","c(NA, NA, NA, NA, NA, NA, NA, NA)",https://twitter.com/iamnotaline/status/1453312683072180226,clancy's cells,District 9,#<U+BC29><U+CC2C> • skz • svt •,NA,FALSE,2188,878,11,22536,16589,1525061300,FALSE,NA,NA,NA,https://pbs.twimg.com/profile_banners/990805024409350144/1622829690,http://abs.twimg.com/images/themes/theme1/bg.png,http://pbs.twimg.com/profile_images/1453511653774041095/suXYEusX_normal.jpg
253,9.90805E+17,1.45263E+18,1635168453,iamnotaline,se vier mesmo eu vou indicar taxi driver pra qualquer pessoa que respirar perto de mim https://t.co/FcB71UgUPe,Twitter Web App,86,NA,NA,NA,TRUE,FALSE,0,0,NA,NA,NA,NA,twitter.com/heymatteus/sta…,https://t.co/FcB71UgUPe,https://twitter.com/heymatteus/status/1452371770514853892,NA,NA,NA,NA,NA,NA,NA,NA,NA,NA,pt,1.45237E+18,Dramas que vão pra Prime Video. Não sei se vão vir aqui pra Brasil também https://t.co/ZUVk0ILf2Y,1635107388,Twitter for Android,933,72,1.29878E+18,heymatteus,Mateus <U+25BD> #SabotageCity | D - 89,1967,2230,24606,Hell,CW: Lost- Yumi's Cells - A Man In A Veil - Reflection of You,FALSE,NA,NA,NA,NA,NA,NA,NA,NA,NA,NA,NA,NA,NA,NA,NA,NA,NA,NA,NA,NA,NA,"c(NA, NA)","c(NA, NA)","c(NA, NA, NA, NA, NA, NA, NA, NA)",https://twitter.com/iamnotaline/status/1452627893914374146,clancy's cells,District 9,#<U+BC29><U+CC2C> • skz • svt •,NA,FALSE,2188,878,11,22536,16589,1525061300,FALSE,NA,NA,NA,https://pbs.twimg.com/profile_banners/990805024409350144/1622829690,http://abs.twimg.com/images/themes/theme1/bg.png,http://pbs.twimg.com/profile_images/1453511653774041095/suXYEusX_normal.jpg
254,552966764,1.45331E+18,1635331543,Yimmz,They flogging this black babe that was moving mad in the taxi like No tomorrow. I’m not saying she don’t deserve it but the vim I’m seeing is interesting,Twitter for iPhone,153,NA,NA,NA,FALSE,FALSE,0,0,NA,NA,NA,NA,NA,NA,NA,NA,NA,NA,NA,NA,NA,NA,NA,NA,NA,en,NA,NA,NA,NA,NA,NA,NA,NA,NA,NA,NA,NA,NA,NA,NA,NA,NA,NA,NA,NA,NA,NA,NA,NA,NA,NA,NA,NA,NA,NA,NA,NA,NA,NA,NA,NA,"c(NA, NA)","c(NA, NA)","c(NA, NA, NA, NA, NA, NA, NA, NA)",https://twitter.com/Yimmz/status/1453311942865588227,Who’s Who,Essex,"Consciousness Over Coochie, Politics Over Punani",NA,FALSE,1800,542,17,99461,14023,1334347102,FALSE,NA,NA,NA,https://pbs.twimg.com/profile_banners/552966764/1565385613,http://abs.twimg.com/images/themes/theme1/bg.png,http://pbs.twimg.com/profile_images/1409809186091933702/3CQyBhmA_normal.jpg
255,282456925,1.45328E+18,1635323671,StevePPhotos,"@TfLTPH I’m a PCO driver driving a electric car, as you are aware we lack rapid car chargers in London. But there’s seems to a great number of E Taxi chargers, if desperately needed to charge, can we use E taxi points as I’ve just been abuse by a black cab driver",Twitter for iPhone,263,NA,538103919,TfLTPH,FALSE,FALSE,0,0,NA,NA,NA,NA,NA,NA,NA,NA,NA,NA,NA,NA,NA,NA,NA,538103919,TfLTPH,en,NA,NA,NA,NA,NA,NA,NA,NA,NA,NA,NA,NA,NA,NA,NA,NA,NA,NA,NA,NA,NA,NA,NA,NA,NA,NA,NA,NA,NA,NA,NA,NA,NA,NA,NA,NA,"c(NA, NA)","c(NA, NA)","c(NA, NA, NA, NA, NA, NA, NA, NA)",https://twitter.com/StevePPhotos/status/1453278926533443586,Stephen Philpot,Essex,"Semi-pro Photographer #weddings, #barmitzvahs, #events, #streetphotos I love travelling and most of all I am big Spurs fan #coys #tottenham #photos #photography",https://t.co/YnnAg2sjN6,FALSE,1187,1356,28,3975,470,1302852965,FALSE,https://t.co/YnnAg2sjN6,http://www.stephenphilpotphotography.co.uk,NA,https://pbs.twimg.com/profile_banners/282456925/1505806942,http://abs.twimg.com/images/themes/theme1/bg.png,http://pbs.twimg.com/profile_images/1263555586324602880/692-oKfE_normal.jpg
