,user_id,status_id,created_at,screen_name,text,source,display_text_width,reply_to_status_id,reply_to_user_id,reply_to_screen_name,is_quote,is_retweet,favorite_count,retweet_count,quote_count,reply_count,hashtags,symbols,urls_url,urls_t.co,urls_expanded_url,media_url,media_t.co,media_expanded_url,media_type,ext_media_url,ext_media_t.co,ext_media_expanded_url,ext_media_type,mentions_user_id,mentions_screen_name,lang,quoted_status_id,quoted_text,quoted_created_at,quoted_source,quoted_favorite_count,quoted_retweet_count,quoted_user_id,quoted_screen_name,quoted_name,quoted_followers_count,quoted_friends_count,quoted_statuses_count,quoted_location,quoted_description,quoted_verified,retweet_status_id,retweet_text,retweet_created_at,retweet_source,retweet_favorite_count,retweet_retweet_count,retweet_user_id,retweet_screen_name,retweet_name,retweet_followers_count,retweet_friends_count,retweet_statuses_count,retweet_location,retweet_description,retweet_verified,place_url,place_name,place_full_name,place_type,country,country_code,geo_coords,coords_coords,bbox_coords,status_url,name,location,description,url,protected,followers_count,friends_count,listed_count,statuses_count,favourites_count,account_created_at,verified,profile_url,profile_expanded_url,account_lang,profile_banner_url,profile_background_url,profile_image_url
1,2218356100,1.45562E+18,1635881723,Yourboibflo,"@KxngDeez You said it best… got all the money in the world for an Uber, taxi, anything… agreed 100% with you",Twitter for iPhone,98,1.45562E+18,3259465054,KxngDeez,FALSE,FALSE,1,0,NA,NA,NA,NA,NA,NA,NA,NA,NA,NA,NA,NA,NA,NA,NA,3259465054,KxngDeez,en,NA,NA,NA,NA,NA,NA,NA,NA,NA,NA,NA,NA,NA,NA,NA,NA,NA,NA,NA,NA,NA,NA,NA,NA,NA,NA,NA,NA,NA,NA,NA,NA,NA,NA,NA,NA,"c(NA, NA)","c(NA, NA)","c(NA, NA, NA, NA, NA, NA, NA, NA)",https://twitter.com/Yourboibflo/status/1455619566944591874,Brent Floyd Jr,"Ferndale, MD",Maryland <U+2194><U+FE0F> Tennessee | Tusculum Lacrosse #6 | Set the tone,NA,FALSE,857,1757,4,7422,6201,1386712976,FALSE,NA,NA,NA,https://pbs.twimg.com/profile_banners/2218356100/1634743896,http://abs.twimg.com/images/themes/theme1/bg.png,http://pbs.twimg.com/profile_images/1453410472926007302/6EySPMD3_normal.jpg
2,35312001,1.4556E+18,1635877408,troublesome21,"Couldn’t take an Uber, Lyft, Taxi, even those party vans that take you to strip joints? <U+0001F926><U+0001F3FD><U+200D><U+2642><U+FE0F> prayers to the families who lost a love one today #raiders",Twitter for iPhone,152,NA,NA,NA,FALSE,FALSE,0,0,NA,NA,raiders,NA,NA,NA,NA,NA,NA,NA,NA,NA,NA,NA,NA,NA,NA,en,NA,NA,NA,NA,NA,NA,NA,NA,NA,NA,NA,NA,NA,NA,NA,NA,NA,NA,NA,NA,NA,NA,NA,NA,NA,NA,NA,NA,NA,NA,NA,NA,NA,NA,NA,NA,"c(NA, NA)","c(NA, NA)","c(NA, NA, NA, NA, NA, NA, NA, NA)",https://twitter.com/troublesome21/status/1455601468753342467,villain,California,seasoned vet. power animal: scotch.Born at a very young age. #jaysfordays,NA,FALSE,77,155,0,1772,4425,1240693952,FALSE,NA,NA,NA,https://pbs.twimg.com/profile_banners/35312001/1416761070,http://abs.twimg.com/images/themes/theme9/bg.gif,http://pbs.twimg.com/profile_images/1054783261845549057/QLehRSsX_normal.jpg
3,1.10079E+18,1.4556E+18,1635877336,DistrictDingers,"There ain’t no damn excuse anymore driving drunk, take an Uber, LYFT, taxi, hire a driver, taking peoples lives for your stupid ass is not acceptable.",Twitter for iPhone,150,NA,NA,NA,FALSE,FALSE,20,4,NA,NA,NA,NA,NA,NA,NA,NA,NA,NA,NA,NA,NA,NA,NA,NA,NA,en,NA,NA,NA,NA,NA,NA,NA,NA,NA,NA,NA,NA,NA,NA,NA,NA,NA,NA,NA,NA,NA,NA,NA,NA,NA,NA,NA,NA,NA,NA,NA,NA,NA,NA,NA,NA,"c(NA, NA)","c(NA, NA)","c(NA, NA, NA, NA, NA, NA, NA, NA)",https://twitter.com/DistrictDingers/status/1455601166436478979,District Dingers,"Washington, DC",Punmaster General and Part-Time Podcasters. A podcast for Washington Nationals fans by Washington Nationals fans. Hosted by Jack and Cory #ZimStan,https://t.co/OuYnDsLWyK,FALSE,1239,370,35,18067,19162,1551284482,FALSE,https://t.co/OuYnDsLWyK,https://itunes.apple.com/us/podcast/district-dingers/id1454692501?mt=2,NA,https://pbs.twimg.com/profile_banners/1100793021493329920/1633305059,NA,http://pbs.twimg.com/profile_images/1389014898496217088/Aavj4gIG_normal.jpg
4,48243924,1.4556E+18,1635877148,kingtap08,"Why the fuck don’t these athletes get it , call a fucking Uber or taxi",Twitter for iPhone,70,NA,NA,NA,FALSE,FALSE,1,0,NA,NA,NA,NA,NA,NA,NA,NA,NA,NA,NA,NA,NA,NA,NA,NA,NA,en,NA,NA,NA,NA,NA,NA,NA,NA,NA,NA,NA,NA,NA,NA,NA,NA,NA,NA,NA,NA,NA,NA,NA,NA,NA,NA,NA,NA,NA,NA,NA,NA,NA,NA,NA,NA,"c(NA, NA)","c(NA, NA)","c(NA, NA, NA, NA, NA, NA, NA, NA)",https://twitter.com/kingtap08/status/1455600376451792897,Etap,"California, USA","Bay Area . Raider Nation , Athletics Baseball",NA,FALSE,260,380,5,73159,13447,1245299090,FALSE,NA,NA,NA,https://pbs.twimg.com/profile_banners/48243924/1348101353,http://abs.twimg.com/images/themes/theme1/bg.png,http://pbs.twimg.com/profile_images/1315419381766082560/qW3xD4QU_normal.jpg
5,2247810696,1.4556E+18,1635877057,steadypal,"@ShippySpins Hes in vegas too, not like theres a shortage of drivers,,, lyft uber taxi omg",Twitter for iPhone,77,1.4556E+18,340145838,ShippySpins,FALSE,FALSE,1,0,NA,NA,NA,NA,NA,NA,NA,NA,NA,NA,NA,NA,NA,NA,NA,340145838,ShippySpins,en,NA,NA,NA,NA,NA,NA,NA,NA,NA,NA,NA,NA,NA,NA,NA,NA,NA,NA,NA,NA,NA,NA,NA,NA,NA,NA,NA,NA,NA,NA,NA,NA,NA,NA,NA,NA,"c(NA, NA)","c(NA, NA)","c(NA, NA, NA, NA, NA, NA, NA, NA)",https://twitter.com/steadypal/status/1455599994719793155,Daniel Roberts,"California, USA",,NA,FALSE,33,249,1,11645,150,1387144941,FALSE,NA,NA,NA,NA,http://abs.twimg.com/images/themes/theme1/bg.png,http://pbs.twimg.com/profile_images/905192050542313473/q-6QYNXN_normal.jpg
6,1.33854E+18,1.4556E+18,1635876976,AESMITHPACKFAN,"@Music__Mentor Mr. Jones, Round Here &amp; Big Yellow Taxi.",Twitter for iPhone,44,1.45528E+18,2656796089,Music__Mentor,FALSE,FALSE,1,0,NA,NA,NA,NA,NA,NA,NA,NA,NA,NA,NA,NA,NA,NA,NA,2656796089,Music__Mentor,en,NA,NA,NA,NA,NA,NA,NA,NA,NA,NA,NA,NA,NA,NA,NA,NA,NA,NA,NA,NA,NA,NA,NA,NA,NA,NA,NA,NA,NA,NA,NA,NA,NA,NA,NA,NA,"c(NA, NA)","c(NA, NA)","c(NA, NA, NA, NA, NA, NA, NA, NA)",https://twitter.com/AESMITHPACKFAN/status/1455599655048257540,AE Smith,"California, USA","Gen-X living into Family, Friends, Working Out, stock market riding, Bay Area & Wisconsin Sports Teams & Music. My motto: Control the controllables.",NA,FALSE,194,1347,0,8352,3673,1607967072,FALSE,NA,NA,NA,https://pbs.twimg.com/profile_banners/1338536851804581890/1607973393,NA,http://pbs.twimg.com/profile_images/1434991538472296452/o_Tvx_YN_normal.jpg
7,266217466,1.4556E+18,1635876878,TheSituAsian508,"If you have millions of dollars there’s no reason to not call an Uber, you have enough money to have your car towed back to your house too if you want. Call the Uber, taxi, neighbor, literally anyone to come get you instead of driving drunk https://t.co/lQ2taMwd93",Twitter for iPhone,240,NA,NA,NA,TRUE,FALSE,0,0,NA,NA,NA,NA,twitter.com/bleacherreport…,https://t.co/lQ2taMwd93,https://twitter.com/bleacherreport/status/1455595849623367687,NA,NA,NA,NA,NA,NA,NA,NA,NA,NA,en,1.4556E+18,Raiders WR Henry Ruggs III will be charged with DUI resulting in death after his involvement in a fatal car crash this morning in Las Vegas. He was treated for non-life-threatening injuries. https://t.co/QqFEbZ89pb,1635876068,TweetDeck,19445,3537,890891,BleacherReport,Bleacher Report,10220404,707,147002,,Get the free B/R App,TRUE,NA,NA,NA,NA,NA,NA,NA,NA,NA,NA,NA,NA,NA,NA,NA,NA,NA,NA,NA,NA,NA,"c(NA, NA)","c(NA, NA)","c(NA, NA, NA, NA, NA, NA, NA, NA)",https://twitter.com/TheSituAsian508/status/1455599246510592006,Alex (jeremy wade fan),Harmony Hall,NFL/MLB/NHL/NBA/MLS Free Agent. 1x MHS Football Offensive Player of the Week. Appeared on one (1) episode of Extreme Makeover: Home Edition,NA,FALSE,226,168,10,32608,115228,1300138925,FALSE,NA,NA,NA,https://pbs.twimg.com/profile_banners/266217466/1634572994,http://abs.twimg.com/images/themes/theme1/bg.png,http://pbs.twimg.com/profile_images/1345448174249537536/n3GcazdE_normal.jpg
8,3051664247,1.4556E+18,1635876738,joshuac3vt,@MidgetTamer Now I do. Mark Davis might need to start a taxi service exclusively for the Raiders.,Twitter for iPhone,84,1.4556E+18,388512447,MidgetTamer,FALSE,FALSE,1,0,NA,NA,NA,NA,NA,NA,NA,NA,NA,NA,NA,NA,NA,NA,NA,388512447,MidgetTamer,en,NA,NA,NA,NA,NA,NA,NA,NA,NA,NA,NA,NA,NA,NA,NA,NA,NA,NA,NA,NA,NA,NA,NA,NA,NA,NA,NA,NA,NA,NA,NA,NA,NA,NA,NA,NA,"c(NA, NA)","c(NA, NA)","c(NA, NA, NA, NA, NA, NA, NA, NA)",https://twitter.com/joshuac3vt/status/1455598659622559749,Joshua Carter,"Prince William County, VA","Fan of the Hokies, Raiders, New York Rangers, Braves, Manchester City, & Denny Hamlin. Learning to be an electrician. #RaiderNation #NYR #BattleATL",NA,FALSE,476,1274,16,15558,142329,1424575496,FALSE,NA,NA,NA,https://pbs.twimg.com/profile_banners/3051664247/1591103351,http://abs.twimg.com/images/themes/theme1/bg.png,http://pbs.twimg.com/profile_images/1182086079081570307/P3QsFa9L_normal.jpg
9,7.7036E+17,1.4556E+18,1635876151,Cheetara1986,@ComplexSports @hectormejianews Doesnt the NFL/NFLPA offer Lyft/Uber/Taxi services? Why do athletes think they are invincible to DUI's?,Twitter for Android,103,1.45559E+18,262715431,ComplexSports,FALSE,FALSE,0,0,NA,NA,NA,NA,NA,NA,NA,NA,NA,NA,NA,NA,NA,NA,NA,"c(""262715431"", ""1161372464"")","c(""ComplexSports"", ""hectormejianews"")",en,NA,NA,NA,NA,NA,NA,NA,NA,NA,NA,NA,NA,NA,NA,NA,NA,NA,NA,NA,NA,NA,NA,NA,NA,NA,NA,NA,NA,NA,NA,NA,NA,NA,NA,NA,NA,"c(NA, NA)","c(NA, NA)","c(NA, NA, NA, NA, NA, NA, NA, NA)",https://twitter.com/Cheetara1986/status/1455596198249762818,Kristina,"Baltimore, MD",Lives in a Pineapple Under the Sea <U+0001F30A> #BlackLivesMatter,NA,FALSE,488,2415,4,14665,12820,1472503172,FALSE,NA,NA,NA,https://pbs.twimg.com/profile_banners/770360254265561088/1596525609,NA,http://pbs.twimg.com/profile_images/1109887953684348928/twGHqdH-_normal.jpg
10,1.41827E+18,1.4556E+18,1635876087,RestonTaxiSer,We strive to make customer satisfaction our number one priority! #Taxi #AirportTaxi #EventTransportation https://t.co/7bVgTMb5r6 https://t.co/0w6m6txSXz,Sendible,128,NA,NA,NA,FALSE,FALSE,0,0,NA,NA,"c(""Taxi"", ""AirportTaxi"", ""EventTransportation"")",NA,bit.ly/2WadJLn,https://t.co/7bVgTMb5r6,https://bit.ly/2WadJLn,http://pbs.twimg.com/media/FDNQxC_XMAULnwZ.jpg,https://t.co/0w6m6txSXz,https://twitter.com/RestonTaxiSer/status/1455595926962180096/photo/1,photo,http://pbs.twimg.com/media/FDNQxC_XMAULnwZ.jpg,https://t.co/0w6m6txSXz,https://twitter.com/RestonTaxiSer/status/1455595926962180096/photo/1,NA,NA,NA,en,NA,NA,NA,NA,NA,NA,NA,NA,NA,NA,NA,NA,NA,NA,NA,NA,NA,NA,NA,NA,NA,NA,NA,NA,NA,NA,NA,NA,NA,NA,NA,NA,NA,NA,NA,NA,"c(NA, NA)","c(NA, NA)","c(NA, NA, NA, NA, NA, NA, NA, NA)",https://twitter.com/RestonTaxiSer/status/1455595926962180096,Reston Taxi Services LLC,"Herndon, VA ","Reston Taxi Services LLC Offers Taxi Services in Herndon, VA 20171",https://t.co/NvJfYSP1ZE,FALSE,0,0,0,17,0,1626976568,FALSE,https://t.co/NvJfYSP1ZE,https://taxiherndon.com/,NA,https://pbs.twimg.com/profile_banners/1418268540667195394/1627080102,NA,http://pbs.twimg.com/profile_images/1418702813203365888/KF8mJ4zG_normal.jpg
11,1.14881E+18,1.45559E+18,1635875509,Nicolas3055,Fuck man wtf is wrong with mfs call a fucking Uber or taxi why tf are you driving drunk,Twitter for iPhone,87,NA,NA,NA,FALSE,FALSE,1,0,NA,NA,NA,NA,NA,NA,NA,NA,NA,NA,NA,NA,NA,NA,NA,NA,NA,en,NA,NA,NA,NA,NA,NA,NA,NA,NA,NA,NA,NA,NA,NA,NA,NA,NA,NA,NA,NA,NA,NA,NA,NA,NA,NA,NA,NA,NA,NA,NA,NA,NA,NA,NA,NA,"c(NA, NA)","c(NA, NA)","c(NA, NA, NA, NA, NA, NA, NA, NA)",https://twitter.com/Nicolas3055/status/1455593504051122181,Nicolas,"California, USA",,NA,FALSE,103,630,0,1059,33714,1562732904,FALSE,NA,NA,NA,https://pbs.twimg.com/profile_banners/1148811181206884352/1605748905,NA,http://pbs.twimg.com/profile_images/1406728807566897154/p4XlCcW1_normal.jpg
12,120220479,1.45558E+18,1635872537,AAHI_Info,"The Montgomery County Department of Transportation is offering residents 65+ and residents with disabilities, a FREE taxi service to COVID-19 vaccination and testing. Please see the picture for more details. https://t.co/og98jMwmiE",Hootsuite Inc.,207,NA,NA,NA,FALSE,FALSE,0,0,NA,NA,NA,NA,NA,NA,NA,http://pbs.twimg.com/media/FDNDPW7WEAwn5iG.jpg,https://t.co/og98jMwmiE,https://twitter.com/AAHI_Info/status/1455581038567202820/photo/1,photo,http://pbs.twimg.com/media/FDNDPW7WEAwn5iG.jpg,https://t.co/og98jMwmiE,https://twitter.com/AAHI_Info/status/1455581038567202820/photo/1,NA,NA,NA,en,NA,NA,NA,NA,NA,NA,NA,NA,NA,NA,NA,NA,NA,NA,NA,NA,NA,NA,NA,NA,NA,NA,NA,NA,NA,NA,NA,NA,NA,NA,NA,NA,NA,NA,NA,NA,"c(NA, NA)","c(NA, NA)","c(NA, NA, NA, NA, NA, NA, NA, NA)",https://twitter.com/AAHI_Info/status/1455581038567202820,Asian American Health Initiative (AAHI),"Rockville, MD","Part of the Montgomery County, MD Department of Health and Human Services. Our mission is to improve the health and wellness of Asian Americans in MoCo.",http://t.co/DPhCi8yT8Q,FALSE,390,169,21,3444,265,1267822398,FALSE,http://t.co/DPhCi8yT8Q,http://www.AAHIinfo.org,NA,NA,http://abs.twimg.com/images/themes/theme1/bg.png,http://pbs.twimg.com/profile_images/604034355120340992/6EnSQB2l_normal.png
13,120220479,1.45304E+18,1635267715,AAHI_Info,"The Montgomery County Department of Transportation is offering residents 65+ and residents with disabilities, a FREE taxi service to COVID-19 vaccination and testing. Please see the picture for more details. https://t.co/KK1glAXYyN",Hootsuite Inc.,207,NA,NA,NA,FALSE,FALSE,1,1,NA,NA,NA,NA,NA,NA,NA,http://pbs.twimg.com/media/FCpABx1XIAEVBxr.jpg,https://t.co/KK1glAXYyN,https://twitter.com/AAHI_Info/status/1453044232244105218/photo/1,photo,http://pbs.twimg.com/media/FCpABx1XIAEVBxr.jpg,https://t.co/KK1glAXYyN,https://twitter.com/AAHI_Info/status/1453044232244105218/photo/1,NA,NA,NA,en,NA,NA,NA,NA,NA,NA,NA,NA,NA,NA,NA,NA,NA,NA,NA,NA,NA,NA,NA,NA,NA,NA,NA,NA,NA,NA,NA,NA,NA,NA,NA,NA,NA,NA,NA,NA,"c(NA, NA)","c(NA, NA)","c(NA, NA, NA, NA, NA, NA, NA, NA)",https://twitter.com/AAHI_Info/status/1453044232244105218,Asian American Health Initiative (AAHI),"Rockville, MD","Part of the Montgomery County, MD Department of Health and Human Services. Our mission is to improve the health and wellness of Asian Americans in MoCo.",http://t.co/DPhCi8yT8Q,FALSE,390,169,21,3444,265,1267822398,FALSE,http://t.co/DPhCi8yT8Q,http://www.AAHIinfo.org,NA,NA,http://abs.twimg.com/images/themes/theme1/bg.png,http://pbs.twimg.com/profile_images/604034355120340992/6EnSQB2l_normal.png
14,9.2364E+17,1.45557E+18,1635870382,DarrenMargolis_,"Busy roads or not, taxi accidents can happen anywhere and the possibility of yourself being involved always exists!

Here is what you should know about accidents involving taxis: https://t.co/yCt06eCv30

#VehicleAccident #TaxiCollision https://t.co/NJDiAZNLAG",Fanbooster by Traject,235,NA,NA,NA,FALSE,FALSE,0,0,NA,NA,"c(""VehicleAccident"", ""TaxiCollision"")",NA,qoo.ly/3esz3x,https://t.co/yCt06eCv30,https://qoo.ly/3esz3x,http://pbs.twimg.com/media/FDM7BFeWEAAf7QC.png,https://t.co/NJDiAZNLAG,https://twitter.com/DarrenMargolis_/status/1455571999930077188/photo/1,photo,http://pbs.twimg.com/media/FDM7BFeWEAAf7QC.png,https://t.co/NJDiAZNLAG,https://twitter.com/DarrenMargolis_/status/1455571999930077188/photo/1,NA,NA,NA,en,NA,NA,NA,NA,NA,NA,NA,NA,NA,NA,NA,NA,NA,NA,NA,NA,NA,NA,NA,NA,NA,NA,NA,NA,NA,NA,NA,NA,NA,NA,NA,NA,NA,NA,NA,NA,"c(NA, NA)","c(NA, NA)","c(NA, NA, NA, NA, NA, NA, NA, NA)",https://twitter.com/DarrenMargolis_/status/1455571999930077188,"Darren Margolis, PA","Pikesville, MD","Personal Injury Attorney, Workers Compensation.",https://t.co/UjLeNn3eeM,FALSE,75,22,0,883,0,1509047878,FALSE,https://t.co/UjLeNn3eeM,http://www.lawdmpa.com/,NA,https://pbs.twimg.com/profile_banners/923639861516652544/1509626440,NA,http://pbs.twimg.com/profile_images/926066421183889408/RGLnrygd_normal.jpg
15,71159829,1.45556E+18,1635866785,Aleikis,"@Cicmty No reelección, a la altura de Sierra Los Alamitos y Mitra Dorada. Todos terminamos tomando taxi o uber porque es demasiado tiempo.",Twitter for Android,130,1.45556E+18,265220322,Cicmty,FALSE,FALSE,0,0,NA,NA,NA,NA,NA,NA,NA,NA,NA,NA,NA,NA,NA,NA,NA,265220322,Cicmty,es,NA,NA,NA,NA,NA,NA,NA,NA,NA,NA,NA,NA,NA,NA,NA,NA,NA,NA,NA,NA,NA,NA,NA,NA,NA,NA,NA,NA,NA,NA,NA,NA,NA,NA,NA,NA,"c(NA, NA)","c(NA, NA)","c(NA, NA, NA, NA, NA, NA, NA, NA)",https://twitter.com/Aleikis/status/1455556912666365953,Aleikis,Narnia,"I've looked into the eye of this Island, and what I saw... was beautiful...",NA,FALSE,175,387,3,8720,11622,1251948368,FALSE,NA,NA,NA,https://pbs.twimg.com/profile_banners/71159829/1364957418,http://abs.twimg.com/images/themes/theme1/bg.png,http://pbs.twimg.com/profile_images/1290669166/Fringe_hand_normal.jpg
16,3090175267,1.45555E+18,1635865304,DJLeo510,@_D_C_M Get a taxi. They don’t surge as high as the ride shares.,Twitter for iPhone,56,1.45543E+18,329200018,_D_C_M,FALSE,FALSE,0,0,NA,NA,NA,NA,NA,NA,NA,NA,NA,NA,NA,NA,NA,NA,NA,329200018,_D_C_M,en,NA,NA,NA,NA,NA,NA,NA,NA,NA,NA,NA,NA,NA,NA,NA,NA,NA,NA,NA,NA,NA,NA,NA,NA,NA,NA,NA,NA,NA,NA,NA,NA,NA,NA,NA,NA,"c(NA, NA)","c(NA, NA)","c(NA, NA, NA, NA, NA, NA, NA, NA)",https://twitter.com/DJLeo510/status/1455550698716741635,Leo,"California, USA",Mobile DJ | Instagram: #DJLeo510 | O<U+03A8>F ‘15,https://t.co/vvegA8pquH,FALSE,469,616,1,10428,7114,1426523543,FALSE,https://t.co/vvegA8pquH,https://www.ricentertainment.com/,NA,https://pbs.twimg.com/profile_banners/3090175267/1513759497,http://abs.twimg.com/images/themes/theme1/bg.png,http://pbs.twimg.com/profile_images/1106383547437215744/RrtynFeU_normal.jpg
17,2387065374,1.45555E+18,1635865242,RideOnMCT,Free taxi service to COVID-19 vaccination and testing sites for residents 65+ and residents with disabilities. https://t.co/CAXZso0zyn,Hootsuite Inc.,110,NA,NA,NA,FALSE,FALSE,2,6,NA,NA,NA,NA,NA,NA,NA,http://pbs.twimg.com/media/FDMnaQXWQAEo6Rc.jpg,https://t.co/CAXZso0zyn,https://twitter.com/RideOnMCT/status/1455550438447661060/photo/1,photo,http://pbs.twimg.com/media/FDMnaQXWQAEo6Rc.jpg,https://t.co/CAXZso0zyn,https://twitter.com/RideOnMCT/status/1455550438447661060/photo/1,NA,NA,NA,en,NA,NA,NA,NA,NA,NA,NA,NA,NA,NA,NA,NA,NA,NA,NA,NA,NA,NA,NA,NA,NA,NA,NA,NA,NA,NA,NA,NA,NA,NA,NA,NA,NA,NA,NA,NA,"c(NA, NA)","c(NA, NA)","c(NA, NA, NA, NA, NA, NA, NA, NA)",https://twitter.com/RideOnMCT/status/1455550438447661060,Ride On Bus,"Montgomery County, MD, USA","850 Public Servants, 375 Buses, 75+ Routes, 1,463 Route Miles",https://t.co/d9mvcRv2kQ,FALSE,3113,385,65,8636,2756,1394719900,FALSE,https://t.co/d9mvcRv2kQ,http://www.rideonbus.com,NA,https://pbs.twimg.com/profile_banners/2387065374/1617643311,http://abs.twimg.com/images/themes/theme1/bg.png,http://pbs.twimg.com/profile_images/950850767350587398/tdNDRkoq_normal.jpg
18,2557038228,1.45554E+18,1635863359,311MC311,FREE Taxi service to Covid-19 vaccine &amp; testing appointments for residents 65+ &amp; people with disabilities. To schedule a trip call Connect-A-Ride at 301-738-3252 to get your free taxi code. Then call Action Taxi @ (301) 840-1000; Anytime @ 301-637-9292; Regency @ 301-990-9000. https://t.co/CwJ4mDmnh5,Twitter Web App,285,NA,NA,NA,FALSE,FALSE,1,0,NA,NA,NA,NA,NA,NA,NA,http://pbs.twimg.com/media/FDMgOtYWUAs0npr.jpg,https://t.co/CwJ4mDmnh5,https://twitter.com/311MC311/status/1455542544478130192/photo/1,photo,http://pbs.twimg.com/media/FDMgOtYWUAs0npr.jpg,https://t.co/CwJ4mDmnh5,https://twitter.com/311MC311/status/1455542544478130192/photo/1,NA,NA,NA,en,NA,NA,NA,NA,NA,NA,NA,NA,NA,NA,NA,NA,NA,NA,NA,NA,NA,NA,NA,NA,NA,NA,NA,NA,NA,NA,NA,NA,NA,NA,NA,NA,NA,NA,NA,NA,"c(NA, NA)","c(NA, NA)","c(NA, NA, NA, NA, NA, NA, NA, NA)",https://twitter.com/311MC311/status/1455542544478130192,MontgomeryCoMD311,"Montgomery County, Maryland",MC311 is Montgomery County Government’s Customer Service Center for all non-emergency County inquiries and services. Tweets are monitored M-F 8:00am-4:30pm,https://t.co/eqzfnDfedD,FALSE,2545,708,32,2909,179,1402327618,FALSE,https://t.co/eqzfnDfedD,http://www.mc311.com,NA,https://pbs.twimg.com/profile_banners/2557038228/1617039565,http://abs.twimg.com/images/themes/theme1/bg.png,http://pbs.twimg.com/profile_images/505020459889344512/uS1cGE_h_normal.jpeg
19,2557038228,1.45411E+18,1635520800,311MC311,FREE Taxi service to Covid-19 vaccine &amp; testing appointments for residents 65+ &amp; people with disabilities. To schedule a trip call Connect-A-Ride at 301-738-3252 to get your free taxi code. Then call Action Taxi @ (301) 840-1000; Anytime @ 301-637-9292; Regency @ 301-990-9000. https://t.co/oF0b9aQjoL,Twitter Web App,285,NA,NA,NA,FALSE,FALSE,8,10,NA,NA,NA,NA,NA,NA,NA,http://pbs.twimg.com/media/FC0JVXfWUAYsref.jpg,https://t.co/oF0b9aQjoL,https://twitter.com/311MC311/status/1454105744933015559/photo/1,photo,http://pbs.twimg.com/media/FC0JVXfWUAYsref.jpg,https://t.co/oF0b9aQjoL,https://twitter.com/311MC311/status/1454105744933015559/photo/1,NA,NA,NA,en,NA,NA,NA,NA,NA,NA,NA,NA,NA,NA,NA,NA,NA,NA,NA,NA,NA,NA,NA,NA,NA,NA,NA,NA,NA,NA,NA,NA,NA,NA,NA,NA,NA,NA,NA,NA,"c(NA, NA)","c(NA, NA)","c(NA, NA, NA, NA, NA, NA, NA, NA)",https://twitter.com/311MC311/status/1454105744933015559,MontgomeryCoMD311,"Montgomery County, Maryland",MC311 is Montgomery County Government’s Customer Service Center for all non-emergency County inquiries and services. Tweets are monitored M-F 8:00am-4:30pm,https://t.co/eqzfnDfedD,FALSE,2545,708,32,2909,179,1402327618,FALSE,https://t.co/eqzfnDfedD,http://www.mc311.com,NA,https://pbs.twimg.com/profile_banners/2557038228/1617039565,http://abs.twimg.com/images/themes/theme1/bg.png,http://pbs.twimg.com/profile_images/505020459889344512/uS1cGE_h_normal.jpeg
20,59954854,1.45553E+18,1635860919,MrTinDC,@jriskus Interesting! Adding take-off &amp; landing cycles like that sounds hard on the airframe. They should just taxi the whole way on I-95! <U+0001F602>,Twitter Web App,135,1.45553E+18,18189188,jriskus,FALSE,FALSE,1,0,NA,NA,NA,NA,NA,NA,NA,NA,NA,NA,NA,NA,NA,NA,NA,18189188,jriskus,en,NA,NA,NA,NA,NA,NA,NA,NA,NA,NA,NA,NA,NA,NA,NA,NA,NA,NA,NA,NA,NA,NA,NA,NA,NA,NA,NA,NA,NA,NA,NA,NA,NA,NA,NA,NA,"c(NA, NA)","c(NA, NA)","c(NA, NA, NA, NA, NA, NA, NA, NA)",https://twitter.com/MrTinDC/status/1455532308392517640,Mr. T in DC,"Washington, DC","DC <U+27A1><U+FE0F> PG, #BikeDC, #BikeMD, photographer, birdwatcher, transit advocate, YIMBY, boats/ships lover, cat dad, married to an expert knitter. He/him.",https://t.co/9EwA44mDeb,FALSE,3120,2503,135,93527,95197,1248488697,FALSE,https://t.co/9EwA44mDeb,http://www.flickr.com/photos/mr_t_in_dc/,NA,https://pbs.twimg.com/profile_banners/59954854/1615255828,http://abs.twimg.com/images/themes/theme1/bg.png,http://pbs.twimg.com/profile_images/771064969127485440/pwGn3U08_normal.jpg
21,48832137,1.45553E+18,1635860128,Lakotasky,Channing Tatum &amp; Zoë Kravitz confirm they are a couple by going Instagram official on Halloween.   https://t.co/F3RIl9uTYL via @HollywoodLife,Twitter Web App,145,NA,NA,NA,FALSE,FALSE,0,0,NA,NA,NA,NA,hollywoodlife.com/2021/11/02/cha…,https://t.co/F3RIl9uTYL,https://hollywoodlife.com/2021/11/02/channing-tatum-zoe-kravitz-taxi-driver-halloween-costumes-photo/,NA,NA,NA,NA,NA,NA,NA,NA,21246105,HollywoodLife,en,NA,NA,NA,NA,NA,NA,NA,NA,NA,NA,NA,NA,NA,NA,NA,NA,NA,NA,NA,NA,NA,NA,NA,NA,NA,NA,NA,NA,NA,NA,NA,NA,NA,NA,NA,NA,"c(NA, NA)","c(NA, NA)","c(NA, NA, NA, NA, NA, NA, NA, NA)",https://twitter.com/Lakotasky/status/1455528990706384896,T.F.,"Washington, DC",Love is never afraid of giving too much.,NA,FALSE,2328,1805,31,108638,20433,1245446222,FALSE,NA,NA,NA,https://pbs.twimg.com/profile_banners/48832137/1465915880,http://abs.twimg.com/images/themes/theme10/bg.gif,http://pbs.twimg.com/profile_images/742732415102242816/nkJTU4uy_normal.jpg
22,162066760,1.45551E+18,1635856218,AFHF,"1947:The Howard Hughes H-4 Hercules, “The Spruce Goose,” after a number of taxi runs, makes its first and only flight in the Los Angeles Harbor. It travels about a mile. https://t.co/4BTFM8hpvD",Hootsuite Inc.,169,NA,NA,NA,FALSE,FALSE,32,6,NA,NA,NA,NA,NA,NA,NA,http://pbs.twimg.com/media/FDME_MqXoAMc8EW.jpg,https://t.co/4BTFM8hpvD,https://twitter.com/AFHF/status/1455512589606195212/photo/1,photo,http://pbs.twimg.com/media/FDME_MqXoAMc8EW.jpg,https://t.co/4BTFM8hpvD,https://twitter.com/AFHF/status/1455512589606195212/photo/1,NA,NA,NA,en,NA,NA,NA,NA,NA,NA,NA,NA,NA,NA,NA,NA,NA,NA,NA,NA,NA,NA,NA,NA,NA,NA,NA,NA,NA,NA,NA,NA,NA,NA,NA,NA,NA,NA,NA,NA,"c(NA, NA)","c(NA, NA)","c(NA, NA, NA, NA, NA, NA, NA, NA)",https://twitter.com/AFHF/status/1455512589606195212,Air Force Historical Foundation,Andrews Air Force Base,"The recognized guardian of the history and legacy of the U.S. Air Force and the U.S. Space Force...Know the Past, Shape the Future.",https://t.co/8xsF7lZAFF,FALSE,2465,1111,86,9977,89,1278082725,FALSE,https://t.co/8xsF7lZAFF,http://www.afhistory.org,NA,https://pbs.twimg.com/profile_banners/162066760/1631702788,http://abs.twimg.com/images/themes/theme9/bg.gif,http://pbs.twimg.com/profile_images/1437888428360847369/d5rdcBYj_normal.jpg
23,7.75833E+17,1.45548E+18,1635847893,JackduORleans,@WilkinsonCape ZA may be aged by African standards but it's still young enough the elderly have no impact aside from pre apartheid heroes making bank in Pretoria and no one would be as capable of voter intimidation as the taxi party. The ANC is hurting but bantu nationalism isn't going to die,Twitter for Android,278,1.45547E+18,58277004,WilkinsonCape,FALSE,FALSE,1,0,NA,NA,NA,NA,NA,NA,NA,NA,NA,NA,NA,NA,NA,NA,NA,58277004,WilkinsonCape,en,NA,NA,NA,NA,NA,NA,NA,NA,NA,NA,NA,NA,NA,NA,NA,NA,NA,NA,NA,NA,NA,NA,NA,NA,NA,NA,NA,NA,NA,NA,NA,NA,NA,NA,NA,NA,"c(NA, NA)","c(NA, NA)","c(NA, NA, NA, NA, NA, NA, NA, NA)",https://twitter.com/JackduORleans/status/1455477673690599426,"JackOrleans, oceans interactive's great flop","Washington, USA","Hiya I'm jack. Washington state, I love our evergreens and mountains.",NA,FALSE,154,819,3,27757,25316,1473808049,FALSE,NA,NA,NA,https://pbs.twimg.com/profile_banners/775833306692595712/1473808558,NA,http://pbs.twimg.com/profile_images/1448843539987709952/dUGkwgEq_normal.jpg
