141,1.00181E+18,1.45454E+18,1635625008,Artec7793,@Nephilim225 Here this one is for the road and it's on the house. I'll call you a taxi er ambulance.,Twitter Web App,87,1.45454E+18,9.76349E+17,Nephilim225,FALSE,FALSE,3,0,NA,NA,NA,NA,NA,NA,NA,NA,NA,NA,NA,NA,NA,NA,NA,9.76349E+17,Nephilim225,en,NA,NA,NA,NA,NA,NA,NA,NA,NA,NA,NA,NA,NA,NA,NA,NA,NA,NA,NA,NA,NA,NA,NA,NA,NA,NA,NA,NA,NA,NA,NA,NA,NA,NA,NA,NA,"c(NA, NA)","c(NA, NA)","c(NA, NA, NA, NA, NA, NA, NA, NA)",https://twitter.com/Artec7793/status/1454542827879231488,Valkyrie_7793,"California, USA","Retired airline pilot, open-wheel racer marooned on an insane planet.  Where is the rescue ship, I want off.  Out, out brief candle...",NA,FALSE,686,314,0,17302,9991,1527685818,FALSE,NA,NA,NA,https://pbs.twimg.com/profile_banners/1001813051060842496/1528757608,http://abs.twimg.com/images/themes/theme1/bg.png,http://pbs.twimg.com/profile_images/1332662892101943299/nTy_emTb_normal.jpg
142,8.80112E+17,1.45454E+18,1635624871,TheChestnutPost,‘Flying taxi’ prototype at Rome’s airport https://t.co/sFItzFnFqb,WordPress.com,65,NA,NA,NA,FALSE,FALSE,0,0,NA,NA,NA,NA,thechestnutpost.com/news/flying-ta…,https://t.co/sFItzFnFqb,https://www.thechestnutpost.com/news/flying-taxi-prototype-at-romes-airport/,NA,NA,NA,NA,NA,NA,NA,NA,NA,NA,en,NA,NA,NA,NA,NA,NA,NA,NA,NA,NA,NA,NA,NA,NA,NA,NA,NA,NA,NA,NA,NA,NA,NA,NA,NA,NA,NA,NA,NA,NA,NA,NA,NA,NA,NA,NA,"c(NA, NA)","c(NA, NA)","c(NA, NA, NA, NA, NA, NA, NA, NA)",https://twitter.com/TheChestnutPost/status/1454542251774906373,The Chestnut Post,"Washington, DC",Latest in Breaking News,https://t.co/jbLmk5sxqZ,FALSE,220,0,4,326030,5,1498670104,FALSE,https://t.co/jbLmk5sxqZ,http://TheChestnutPost.com,NA,https://pbs.twimg.com/profile_banners/880112324987822082/1548019464,NA,http://pbs.twimg.com/profile_images/1087098624545153025/56X9wjaa_normal.jpg
143,8.80112E+17,1.45349E+18,1635374697,TheChestnutPost,Presentan prototipo de taxi aéreo eléctrico – Las Noticias https://t.co/EJpWRyp0pN,WordPress.com,82,NA,NA,NA,FALSE,FALSE,0,0,NA,NA,NA,NA,thechestnutpost.com/news/presentan…,https://t.co/EJpWRyp0pN,https://www.thechestnutpost.com/news/presentan-prototipo-de-taxi-aereo-electrico-las-noticias/,NA,NA,NA,NA,NA,NA,NA,NA,NA,NA,es,NA,NA,NA,NA,NA,NA,NA,NA,NA,NA,NA,NA,NA,NA,NA,NA,NA,NA,NA,NA,NA,NA,NA,NA,NA,NA,NA,NA,NA,NA,NA,NA,NA,NA,NA,NA,"c(NA, NA)","c(NA, NA)","c(NA, NA, NA, NA, NA, NA, NA, NA)",https://twitter.com/TheChestnutPost/status/1453492947207561225,The Chestnut Post,"Washington, DC",Latest in Breaking News,https://t.co/jbLmk5sxqZ,FALSE,220,0,4,326030,5,1498670104,FALSE,https://t.co/jbLmk5sxqZ,http://TheChestnutPost.com,NA,https://pbs.twimg.com/profile_banners/880112324987822082/1548019464,NA,http://pbs.twimg.com/profile_images/1087098624545153025/56X9wjaa_normal.jpg
144,88497115,1.45454E+18,1635623533,zamattiac,Guy just tried to wave down the metro like it was a taxi,Twitter for iPhone,56,NA,NA,NA,FALSE,FALSE,2,0,NA,NA,NA,NA,NA,NA,NA,NA,NA,NA,NA,NA,NA,NA,NA,NA,NA,en,NA,NA,NA,NA,NA,NA,NA,NA,NA,NA,NA,NA,NA,NA,NA,NA,NA,NA,NA,NA,NA,NA,NA,NA,NA,NA,NA,NA,NA,NA,NA,NA,NA,NA,NA,NA,"c(NA, NA)","c(NA, NA)","c(NA, NA, NA, NA, NA, NA, NA, NA)",https://twitter.com/zamattiac/status/1454536640412766210,kettlecorn <U+0001F383>,"Washington, DC",• if you don’t like it it wasn’t for you • <U+0001F3F3><U+FE0F><U+200D><U+0001F308><U+2721><U+FE0F>,https://t.co/NbQFTEo8NF,FALSE,273,349,0,2411,4012,1257710792,FALSE,https://t.co/NbQFTEo8NF,https://youtube.com/channel/UCbdAc4zazueNF0advT2Wo3Q,NA,https://pbs.twimg.com/profile_banners/88497115/1459963120,http://abs.twimg.com/images/themes/theme1/bg.png,http://pbs.twimg.com/profile_images/1330510726482563079/KpUihjTA_normal.jpg
145,1.3994E+18,1.45453E+18,1635622338,dameandconfused,The taxi came and I don’t know where I’m going. . . Oh oh oh. https://t.co/7LIzAd023Q,Twitter for iPhone,61,NA,NA,NA,FALSE,FALSE,16,0,NA,NA,NA,NA,NA,NA,NA,http://pbs.twimg.com/media/FC-IziTWEAIp92F.jpg,https://t.co/7LIzAd023Q,https://twitter.com/dameandconfused/status/1454531629209239558/photo/1,photo,http://pbs.twimg.com/media/FC-IziTWEAIp92F.jpg,https://t.co/7LIzAd023Q,https://twitter.com/dameandconfused/status/1454531629209239558/photo/1,NA,NA,NA,en,NA,NA,NA,NA,NA,NA,NA,NA,NA,NA,NA,NA,NA,NA,NA,NA,NA,NA,NA,NA,NA,NA,NA,NA,NA,NA,NA,NA,NA,NA,NA,NA,NA,NA,NA,NA,"c(NA, NA)","c(NA, NA)","c(NA, NA, NA, NA, NA, NA, NA, NA)",https://twitter.com/dameandconfused/status/1454531629209239558,JOHN PAUL GAULTHIER,Narnia,Editor in Chief of Vogue Narnia. IG:dameandconfused,NA,FALSE,2984,496,16,22094,23688,1622478923,FALSE,NA,NA,NA,https://pbs.twimg.com/profile_banners/1399404102421987331/1627132172,NA,http://pbs.twimg.com/profile_images/1449237706005958660/ZhVgpnM-_normal.jpg
146,2573921143,1.4545E+18,1635614832,TamNotTammy,My bad they weren’t just listening to his music they put @lilbaby4PF on a taxi <U+0001F602> talk about an international celebrity!! https://t.co/hizeajj21J https://t.co/GTxGAzKnn8,Twitter for iPhone,144,NA,NA,NA,TRUE,FALSE,0,2,NA,NA,NA,NA,twitter.com/TamNotTammy/st…,https://t.co/hizeajj21J,https://twitter.com/TamNotTammy/status/1454254578082349056,http://pbs.twimg.com/media/FC9sK9WUUAU1Wl2.jpg,https://t.co/GTxGAzKnn8,https://twitter.com/TamNotTammy/status/1454500145794457600/photo/1,photo,http://pbs.twimg.com/media/FC9sK9WUUAU1Wl2.jpg,https://t.co/GTxGAzKnn8,https://twitter.com/TamNotTammy/status/1454500145794457600/photo/1,NA,8.16412E+17,lilbaby4PF,en,1.45425E+18,@simonembanna Bc they grew up watching our tv shows/movies/listening to our music. Black American culture is pretty much thee black culture. Even in Africa kids are wearing NBA jerseys and listening to Lil baby lol,1635556284,Twitter for iPhone,12,2,2573921143,TamNotTammy,Tam,321,1310,29707,California,weekly show available on all streaming platforms #TamTonight,FALSE,NA,NA,NA,NA,NA,NA,NA,NA,NA,NA,NA,NA,NA,NA,NA,NA,NA,NA,NA,NA,NA,"c(NA, NA)","c(NA, NA)","c(NA, NA, NA, NA, NA, NA, NA, NA)",https://twitter.com/TamNotTammy/status/1454500145794457600,Tam,California,weekly show available on all streaming platforms #TamTonight,https://t.co/0KoMY1mJUY,FALSE,321,1310,14,29707,35103,1403055472,FALSE,https://t.co/0KoMY1mJUY,https://linktr.ee/TamTonight,NA,https://pbs.twimg.com/profile_banners/2573921143/1563980309,http://abs.twimg.com/images/themes/theme1/bg.png,http://pbs.twimg.com/profile_images/1017444517362860032/7gPXsw2x_normal.jpg
147,28744559,1.4545E+18,1635613979,peace_harp,"@ProlePumpkin Like nothing is plumb, from the dutched exterior shots that level to the street and let the houses slump sideways, to the nervy handheld in the car...the taxi ride to the airport is so tense, with the motorcycle cops speeding by",Twitter for Android,228,1.4545E+18,28744559,peace_harp,FALSE,FALSE,0,0,NA,NA,NA,NA,NA,NA,NA,NA,NA,NA,NA,NA,NA,NA,NA,514890208,ProlePumpkin,en,NA,NA,NA,NA,NA,NA,NA,NA,NA,NA,NA,NA,NA,NA,NA,NA,NA,NA,NA,NA,NA,NA,NA,NA,NA,NA,NA,NA,NA,NA,NA,NA,NA,NA,NA,NA,"c(NA, NA)","c(NA, NA)","c(NA, NA, NA, NA, NA, NA, NA, NA)",https://twitter.com/peace_harp/status/1454496565226315785,clu,DC,"khomus, circuitry, pigments, graphite, & light. He/him

https://t.co/Wp2E10UViZ",https://t.co/AbkEZrIGk3,FALSE,65,155,2,5588,2124,1238821562,FALSE,https://t.co/AbkEZrIGk3,http://cluuu.bandcamp.com,NA,https://pbs.twimg.com/profile_banners/28744559/1632637698,http://abs.twimg.com/images/themes/theme1/bg.png,http://pbs.twimg.com/profile_images/1187746374839873536/679-y6Yp_normal.jpg
148,414818069,1.45449E+18,1635613160,JFrayWTOP,"@jpttaub ‘76 was an insanely competitive year: Rocky, Network, All the President’s Men, Taxi Driver, Marathon Man, The Omen, Carrie, The Bad News Bears.",Twitter for iPhone,143,1.45449E+18,154608729,jpttaub,FALSE,FALSE,1,0,NA,NA,NA,NA,NA,NA,NA,NA,NA,NA,NA,NA,NA,NA,NA,154608729,jpttaub,en,NA,NA,NA,NA,NA,NA,NA,NA,NA,NA,NA,NA,NA,NA,NA,NA,NA,NA,NA,NA,NA,NA,NA,NA,NA,NA,NA,NA,NA,NA,NA,NA,NA,NA,NA,NA,"c(NA, NA)","c(NA, NA)","c(NA, NA, NA, NA, NA, NA, NA, NA)",https://twitter.com/JFrayWTOP/status/1454493132951801859,Jason Fraley,"Washington, DC",Husband. Movie Guy. @WTOP Entertainment Reporter. Host of @fame_podcast. Screenwriter of “Born Again” and “Cinemagic” (@Coverfly Top 1%).,https://t.co/MQfIrNBELe,FALSE,3397,2151,103,21698,6685,1321540791,TRUE,https://t.co/MQfIrNBELe,https://writers.coverfly.com/profile/writer-a8c93eb54-39748,NA,NA,http://abs.twimg.com/images/themes/theme1/bg.png,http://pbs.twimg.com/profile_images/1441608316115820555/I6xxklCc_normal.jpg
149,3303463492,1.45449E+18,1635611528,noorepi,i remember my dad said when he first came to america and drove taxi he picked up this baseball player for the orioles and they ended up going to lunch,Twitter Web App,150,NA,NA,NA,FALSE,FALSE,1,0,NA,NA,NA,NA,NA,NA,NA,NA,NA,NA,NA,NA,NA,NA,NA,NA,NA,en,NA,NA,NA,NA,NA,NA,NA,NA,NA,NA,NA,NA,NA,NA,NA,NA,NA,NA,NA,NA,NA,NA,NA,NA,NA,NA,NA,NA,NA,NA,NA,NA,NA,NA,NA,NA,"c(NA, NA)","c(NA, NA)","c(NA, NA, NA, NA, NA, NA, NA, NA)",https://twitter.com/noorepi/status/1454486284869767173,zatanna,md,aspiring class traitor & retired philosopher,NA,FALSE,578,1410,6,61371,118724,1432957322,FALSE,NA,NA,NA,https://pbs.twimg.com/profile_banners/3303463492/1624292833,http://abs.twimg.com/images/themes/theme1/bg.png,http://pbs.twimg.com/profile_images/1443226612510728199/ONQgSGWo_normal.jpg
150,474185785,1.45448E+18,1635611025,surcrimV,"Literal que estábamos esperando en taxi, 4 personas. De repente se para un cochazo delante, aparca, abre el maletero, se enciende una pantalla con un dj, suena la música atope, y vienen corriendo desde la calle como 50 personas a bailar la rave",Twitter for Android,244,1.45448E+18,474185785,surcrimV,FALSE,FALSE,0,0,NA,NA,NA,NA,NA,NA,NA,NA,NA,NA,NA,NA,NA,NA,NA,NA,NA,es,NA,NA,NA,NA,NA,NA,NA,NA,NA,NA,NA,NA,NA,NA,NA,NA,NA,NA,NA,NA,NA,NA,NA,NA,NA,NA,NA,NA,NA,NA,NA,NA,NA,NA,NA,NA,"c(NA, NA)","c(NA, NA)","c(NA, NA, NA, NA, NA, NA, NA, NA)",https://twitter.com/surcrimV/status/1454484176556605440,M a n u,Korea,"vivo por ahí. 
yo le he chocado la mano a Faker",https://t.co/PnPES6RfDg,FALSE,324,340,9,20477,531,1327517526,FALSE,https://t.co/PnPES6RfDg,https://www.youtube.com/user/shikamanu120,NA,https://pbs.twimg.com/profile_banners/474185785/1552275378,http://abs.twimg.com/images/themes/theme9/bg.gif,http://pbs.twimg.com/profile_images/988162703301767168/FsEPrp_X_normal.jpg
151,1.22047E+18,1.45448E+18,1635610792,talat01442006,@sftwa @LondonBreed What a shame.Sit in the lap of corporate America and ignore the plight of poor voiceless immigrant Taxi Medallion holders.Even more pathetic when you yourself come from slums of San Francisco.See How easily folks forget their roots and humble beginnings.,Twitter for iPhone,254,1.45429E+18,2781912457,sftwa,FALSE,FALSE,4,2,NA,NA,NA,NA,NA,NA,NA,NA,NA,NA,NA,NA,NA,NA,NA,"c(""2781912457"", ""2927379996"")","c(""sftwa"", ""LondonBreed"")",en,NA,NA,NA,NA,NA,NA,NA,NA,NA,NA,NA,NA,NA,NA,NA,NA,NA,NA,NA,NA,NA,NA,NA,NA,NA,NA,NA,NA,NA,NA,NA,NA,NA,NA,NA,NA,"c(NA, NA)","c(NA, NA)","c(NA, NA, NA, NA, NA, NA, NA, NA)",https://twitter.com/talat01442006/status/1454483200483287040,talat nalaiq,"California, USA",,NA,FALSE,4,25,0,48,108,1579817539,FALSE,NA,NA,NA,NA,NA,http://abs.twimg.com/sticky/default_profile_images/default_profile_normal.png
152,1.22047E+18,1.45417E+18,1635535418,talat01442006,"@sfmta_muni Sfmta great job.But,there is another community,called Sf Taxi Medallion holders that need your attention.Give them something to celebrate as well by solving the Taxi medallion mess that you created .",Twitter for iPhone,199,1.45416E+18,109702390,sfmta_muni,FALSE,FALSE,0,0,NA,NA,NA,NA,NA,NA,NA,NA,NA,NA,NA,NA,NA,NA,NA,109702390,sfmta_muni,en,NA,NA,NA,NA,NA,NA,NA,NA,NA,NA,NA,NA,NA,NA,NA,NA,NA,NA,NA,NA,NA,NA,NA,NA,NA,NA,NA,NA,NA,NA,NA,NA,NA,NA,NA,NA,"c(NA, NA)","c(NA, NA)","c(NA, NA, NA, NA, NA, NA, NA, NA)",https://twitter.com/talat01442006/status/1454167058225111041,talat nalaiq,"California, USA",,NA,FALSE,4,25,0,48,108,1579817539,FALSE,NA,NA,NA,NA,NA,http://abs.twimg.com/sticky/default_profile_images/default_profile_normal.png
153,1.22047E+18,1.45278E+18,1635203532,talat01442006,"@veenadubal Now I know who destroyed Taxi https://t.co/C12mHYWwx0 don’t forget Ed Lee,former mayor,who started this crap,called Uber.These are heartless bunch ,who derive pleasure by inflicting pain on the community that can’t fight back.",Twitter for iPhone,226,1.45269E+18,22837115,veenadubal,FALSE,FALSE,3,0,NA,NA,NA,NA,industry.Here,https://t.co/C12mHYWwx0,http://industry.Here,NA,NA,NA,NA,NA,NA,NA,NA,22837115,veenadubal,en,NA,NA,NA,NA,NA,NA,NA,NA,NA,NA,NA,NA,NA,NA,NA,NA,NA,NA,NA,NA,NA,NA,NA,NA,NA,NA,NA,NA,NA,NA,NA,NA,NA,NA,NA,NA,"c(NA, NA)","c(NA, NA)","c(NA, NA, NA, NA, NA, NA, NA, NA)",https://twitter.com/talat01442006/status/1452775026030112772,talat nalaiq,"California, USA",,NA,FALSE,4,25,0,48,108,1579817539,FALSE,NA,NA,NA,NA,NA,http://abs.twimg.com/sticky/default_profile_images/default_profile_normal.png
154,1.22047E+18,1.45278E+18,1635203863,talat01442006,"@LondonBreed Madam Mayor congratulations on clearing the city so quickly.
Please clear the Taxi medallion mess as well.We taxi drivers have suffered long enough.We want this mayor to solve this crisis as well.",Twitter for iPhone,196,1.45267E+18,2927379996,LondonBreed,FALSE,FALSE,0,0,NA,NA,NA,NA,NA,NA,NA,NA,NA,NA,NA,NA,NA,NA,NA,2927379996,LondonBreed,en,NA,NA,NA,NA,NA,NA,NA,NA,NA,NA,NA,NA,NA,NA,NA,NA,NA,NA,NA,NA,NA,NA,NA,NA,NA,NA,NA,NA,NA,NA,NA,NA,NA,NA,NA,NA,"c(NA, NA)","c(NA, NA)","c(NA, NA, NA, NA, NA, NA, NA, NA)",https://twitter.com/talat01442006/status/1452776413946269696,talat nalaiq,"California, USA",,NA,FALSE,4,25,0,48,108,1579817539,FALSE,NA,NA,NA,NA,NA,http://abs.twimg.com/sticky/default_profile_images/default_profile_normal.png
155,442084884,1.45448E+18,1635609173,fraserpaul6,AJ &amp; PG to share a taxi out from @OfficialQosFC &amp; @officialdafc tonight.....,Twitter Web App,84,NA,NA,NA,FALSE,FALSE,2,0,NA,NA,NA,NA,NA,NA,NA,NA,NA,NA,NA,NA,NA,NA,NA,"c(""161325002"", ""72582858"")","c(""OfficialQosFC"", ""officialdafc"")",en,NA,NA,NA,NA,NA,NA,NA,NA,NA,NA,NA,NA,NA,NA,NA,NA,NA,NA,NA,NA,NA,NA,NA,NA,NA,NA,NA,NA,NA,NA,NA,NA,NA,NA,NA,NA,"c(NA, NA)","c(NA, NA)","c(NA, NA, NA, NA, NA, NA, NA, NA)",https://twitter.com/fraserpaul6/status/1454476409863385092,Paul Fraser,Dumfries,"Queen of the South Fan <U+26BD>
Part-Time Film Maker... 
Enjoy the Theatre <U+0001F3AD>",NA,FALSE,262,717,0,4837,9576,1324406885,FALSE,NA,NA,NA,https://pbs.twimg.com/profile_banners/442084884/1628557379,http://abs.twimg.com/images/themes/theme1/bg.png,http://pbs.twimg.com/profile_images/1454108201104859139/lUsFk07i_normal.jpg
156,114549551,1.45446E+18,1635606241,DougSloan,"@CB82Madness LoL! No. He doesnt. You dont get cut as much as he has if you're halfway decent. He got cut from the Giants taxi squad by a coach that likes him &amp; brought him in after Dallas waived him. He sux. 
Hopefully we wont see him starting for the Cowboys any time this season. https://t.co/JXvB8Yt4mF",Twitter for Android,272,1.45416E+18,1.39739E+18,CB82Madness,FALSE,FALSE,0,0,NA,NA,NA,NA,NA,NA,NA,http://pbs.twimg.com/media/FC9LZn9WUAQC32h.jpg,https://t.co/JXvB8Yt4mF,https://twitter.com/DougSloan/status/1454464110884700171/photo/1,photo,http://pbs.twimg.com/media/FC9LZn9WUAQC32h.jpg,https://t.co/JXvB8Yt4mF,https://twitter.com/DougSloan/status/1454464110884700171/photo/1,NA,1.39739E+18,CB82Madness,en,NA,NA,NA,NA,NA,NA,NA,NA,NA,NA,NA,NA,NA,NA,NA,NA,NA,NA,NA,NA,NA,NA,NA,NA,NA,NA,NA,NA,NA,NA,NA,NA,NA,NA,NA,NA,"c(NA, NA)","c(NA, NA)","c(NA, NA, NA, NA, NA, NA, NA, NA)",https://twitter.com/DougSloan/status/1454464110884700171,Douglass Sloan,"Washington, DC","TV Political Analyst, Democratic Strategist, DC Native & SJC HS Alum.
I SUPPORT COLIN KAEPERNICK.
Views are my own.
BLACK LIVES MATTER <U+270A><U+0001F3FE>
#GetVaccinated",https://t.co/qM4UPI70ZK,FALSE,3198,905,74,114348,24638,1266264211,FALSE,https://t.co/qM4UPI70ZK,https://www.youtube.com/channel/UCz-A6b5ONcKtRhub_VJeOZw,NA,https://pbs.twimg.com/profile_banners/114549551/1626539733,http://abs.twimg.com/images/themes/theme4/bg.gif,http://pbs.twimg.com/profile_images/1361552418182475780/wTsTZl0W_normal.jpg
157,114549551,1.45416E+18,1635534696,DougSloan,"@BryanTheKid47 @CB82Madness @BigOMitchell @TheJAMassey @cowboyscoffetlk @IsomJojuan So the original discussion was is Cam a better option than Cooper Rush. I said emphatically YES, but other fans seem to want to go with a 5yr journeyman who got cut from the Giants taxi squad. <U+0001F937><U+0001F3FE><U+200D><U+2642><U+FE0F> https://t.co/qPlS2SYwvh",Twitter for Android,198,1.45416E+18,2395281691,BryanTheKid47,FALSE,FALSE,0,0,NA,NA,NA,NA,NA,NA,NA,http://pbs.twimg.com/media/FC46ejrXEAgwgZe.jpg,https://t.co/qPlS2SYwvh,https://twitter.com/DougSloan/status/1454164028238991363/photo/1,photo,http://pbs.twimg.com/media/FC46ejrXEAgwgZe.jpg,https://t.co/qPlS2SYwvh,https://twitter.com/DougSloan/status/1454164028238991363/photo/1,NA,"c(""2395281691"", ""1397390803534745605"", ""84370760"", ""783832576024649729"", ""920836927393234944"", ""1260541182595268608"")","c(""BryanTheKid47"", ""CB82Madness"", ""BigOMitchell"", ""TheJAMassey"", ""cowboyscoffetlk"", ""IsomJojuan"")",en,NA,NA,NA,NA,NA,NA,NA,NA,NA,NA,NA,NA,NA,NA,NA,NA,NA,NA,NA,NA,NA,NA,NA,NA,NA,NA,NA,NA,NA,NA,NA,NA,NA,NA,NA,NA,"c(NA, NA)","c(NA, NA)","c(NA, NA, NA, NA, NA, NA, NA, NA)",https://twitter.com/DougSloan/status/1454164028238991363,Douglass Sloan,"Washington, DC","TV Political Analyst, Democratic Strategist, DC Native & SJC HS Alum.
I SUPPORT COLIN KAEPERNICK.
Views are my own.
BLACK LIVES MATTER <U+270A><U+0001F3FE>
#GetVaccinated",https://t.co/qM4UPI70ZK,FALSE,3198,905,74,114348,24638,1266264211,FALSE,https://t.co/qM4UPI70ZK,https://www.youtube.com/channel/UCz-A6b5ONcKtRhub_VJeOZw,NA,https://pbs.twimg.com/profile_banners/114549551/1626539733,http://abs.twimg.com/images/themes/theme4/bg.gif,http://pbs.twimg.com/profile_images/1361552418182475780/wTsTZl0W_normal.jpg
158,1.32689E+18,1.45446E+18,1635604193,esther_livesey,"@susanreadsbooks @AllanGPaterson This is awful, your poor Dad. You must be worried sick. Is your Dad too frail to try getting him into a taxi? I hope he is helped soon.",Twitter for Android,135,1.45441E+18,1.18701E+18,susanreadsbooks,FALSE,FALSE,0,0,NA,NA,NA,NA,NA,NA,NA,NA,NA,NA,NA,NA,NA,NA,NA,"c(""1187008920843366400"", ""540223123"")","c(""susanreadsbooks"", ""AllanGPaterson"")",en,NA,NA,NA,NA,NA,NA,NA,NA,NA,NA,NA,NA,NA,NA,NA,NA,NA,NA,NA,NA,NA,NA,NA,NA,NA,NA,NA,NA,NA,NA,NA,NA,NA,NA,NA,NA,"c(NA, NA)","c(NA, NA)","c(NA, NA, NA, NA, NA, NA, NA, NA)",https://twitter.com/esther_livesey/status/1454455521944166408,Esther <U+0001F1EA><U+0001F1FA><U+0001F54A><U+FE0F><U+262E><U+FE0F>,Oxfordshire,"Woke Rejoiner.  Mother to six humans and two cats. Twins x 2. Opera mum, book lover. #FBPA #FBPE #GTTO #JohnsonOut #WearAMask",NA,FALSE,3115,3045,1,15706,47744,1605189979,FALSE,NA,NA,NA,https://pbs.twimg.com/profile_banners/1326888944538169344/1612539661,NA,http://pbs.twimg.com/profile_images/1426308195706974208/sssyFFoI_normal.jpg
159,104355276,1.45442E+18,1635596487,charlesmanus,@Roy_Bntz @thomaschattwill happy to give my money to taxi drivers again. Uber is a giant scam.,Twitter Web App,67,1.45423E+18,9.56964E+17,Roy_Bntz,FALSE,FALSE,0,0,NA,NA,NA,NA,NA,NA,NA,NA,NA,NA,NA,NA,NA,NA,NA,"c(""956964191931453440"", ""133033883"")","c(""Roy_Bntz"", ""thomaschattwill"")",en,NA,NA,NA,NA,NA,NA,NA,NA,NA,NA,NA,NA,NA,NA,NA,NA,NA,NA,NA,NA,NA,NA,NA,NA,NA,NA,NA,NA,NA,NA,NA,NA,NA,NA,NA,NA,"c(NA, NA)","c(NA, NA)","c(NA, NA, NA, NA, NA, NA, NA, NA)",https://twitter.com/charlesmanus/status/1454423202042679300,Babylonbybus,"Bethesda, MD","Movie buff, Arsenal supporter, avid traveler, amateur cook, music lover, foodie impostor, socially conscious and politically aware..",NA,FALSE,73,174,0,3113,3426,1263350763,FALSE,NA,NA,NA,NA,http://abs.twimg.com/images/themes/theme1/bg.png,http://pbs.twimg.com/profile_images/449476033117683712/MzTu5ErI_normal.jpeg
160,392688294,1.45442E+18,1635595598,St3v3nicy,@CurtisSliwa Taxi driver democrat? https://t.co/ElIwMQtjSt,Twitter for iPhone,21,1.45416E+18,21112251,CurtisSliwa,FALSE,FALSE,0,0,NA,NA,NA,NA,NA,NA,NA,http://pbs.twimg.com/tweet_video_thumb/FC8izIxWYAE5cBN.jpg,https://t.co/ElIwMQtjSt,https://twitter.com/St3v3nicy/status/1454419472203370503/photo/1,photo,http://pbs.twimg.com/tweet_video_thumb/FC8izIxWYAE5cBN.jpg,https://t.co/ElIwMQtjSt,https://twitter.com/St3v3nicy/status/1454419472203370503/photo/1,NA,21112251,CurtisSliwa,en,NA,NA,NA,NA,NA,NA,NA,NA,NA,NA,NA,NA,NA,NA,NA,NA,NA,NA,NA,NA,NA,NA,NA,NA,NA,NA,NA,NA,NA,NA,NA,NA,NA,NA,NA,NA,"c(NA, NA)","c(NA, NA)","c(NA, NA, NA, NA, NA, NA, NA, NA)",https://twitter.com/St3v3nicy/status/1454419472203370503,John Adams Phd,"Washington, DC",Philosophical thinker - Lover of technology. An Enemy of red tape - and a built in radar for BS. If I follow you does not mean I agree with you.,NA,FALSE,401,3063,3,24336,12254,1318854903,FALSE,NA,NA,NA,https://pbs.twimg.com/profile_banners/392688294/1635775659,http://abs.twimg.com/images/themes/theme1/bg.png,http://pbs.twimg.com/profile_images/1347409958996885504/peaA04k__normal.jpg
161,7.8412E+17,1.45442E+18,1635595002,YANNOH_00,@youngb_bravus No táxi,Twitter for Android,7,1.454E+18,8.24398E+17,youngb_bravus,FALSE,FALSE,1,0,NA,NA,NA,NA,NA,NA,NA,NA,NA,NA,NA,NA,NA,NA,NA,8.24398E+17,youngb_bravus,pt,NA,NA,NA,NA,NA,NA,NA,NA,NA,NA,NA,NA,NA,NA,NA,NA,NA,NA,NA,NA,NA,NA,NA,NA,NA,NA,NA,NA,NA,NA,NA,NA,NA,NA,NA,NA,"c(NA, NA)","c(NA, NA)","c(NA, NA, NA, NA, NA, NA, NA, NA)",https://twitter.com/YANNOH_00/status/1454416972620443649,Yano,"California, USA",I'm immortal.. simple,NA,FALSE,132,206,0,9790,6920,1475783686,FALSE,NA,NA,NA,https://pbs.twimg.com/profile_banners/784119729430691840/1539549284,http://abs.twimg.com/images/themes/theme1/bg.png,http://pbs.twimg.com/profile_images/878727022381588481/F6cTVpEa_normal.jpg
162,7.40592E+17,1.45438E+18,1635586422,TwangriLa,Taxi Driver - Anytime Anywhere https://t.co/noxQsKRWjd,TwangriLa Radio Playlist Update,54,NA,NA,NA,FALSE,FALSE,0,0,NA,NA,NA,NA,rdo.to/TWANG,https://t.co/noxQsKRWjd,https://rdo.to/TWANG,NA,NA,NA,NA,NA,NA,NA,NA,NA,NA,en,NA,NA,NA,NA,NA,NA,NA,NA,NA,NA,NA,NA,NA,NA,NA,NA,NA,NA,NA,NA,NA,NA,NA,NA,NA,NA,NA,NA,NA,NA,NA,NA,NA,NA,NA,NA,"c(NA, NA)","c(NA, NA)","c(NA, NA, NA, NA, NA, NA, NA, NA)",https://twitter.com/TwangriLa/status/1454380985928327169,TwangriLa,"Baltimore, MD","Twangrila - Country Music Utopia.  Doing podcasts, music reviews, concert reviews, and whatever we want.  Follow and visit the website: https://t.co/w9lIqhxo8z",NA,FALSE,681,972,16,292647,3546,1465405896,FALSE,NA,NA,NA,https://pbs.twimg.com/profile_banners/740592119732154368/1473969229,NA,http://pbs.twimg.com/profile_images/776509460453986305/H4ParQ35_normal.jpg
163,232257830,1.45438E+18,1635585510,golfguidewriter,Kid’s just been dropped off at football in a taxi… https://t.co/DZhF14Bsw2,Twitter for iPhone,50,NA,NA,NA,FALSE,FALSE,0,0,NA,NA,NA,NA,NA,NA,NA,http://pbs.twimg.com/media/FC78T80WEAA3Zjr.jpg,https://t.co/DZhF14Bsw2,https://twitter.com/golfguidewriter/status/1454377158672007170/photo/1,photo,http://pbs.twimg.com/media/FC78T80WEAA3Zjr.jpg,https://t.co/DZhF14Bsw2,https://twitter.com/golfguidewriter/status/1454377158672007170/photo/1,NA,NA,NA,en,NA,NA,NA,NA,NA,NA,NA,NA,NA,NA,NA,NA,NA,NA,NA,NA,NA,NA,NA,NA,NA,NA,NA,NA,NA,NA,NA,NA,NA,NA,NA,NA,NA,NA,NA,NA,"c(NA, NA)","c(NA, NA)","c(NA, NA, NA, NA, NA, NA, NA, NA)",https://twitter.com/golfguidewriter/status/1454377158672007170,Michael Whitehead,Yorkshire,"Author, The Golf Lover's Guide To Scotland and The Golf Lover's Guide to England - click on the link for further details.",https://t.co/qHzM3HoaaC,FALSE,1218,1316,49,21438,11188,1293729625,FALSE,https://t.co/qHzM3HoaaC,https://linktr.ee/michaelwhitehead,NA,https://pbs.twimg.com/profile_banners/232257830/1598382972,http://abs.twimg.com/images/themes/theme1/bg.png,http://pbs.twimg.com/profile_images/1295276519540043776/LCVmWx6d_normal.jpg
164,7.60702E+17,1.45436E+18,1635581412,TameImpalaBot,Taxi’s here,TameImpalaBot,11,NA,NA,NA,FALSE,FALSE,14,3,NA,NA,NA,NA,NA,NA,NA,NA,NA,NA,NA,NA,NA,NA,NA,NA,NA,en,NA,NA,NA,NA,NA,NA,NA,NA,NA,NA,NA,NA,NA,NA,NA,NA,NA,NA,NA,NA,NA,NA,NA,NA,NA,NA,NA,NA,NA,NA,NA,NA,NA,NA,NA,NA,"c(NA, NA)","c(NA, NA)","c(NA, NA, NA, NA, NA, NA, NA, NA)",https://twitter.com/TameImpalaBot/status/1454359971429289992,Tame Impala Bot,"California, USA",A bot programmed to tweet randomized Tame Impala (@TameImpala) lyrics.,NA,FALSE,5483,3,12,11429,0,1470200542,FALSE,NA,NA,NA,https://pbs.twimg.com/profile_banners/760702323626827780/1470270443,http://abs.twimg.com/images/themes/theme1/bg.png,http://pbs.twimg.com/profile_images/760994439108055041/bcEFoqgH_normal.jpg
